"['﻿client_id', 'path', 'sentence', 'up_votes', 'down_votes', 'age', 'gender', 'accents', 'locale', 'segment']"0556918792c0a32f83c9d55abc07c607aa28d5e811ac231b6d57c67aab4dc15f6352290903cc79962a3b210b6538b5c13231ab4e94722205da80e4ed57558be0,common_voice_en_18893955.mp3,The Drake Stone punctuates the hills surrounding Harbottle.,2,0,fifties,male,New Zealand English,en,
0556918792c0a32f83c9d55abc07c607aa28d5e811ac231b6d57c67aab4dc15f6352290903cc79962a3b210b6538b5c13231ab4e94722205da80e4ed57558be0,common_voice_en_18893959.mp3,"Objecting to cold-blooded murder, Elsa draws a pistol.",2,0,fifties,male,New Zealand English,en,
0556918792c0a32f83c9d55abc07c607aa28d5e811ac231b6d57c67aab4dc15f6352290903cc79962a3b210b6538b5c13231ab4e94722205da80e4ed57558be0,common_voice_en_18893963.mp3,"This is a list of Jesuit scientists, who contributed somehow to science.",2,0,fifties,male,New Zealand English,en,
0556918792c0a32f83c9d55abc07c607aa28d5e811ac231b6d57c67aab4dc15f6352290903cc79962a3b210b6538b5c13231ab4e94722205da80e4ed57558be0,common_voice_en_18893967.mp3,Clasp brakes are one type of brakes historically used on trains.,2,0,fifties,male,New Zealand English,en,
0556918792c0a32f83c9d55abc07c607aa28d5e811ac231b6d57c67aab4dc15f6352290903cc79962a3b210b6538b5c13231ab4e94722205da80e4ed57558be0,common_voice_en_18893971.mp3,The album was praised by Kerrang!,2,0,fifties,male,New Zealand English,en,
0556918792c0a32f83c9d55abc07c607aa28d5e811ac231b6d57c67aab4dc15f6352290903cc79962a3b210b6538b5c13231ab4e94722205da80e4ed57558be0,common_voice_en_18893976.mp3,A toilet block formerly provided has been demolished.,2,0,fifties,male,New Zealand English,en,
0556918792c0a32f83c9d55abc07c607aa28d5e811ac231b6d57c67aab4dc15f6352290903cc79962a3b210b6538b5c13231ab4e94722205da80e4ed57558be0,common_voice_en_18893980.mp3,The club hope to build new changing facilities.,3,0,fifties,male,New Zealand English,en,
0556918792c0a32f83c9d55abc07c607aa28d5e811ac231b6d57c67aab4dc15f6352290903cc79962a3b210b6538b5c13231ab4e94722205da80e4ed57558be0,common_voice_en_18893994.mp3,"Part Deux, featuring a blue animal drumming through instead of the pink bunny.",2,0,fifties,male,New Zealand English,en,
0556918792c0a32f83c9d55abc07c607aa28d5e811ac231b6d57c67aab4dc15f6352290903cc79962a3b210b6538b5c13231ab4e94722205da80e4ed57558be0,common_voice_en_18896498.mp3,"Speed is crucial in this manga, unlike in Blame!",2,0,fifties,male,New Zealand English,en,
0556918792c0a32f83c9d55abc07c607aa28d5e811ac231b6d57c67aab4dc15f6352290903cc79962a3b210b6538b5c13231ab4e94722205da80e4ed57558be0,common_voice_en_18896502.mp3,"After the War of Independence, Haraden's health deteriorated steadily.",2,0,fifties,male,New Zealand English,en,
0556918792c0a32f83c9d55abc07c607aa28d5e811ac231b6d57c67aab4dc15f6352290903cc79962a3b210b6538b5c13231ab4e94722205da80e4ed57558be0,common_voice_en_18896541.mp3,"An archaeological museum, it contains the Islamic Art Museum of Marrakech.",2,0,fifties,male,New Zealand English,en,
0556918792c0a32f83c9d55abc07c607aa28d5e811ac231b6d57c67aab4dc15f6352290903cc79962a3b210b6538b5c13231ab4e94722205da80e4ed57558be0,common_voice_en_18900721.mp3,The division's largest urban community is the Town of Hinton.,2,0,fifties,male,New Zealand English,en,
0556918792c0a32f83c9d55abc07c607aa28d5e811ac231b6d57c67aab4dc15f6352290903cc79962a3b210b6538b5c13231ab4e94722205da80e4ed57558be0,common_voice_en_18900782.mp3,Only his soldiers never wavered in their devotion.,2,0,fifties,male,New Zealand English,en,
0556918792c0a32f83c9d55abc07c607aa28d5e811ac231b6d57c67aab4dc15f6352290903cc79962a3b210b6538b5c13231ab4e94722205da80e4ed57558be0,common_voice_en_18900789.mp3,This time there was no doubt about Albertsen being the scorer.,2,0,fifties,male,New Zealand English,en,
0556918792c0a32f83c9d55abc07c607aa28d5e811ac231b6d57c67aab4dc15f6352290903cc79962a3b210b6538b5c13231ab4e94722205da80e4ed57558be0,common_voice_en_18900793.mp3,None of this work was signed and most of it remains unattributed.,2,0,fifties,male,New Zealand English,en,
0556918792c0a32f83c9d55abc07c607aa28d5e811ac231b6d57c67aab4dc15f6352290903cc79962a3b210b6538b5c13231ab4e94722205da80e4ed57558be0,common_voice_en_18906287.mp3,"After graduation, he returned home to Arizona, where he began his law practice.",2,0,fifties,male,New Zealand English,en,
0556918792c0a32f83c9d55abc07c607aa28d5e811ac231b6d57c67aab4dc15f6352290903cc79962a3b210b6538b5c13231ab4e94722205da80e4ed57558be0,common_voice_en_18906342.mp3,His great-grandson Andrei Ivanovitch is a successful international classical pianist.,2,0,fifties,male,New Zealand English,en,
0556918792c0a32f83c9d55abc07c607aa28d5e811ac231b6d57c67aab4dc15f6352290903cc79962a3b210b6538b5c13231ab4e94722205da80e4ed57558be0,common_voice_en_18906396.mp3,Krosnoff died instantly of the injuries sustained from hitting the lamp post.,2,0,fifties,male,New Zealand English,en,
0556918792c0a32f83c9d55abc07c607aa28d5e811ac231b6d57c67aab4dc15f6352290903cc79962a3b210b6538b5c13231ab4e94722205da80e4ed57558be0,common_voice_en_18909318.mp3,Crouse is now married to Rick Blue.,2,0,fifties,male,New Zealand English,en,
0556918792c0a32f83c9d55abc07c607aa28d5e811ac231b6d57c67aab4dc15f6352290903cc79962a3b210b6538b5c13231ab4e94722205da80e4ed57558be0,common_voice_en_18909322.mp3,Dolby developed a digital surround sound compression scheme for the cinema.,2,0,fifties,male,New Zealand English,en,
0556918792c0a32f83c9d55abc07c607aa28d5e811ac231b6d57c67aab4dc15f6352290903cc79962a3b210b6538b5c13231ab4e94722205da80e4ed57558be0,common_voice_en_18909326.mp3,This third form is rarely seen outside of this context.,2,0,fifties,male,New Zealand English,en,
0556918792c0a32f83c9d55abc07c607aa28d5e811ac231b6d57c67aab4dc15f6352290903cc79962a3b210b6538b5c13231ab4e94722205da80e4ed57558be0,common_voice_en_18909330.mp3,Four Thai taekwondo jin qualified for the following events.,2,0,fifties,male,New Zealand English,en,
0556918792c0a32f83c9d55abc07c607aa28d5e811ac231b6d57c67aab4dc15f6352290903cc79962a3b210b6538b5c13231ab4e94722205da80e4ed57558be0,common_voice_en_18909334.mp3,Nilsen was assigned to surveil allied military activity in northern Norway.,2,0,fifties,male,New Zealand English,en,
0556918792c0a32f83c9d55abc07c607aa28d5e811ac231b6d57c67aab4dc15f6352290903cc79962a3b210b6538b5c13231ab4e94722205da80e4ed57558be0,common_voice_en_18909338.mp3,"Once primarily used as a military housing community, it is now privately operated.",2,0,fifties,male,New Zealand English,en,
0556918792c0a32f83c9d55abc07c607aa28d5e811ac231b6d57c67aab4dc15f6352290903cc79962a3b210b6538b5c13231ab4e94722205da80e4ed57558be0,common_voice_en_18909342.mp3,The meaning of his statement is still uncertain.,2,0,fifties,male,New Zealand English,en,
0556918792c0a32f83c9d55abc07c607aa28d5e811ac231b6d57c67aab4dc15f6352290903cc79962a3b210b6538b5c13231ab4e94722205da80e4ed57558be0,common_voice_en_18909346.mp3,"It is located to the north of Newbury, near the village of Donnington.",2,0,fifties,male,New Zealand English,en,
0556918792c0a32f83c9d55abc07c607aa28d5e811ac231b6d57c67aab4dc15f6352290903cc79962a3b210b6538b5c13231ab4e94722205da80e4ed57558be0,common_voice_en_18909350.mp3,"Her most well-known illustrations are of Michael Bond's character, Paddington Bear.",2,0,fifties,male,New Zealand English,en,
0556918792c0a32f83c9d55abc07c607aa28d5e811ac231b6d57c67aab4dc15f6352290903cc79962a3b210b6538b5c13231ab4e94722205da80e4ed57558be0,common_voice_en_18909354.mp3,"David's widow, Nancy, and their sons, moved to Los Angeles.",2,0,fifties,male,New Zealand English,en,
0556918792c0a32f83c9d55abc07c607aa28d5e811ac231b6d57c67aab4dc15f6352290903cc79962a3b210b6538b5c13231ab4e94722205da80e4ed57558be0,common_voice_en_18909358.mp3,This list does not include the head coaches of the New Jersey Devils.,2,0,fifties,male,New Zealand English,en,
0556918792c0a32f83c9d55abc07c607aa28d5e811ac231b6d57c67aab4dc15f6352290903cc79962a3b210b6538b5c13231ab4e94722205da80e4ed57558be0,common_voice_en_18909367.mp3,Haworth Band is one of the oldest secular musical organisations in the Keighley area.,2,0,fifties,male,New Zealand English,en,
0556918792c0a32f83c9d55abc07c607aa28d5e811ac231b6d57c67aab4dc15f6352290903cc79962a3b210b6538b5c13231ab4e94722205da80e4ed57558be0,common_voice_en_18909371.mp3,"Uther's mind is plagued by madness and lust, and Britain is in civil war.",2,1,fifties,male,New Zealand English,en,
0556918792c0a32f83c9d55abc07c607aa28d5e811ac231b6d57c67aab4dc15f6352290903cc79962a3b210b6538b5c13231ab4e94722205da80e4ed57558be0,common_voice_en_18909375.mp3,"""The Washington Post"" called him ""the best kept secret in contemporary horror fiction.",2,0,fifties,male,New Zealand English,en,
0556918792c0a32f83c9d55abc07c607aa28d5e811ac231b6d57c67aab4dc15f6352290903cc79962a3b210b6538b5c13231ab4e94722205da80e4ed57558be0,common_voice_en_18935230.mp3,The use of computers facilitates greatly the solution of fiber simulation problems.,2,0,fifties,male,New Zealand English,en,
0556918792c0a32f83c9d55abc07c607aa28d5e811ac231b6d57c67aab4dc15f6352290903cc79962a3b210b6538b5c13231ab4e94722205da80e4ed57558be0,common_voice_en_18935244.mp3,Some lasted several years and appeared in subsequent series.,2,0,fifties,male,New Zealand English,en,
0556918792c0a32f83c9d55abc07c607aa28d5e811ac231b6d57c67aab4dc15f6352290903cc79962a3b210b6538b5c13231ab4e94722205da80e4ed57558be0,common_voice_en_18935269.mp3,"He is seen standing at the bus stop with Lisa, but does not speak.",2,0,fifties,male,New Zealand English,en,
0556918792c0a32f83c9d55abc07c607aa28d5e811ac231b6d57c67aab4dc15f6352290903cc79962a3b210b6538b5c13231ab4e94722205da80e4ed57558be0,common_voice_en_18935302.mp3,It digs tunnels but also uses tunnels created by other small mammals.,2,0,fifties,male,New Zealand English,en,
0556918792c0a32f83c9d55abc07c607aa28d5e811ac231b6d57c67aab4dc15f6352290903cc79962a3b210b6538b5c13231ab4e94722205da80e4ed57558be0,common_voice_en_18935306.mp3,"At the same time, he applied himself with success to mathematics.",2,0,fifties,male,New Zealand English,en,
0556918792c0a32f83c9d55abc07c607aa28d5e811ac231b6d57c67aab4dc15f6352290903cc79962a3b210b6538b5c13231ab4e94722205da80e4ed57558be0,common_voice_en_18935340.mp3,"""When It Hurts So Bad"" is musically old roots reggae mixed with soul.",2,0,fifties,male,New Zealand English,en,
0556918792c0a32f83c9d55abc07c607aa28d5e811ac231b6d57c67aab4dc15f6352290903cc79962a3b210b6538b5c13231ab4e94722205da80e4ed57558be0,common_voice_en_18935389.mp3,Only younger kids camps are held at the site.,2,0,fifties,male,New Zealand English,en,
0556918792c0a32f83c9d55abc07c607aa28d5e811ac231b6d57c67aab4dc15f6352290903cc79962a3b210b6538b5c13231ab4e94722205da80e4ed57558be0,common_voice_en_18935403.mp3,A clay-court specialist is a tennis player who excels on clay courts.,2,0,fifties,male,New Zealand English,en,
0556918792c0a32f83c9d55abc07c607aa28d5e811ac231b6d57c67aab4dc15f6352290903cc79962a3b210b6538b5c13231ab4e94722205da80e4ed57558be0,common_voice_en_18946861.mp3,See Sons of Odin.,2,0,fifties,male,New Zealand English,en,
0556918792c0a32f83c9d55abc07c607aa28d5e811ac231b6d57c67aab4dc15f6352290903cc79962a3b210b6538b5c13231ab4e94722205da80e4ed57558be0,common_voice_en_18946870.mp3,Sheffield and Pittsburgh are considered sister cities.,2,0,fifties,male,New Zealand English,en,
0556918792c0a32f83c9d55abc07c607aa28d5e811ac231b6d57c67aab4dc15f6352290903cc79962a3b210b6538b5c13231ab4e94722205da80e4ed57558be0,common_voice_en_18963316.mp3,He liked their company and he visited church and started reading the Bible.,2,0,fifties,male,New Zealand English,en,
0556918792c0a32f83c9d55abc07c607aa28d5e811ac231b6d57c67aab4dc15f6352290903cc79962a3b210b6538b5c13231ab4e94722205da80e4ed57558be0,common_voice_en_18963320.mp3,The various shades result from different concentrations of halochromic molecules with different conjugated systems.,2,0,fifties,male,New Zealand English,en,
0556918792c0a32f83c9d55abc07c607aa28d5e811ac231b6d57c67aab4dc15f6352290903cc79962a3b210b6538b5c13231ab4e94722205da80e4ed57558be0,common_voice_en_18963324.mp3,There are several trips daily.,2,0,fifties,male,New Zealand English,en,
0556918792c0a32f83c9d55abc07c607aa28d5e811ac231b6d57c67aab4dc15f6352290903cc79962a3b210b6538b5c13231ab4e94722205da80e4ed57558be0,common_voice_en_18963328.mp3,This element involves two main steps.,2,0,fifties,male,New Zealand English,en,
0556918792c0a32f83c9d55abc07c607aa28d5e811ac231b6d57c67aab4dc15f6352290903cc79962a3b210b6538b5c13231ab4e94722205da80e4ed57558be0,common_voice_en_18967247.mp3,Kenya recorded an easy nine-wicket win over Gibraltar.,2,0,fifties,male,New Zealand English,en,
0556918792c0a32f83c9d55abc07c607aa28d5e811ac231b6d57c67aab4dc15f6352290903cc79962a3b210b6538b5c13231ab4e94722205da80e4ed57558be0,common_voice_en_18967251.mp3,Roberts took pride in coming from a long line of railroaders.,2,0,fifties,male,New Zealand English,en,
0556918792c0a32f83c9d55abc07c607aa28d5e811ac231b6d57c67aab4dc15f6352290903cc79962a3b210b6538b5c13231ab4e94722205da80e4ed57558be0,common_voice_en_18967255.mp3,It would remain in royal control for several centuries.,2,0,fifties,male,New Zealand English,en,
0556918792c0a32f83c9d55abc07c607aa28d5e811ac231b6d57c67aab4dc15f6352290903cc79962a3b210b6538b5c13231ab4e94722205da80e4ed57558be0,common_voice_en_18967259.mp3,"He speaks English, French, and Arabic fluently.",2,0,fifties,male,New Zealand English,en,
0556918792c0a32f83c9d55abc07c607aa28d5e811ac231b6d57c67aab4dc15f6352290903cc79962a3b210b6538b5c13231ab4e94722205da80e4ed57558be0,common_voice_en_18967263.mp3,"OpenT, a project to develop a compiler for Turing, is no longer in development.",2,0,fifties,male,New Zealand English,en,
0556918792c0a32f83c9d55abc07c607aa28d5e811ac231b6d57c67aab4dc15f6352290903cc79962a3b210b6538b5c13231ab4e94722205da80e4ed57558be0,common_voice_en_18967268.mp3,The two roles have since been recast due to scheduling conflicts for both actors.,2,0,fifties,male,New Zealand English,en,
0556918792c0a32f83c9d55abc07c607aa28d5e811ac231b6d57c67aab4dc15f6352290903cc79962a3b210b6538b5c13231ab4e94722205da80e4ed57558be0,common_voice_en_18967287.mp3,"Again, the plans were dimensioned in feet and inches.",2,0,fifties,male,New Zealand English,en,
0556918792c0a32f83c9d55abc07c607aa28d5e811ac231b6d57c67aab4dc15f6352290903cc79962a3b210b6538b5c13231ab4e94722205da80e4ed57558be0,common_voice_en_18967302.mp3,The county is one of the first Texas Certified Retirement Communities.,2,0,fifties,male,New Zealand English,en,
0556918792c0a32f83c9d55abc07c607aa28d5e811ac231b6d57c67aab4dc15f6352290903cc79962a3b210b6538b5c13231ab4e94722205da80e4ed57558be0,common_voice_en_18967317.mp3,"The towers face east, and the front central tower is the tallest.",2,0,fifties,male,New Zealand English,en,
0556918792c0a32f83c9d55abc07c607aa28d5e811ac231b6d57c67aab4dc15f6352290903cc79962a3b210b6538b5c13231ab4e94722205da80e4ed57558be0,common_voice_en_18967321.mp3,"National Bank's business is concentrated in Quebec, and it is expanding on other provinces.",2,0,fifties,male,New Zealand English,en,
0556918792c0a32f83c9d55abc07c607aa28d5e811ac231b6d57c67aab4dc15f6352290903cc79962a3b210b6538b5c13231ab4e94722205da80e4ed57558be0,common_voice_en_18985404.mp3,Then it could start making the weapons - secretly or maybe even publicly.,2,0,fifties,male,New Zealand English,en,
0556918792c0a32f83c9d55abc07c607aa28d5e811ac231b6d57c67aab4dc15f6352290903cc79962a3b210b6538b5c13231ab4e94722205da80e4ed57558be0,common_voice_en_18985408.mp3,Covian was extremely active as a scientific leader.,2,0,fifties,male,New Zealand English,en,
0556918792c0a32f83c9d55abc07c607aa28d5e811ac231b6d57c67aab4dc15f6352290903cc79962a3b210b6538b5c13231ab4e94722205da80e4ed57558be0,common_voice_en_18985413.mp3,He has published several books.,2,0,fifties,male,New Zealand English,en,
0556918792c0a32f83c9d55abc07c607aa28d5e811ac231b6d57c67aab4dc15f6352290903cc79962a3b210b6538b5c13231ab4e94722205da80e4ed57558be0,common_voice_en_18985422.mp3,All tracks written by G. Love except as noted.,2,0,fifties,male,New Zealand English,en,
0556918792c0a32f83c9d55abc07c607aa28d5e811ac231b6d57c67aab4dc15f6352290903cc79962a3b210b6538b5c13231ab4e94722205da80e4ed57558be0,common_voice_en_18985431.mp3,It discusses each member of the household of the Prophet.,2,0,fifties,male,New Zealand English,en,
0556918792c0a32f83c9d55abc07c607aa28d5e811ac231b6d57c67aab4dc15f6352290903cc79962a3b210b6538b5c13231ab4e94722205da80e4ed57558be0,common_voice_en_18985435.mp3,The police department later resigned as well along with the mayor.,2,0,fifties,male,New Zealand English,en,
0556918792c0a32f83c9d55abc07c607aa28d5e811ac231b6d57c67aab4dc15f6352290903cc79962a3b210b6538b5c13231ab4e94722205da80e4ed57558be0,common_voice_en_18985449.mp3,"Hancock was born in the Bronx, New York City and raised in Westchester.",2,0,fifties,male,New Zealand English,en,
0556918792c0a32f83c9d55abc07c607aa28d5e811ac231b6d57c67aab4dc15f6352290903cc79962a3b210b6538b5c13231ab4e94722205da80e4ed57558be0,common_voice_en_18985460.mp3,The president of Serbia and Montenegro was elected by the parliament.,2,0,fifties,male,New Zealand English,en,
0556918792c0a32f83c9d55abc07c607aa28d5e811ac231b6d57c67aab4dc15f6352290903cc79962a3b210b6538b5c13231ab4e94722205da80e4ed57558be0,common_voice_en_18985470.mp3,Tommy Byrne the base runner at first.,2,0,fifties,male,New Zealand English,en,
0556918792c0a32f83c9d55abc07c607aa28d5e811ac231b6d57c67aab4dc15f6352290903cc79962a3b210b6538b5c13231ab4e94722205da80e4ed57558be0,common_voice_en_18985494.mp3,Prospect's population is growing and reflective of a broader demographic.,2,0,fifties,male,New Zealand English,en,
0556918792c0a32f83c9d55abc07c607aa28d5e811ac231b6d57c67aab4dc15f6352290903cc79962a3b210b6538b5c13231ab4e94722205da80e4ed57558be0,common_voice_en_18985498.mp3,He was only the second scientist to hold the Principalship.,2,0,fifties,male,New Zealand English,en,
0556918792c0a32f83c9d55abc07c607aa28d5e811ac231b6d57c67aab4dc15f6352290903cc79962a3b210b6538b5c13231ab4e94722205da80e4ed57558be0,common_voice_en_18985522.mp3,"Thus, any exciting frequency lower than the cutoff frequency will attenuate, rather than propagate.",2,0,fifties,male,New Zealand English,en,
0556918792c0a32f83c9d55abc07c607aa28d5e811ac231b6d57c67aab4dc15f6352290903cc79962a3b210b6538b5c13231ab4e94722205da80e4ed57558be0,common_voice_en_18985541.mp3,"With Alexander term-limited, Republicans nominated former Governor Winfield Dunn.",2,0,fifties,male,New Zealand English,en,
0556918792c0a32f83c9d55abc07c607aa28d5e811ac231b6d57c67aab4dc15f6352290903cc79962a3b210b6538b5c13231ab4e94722205da80e4ed57558be0,common_voice_en_18985545.mp3,Frances succeeded him and became the sixth holder of the title.,2,0,fifties,male,New Zealand English,en,
0556918792c0a32f83c9d55abc07c607aa28d5e811ac231b6d57c67aab4dc15f6352290903cc79962a3b210b6538b5c13231ab4e94722205da80e4ed57558be0,common_voice_en_18985554.mp3,Men and women are equally likely to use benzodiazepines recreationally.,2,0,fifties,male,New Zealand English,en,
0556918792c0a32f83c9d55abc07c607aa28d5e811ac231b6d57c67aab4dc15f6352290903cc79962a3b210b6538b5c13231ab4e94722205da80e4ed57558be0,common_voice_en_18985558.mp3,Technological advancements have brought graphic design and digital displays to the forefront.,2,0,fifties,male,New Zealand English,en,
0556918792c0a32f83c9d55abc07c607aa28d5e811ac231b6d57c67aab4dc15f6352290903cc79962a3b210b6538b5c13231ab4e94722205da80e4ed57558be0,common_voice_en_19005144.mp3,China has become Vietnam's second-largest trading partner and the largest source of imports.,2,0,fifties,male,New Zealand English,en,
0556918792c0a32f83c9d55abc07c607aa28d5e811ac231b6d57c67aab4dc15f6352290903cc79962a3b210b6538b5c13231ab4e94722205da80e4ed57558be0,common_voice_en_19005148.mp3,"After the closure of this weather station, the nearest one is located at Pershore.",2,0,fifties,male,New Zealand English,en,
0556918792c0a32f83c9d55abc07c607aa28d5e811ac231b6d57c67aab4dc15f6352290903cc79962a3b210b6538b5c13231ab4e94722205da80e4ed57558be0,common_voice_en_19005152.mp3,The West was unable to break the Soviet encryption at this time.,2,0,fifties,male,New Zealand English,en,
0556918792c0a32f83c9d55abc07c607aa28d5e811ac231b6d57c67aab4dc15f6352290903cc79962a3b210b6538b5c13231ab4e94722205da80e4ed57558be0,common_voice_en_19005156.mp3,The tracks are now used by Montana Rail Link.,2,0,fifties,male,New Zealand English,en,
0556918792c0a32f83c9d55abc07c607aa28d5e811ac231b6d57c67aab4dc15f6352290903cc79962a3b210b6538b5c13231ab4e94722205da80e4ed57558be0,common_voice_en_19005160.mp3,"Recently, the suitability as non-covalent bond strength descriptors was demonstrated too.",2,0,fifties,male,New Zealand English,en,
0556918792c0a32f83c9d55abc07c607aa28d5e811ac231b6d57c67aab4dc15f6352290903cc79962a3b210b6538b5c13231ab4e94722205da80e4ed57558be0,common_voice_en_19034517.mp3,"Gyro controlled with a relatively simple control system, they proved very effective in use.",2,0,fifties,male,New Zealand English,en,
0556918792c0a32f83c9d55abc07c607aa28d5e811ac231b6d57c67aab4dc15f6352290903cc79962a3b210b6538b5c13231ab4e94722205da80e4ed57558be0,common_voice_en_19034547.mp3,Mastermind were musically very different from Journey.,2,0,fifties,male,New Zealand English,en,
0556918792c0a32f83c9d55abc07c607aa28d5e811ac231b6d57c67aab4dc15f6352290903cc79962a3b210b6538b5c13231ab4e94722205da80e4ed57558be0,common_voice_en_25345712.mp3,"The torpedo was of a straight-running unguided design, controlled by a gyroscope.",2,0,fifties,male,New Zealand English,en,
0556918792c0a32f83c9d55abc07c607aa28d5e811ac231b6d57c67aab4dc15f6352290903cc79962a3b210b6538b5c13231ab4e94722205da80e4ed57558be0,common_voice_en_25345789.mp3,"While appearing in a one-man play, he met his ex-wife.",2,1,fifties,male,New Zealand English,en,
0556918792c0a32f83c9d55abc07c607aa28d5e811ac231b6d57c67aab4dc15f6352290903cc79962a3b210b6538b5c13231ab4e94722205da80e4ed57558be0,common_voice_en_25345793.mp3,This usually recalls the historical ownership of lands or manors by the Crown.,2,0,fifties,male,New Zealand English,en,
6934ea90f68dd79d019e2960360dbbf4b7a82acd27c8d6501839402a4db19a60fe1f105bca4c2fcde170b0ce44091fd29c41f656035954b9a936d81b3cfeb254,common_voice_en_19547297.mp3,They bribe the postman and manage to get hold of that letter.,2,0,thirties,male,New Zealand English,en,
6934ea90f68dd79d019e2960360dbbf4b7a82acd27c8d6501839402a4db19a60fe1f105bca4c2fcde170b0ce44091fd29c41f656035954b9a936d81b3cfeb254,common_voice_en_19547366.mp3,The band also performed on the rock evening of the Intertalent Festival in Prague.,2,0,thirties,male,New Zealand English,en,
6934ea90f68dd79d019e2960360dbbf4b7a82acd27c8d6501839402a4db19a60fe1f105bca4c2fcde170b0ce44091fd29c41f656035954b9a936d81b3cfeb254,common_voice_en_19547370.mp3,"Bus, train, taxi and parking services are provided.",2,0,thirties,male,New Zealand English,en,
6934ea90f68dd79d019e2960360dbbf4b7a82acd27c8d6501839402a4db19a60fe1f105bca4c2fcde170b0ce44091fd29c41f656035954b9a936d81b3cfeb254,common_voice_en_19547374.mp3,Cod fish are of course not found in fresh water.,2,0,thirties,male,New Zealand English,en,
6934ea90f68dd79d019e2960360dbbf4b7a82acd27c8d6501839402a4db19a60fe1f105bca4c2fcde170b0ce44091fd29c41f656035954b9a936d81b3cfeb254,common_voice_en_19547378.mp3,"McQuinn was born in Arlington, Virginia and attended Washington-Lee High School.",2,0,thirties,male,New Zealand English,en,
6934ea90f68dd79d019e2960360dbbf4b7a82acd27c8d6501839402a4db19a60fe1f105bca4c2fcde170b0ce44091fd29c41f656035954b9a936d81b3cfeb254,common_voice_en_19547382.mp3,Games between top players are rarely decided by more than a couple of moves.,2,0,thirties,male,New Zealand English,en,
6934ea90f68dd79d019e2960360dbbf4b7a82acd27c8d6501839402a4db19a60fe1f105bca4c2fcde170b0ce44091fd29c41f656035954b9a936d81b3cfeb254,common_voice_en_19547386.mp3,They left no children.,2,0,thirties,male,New Zealand English,en,
6934ea90f68dd79d019e2960360dbbf4b7a82acd27c8d6501839402a4db19a60fe1f105bca4c2fcde170b0ce44091fd29c41f656035954b9a936d81b3cfeb254,common_voice_en_19547390.mp3,"The songs are mostly pastoral, with subtle understated instrumental accompaniment.",2,0,thirties,male,New Zealand English,en,
6934ea90f68dd79d019e2960360dbbf4b7a82acd27c8d6501839402a4db19a60fe1f105bca4c2fcde170b0ce44091fd29c41f656035954b9a936d81b3cfeb254,common_voice_en_19547394.mp3,Markazi lies in western Iran.,2,1,thirties,male,New Zealand English,en,
6934ea90f68dd79d019e2960360dbbf4b7a82acd27c8d6501839402a4db19a60fe1f105bca4c2fcde170b0ce44091fd29c41f656035954b9a936d81b3cfeb254,common_voice_en_19547398.mp3,"Her work gained her the accolade of being ""the greatest contemporary transcendent poet"".",2,0,thirties,male,New Zealand English,en,
6934ea90f68dd79d019e2960360dbbf4b7a82acd27c8d6501839402a4db19a60fe1f105bca4c2fcde170b0ce44091fd29c41f656035954b9a936d81b3cfeb254,common_voice_en_19547402.mp3,"By skillful maneuvering, the Austrians chased The Infant from Milan to Pavia.",2,0,thirties,male,New Zealand English,en,
6934ea90f68dd79d019e2960360dbbf4b7a82acd27c8d6501839402a4db19a60fe1f105bca4c2fcde170b0ce44091fd29c41f656035954b9a936d81b3cfeb254,common_voice_en_19547406.mp3,Yes; I went to Agathaâ€™s to tea.,2,0,thirties,male,New Zealand English,en,
6934ea90f68dd79d019e2960360dbbf4b7a82acd27c8d6501839402a4db19a60fe1f105bca4c2fcde170b0ce44091fd29c41f656035954b9a936d81b3cfeb254,common_voice_en_19547411.mp3,There were Civilian settlements adjacent along the south and the east.,2,1,thirties,male,New Zealand English,en,
6934ea90f68dd79d019e2960360dbbf4b7a82acd27c8d6501839402a4db19a60fe1f105bca4c2fcde170b0ce44091fd29c41f656035954b9a936d81b3cfeb254,common_voice_en_19547421.mp3,It obtained federal and city landmark status in that same year.,2,1,thirties,male,New Zealand English,en,
