"['﻿client_id', 'path', 'sentence', 'up_votes', 'down_votes', 'age', 'gender', 'accents', 'locale', 'segment']"5c531f367556f798684195ad08d333c891d20416e1b14c5c8f5946ac800350502f1378b271744d4f028bfa57e9fc2dedfa5de163d4bd2575fb60aa8f461d8098,common_voice_en_20168064.mp3,Operation Sassoon would see railway stations outside the capital receiving Londoners escaping a disaster.,2,0,thirties,male,New Zealand English,en,
5c531f367556f798684195ad08d333c891d20416e1b14c5c8f5946ac800350502f1378b271744d4f028bfa57e9fc2dedfa5de163d4bd2575fb60aa8f461d8098,common_voice_en_20168121.mp3,Intamin was responsible for the design and building of the Moscow Monorail System.,2,0,thirties,male,New Zealand English,en,
5c531f367556f798684195ad08d333c891d20416e1b14c5c8f5946ac800350502f1378b271744d4f028bfa57e9fc2dedfa5de163d4bd2575fb60aa8f461d8098,common_voice_en_20168221.mp3,"Khemri was originally called Nehekhara, of which Khemri was a major city.",2,0,thirties,male,New Zealand English,en,
5c531f367556f798684195ad08d333c891d20416e1b14c5c8f5946ac800350502f1378b271744d4f028bfa57e9fc2dedfa5de163d4bd2575fb60aa8f461d8098,common_voice_en_20168245.mp3,"""People's Instinctive Travels"" was about celebrating you, whoever you are"".",2,1,thirties,male,New Zealand English,en,
5c531f367556f798684195ad08d333c891d20416e1b14c5c8f5946ac800350502f1378b271744d4f028bfa57e9fc2dedfa5de163d4bd2575fb60aa8f461d8098,common_voice_en_20168260.mp3,The name can be extended to puzzles that use non-alphabetic symbols instead of letters.,2,0,thirties,male,New Zealand English,en,
5c531f367556f798684195ad08d333c891d20416e1b14c5c8f5946ac800350502f1378b271744d4f028bfa57e9fc2dedfa5de163d4bd2575fb60aa8f461d8098,common_voice_en_20168269.mp3,These are my people and that's how it is.,2,0,thirties,male,New Zealand English,en,
5c531f367556f798684195ad08d333c891d20416e1b14c5c8f5946ac800350502f1378b271744d4f028bfa57e9fc2dedfa5de163d4bd2575fb60aa8f461d8098,common_voice_en_21493938.mp3,Use cases can be viewed on the TenAsys website.,2,0,thirties,male,New Zealand English,en,
5c531f367556f798684195ad08d333c891d20416e1b14c5c8f5946ac800350502f1378b271744d4f028bfa57e9fc2dedfa5de163d4bd2575fb60aa8f461d8098,common_voice_en_21493942.mp3,Food can be stored in the backpack until it is needed.,2,0,thirties,male,New Zealand English,en,
5c531f367556f798684195ad08d333c891d20416e1b14c5c8f5946ac800350502f1378b271744d4f028bfa57e9fc2dedfa5de163d4bd2575fb60aa8f461d8098,common_voice_en_21493946.mp3,Counter-recruitment is an attempt to prevent military recruiters from enlisting civilians into the military.,2,0,thirties,male,New Zealand English,en,
5c531f367556f798684195ad08d333c891d20416e1b14c5c8f5946ac800350502f1378b271744d4f028bfa57e9fc2dedfa5de163d4bd2575fb60aa8f461d8098,common_voice_en_21493957.mp3,His German international scoring record stands at roughly a goal every three games.,2,0,thirties,male,New Zealand English,en,
5c531f367556f798684195ad08d333c891d20416e1b14c5c8f5946ac800350502f1378b271744d4f028bfa57e9fc2dedfa5de163d4bd2575fb60aa8f461d8098,common_voice_en_21493961.mp3,This force hurried to the assistance of the city's defenders.,2,0,thirties,male,New Zealand English,en,
5c531f367556f798684195ad08d333c891d20416e1b14c5c8f5946ac800350502f1378b271744d4f028bfa57e9fc2dedfa5de163d4bd2575fb60aa8f461d8098,common_voice_en_21493967.mp3,"The township is east of Ebensburg, the Cambria County seat, and southwest of Altoona.",2,0,thirties,male,New Zealand English,en,
5c531f367556f798684195ad08d333c891d20416e1b14c5c8f5946ac800350502f1378b271744d4f028bfa57e9fc2dedfa5de163d4bd2575fb60aa8f461d8098,common_voice_en_21493981.mp3,Sheep are the most vulnerable.,2,0,thirties,male,New Zealand English,en,
5c531f367556f798684195ad08d333c891d20416e1b14c5c8f5946ac800350502f1378b271744d4f028bfa57e9fc2dedfa5de163d4bd2575fb60aa8f461d8098,common_voice_en_21493985.mp3,"Following the season, Otto announced his retirement.",2,0,thirties,male,New Zealand English,en,
5c531f367556f798684195ad08d333c891d20416e1b14c5c8f5946ac800350502f1378b271744d4f028bfa57e9fc2dedfa5de163d4bd2575fb60aa8f461d8098,common_voice_en_21493989.mp3,"Lorne starts singing ""You Are My Sunshine"" to Fred, who picks up the song.",2,0,thirties,male,New Zealand English,en,
5c531f367556f798684195ad08d333c891d20416e1b14c5c8f5946ac800350502f1378b271744d4f028bfa57e9fc2dedfa5de163d4bd2575fb60aa8f461d8098,common_voice_en_21493994.mp3,"A comparable number of families also moved to Australia, Canada, and the United States.",2,0,thirties,male,New Zealand English,en,
5c531f367556f798684195ad08d333c891d20416e1b14c5c8f5946ac800350502f1378b271744d4f028bfa57e9fc2dedfa5de163d4bd2575fb60aa8f461d8098,common_voice_en_21494019.mp3,While she was the world's oldest person Bolden was rarely seen in public.,2,0,thirties,male,New Zealand English,en,
5c531f367556f798684195ad08d333c891d20416e1b14c5c8f5946ac800350502f1378b271744d4f028bfa57e9fc2dedfa5de163d4bd2575fb60aa8f461d8098,common_voice_en_21494048.mp3,Latimer was originally joined with the adjacent village of Chenies.,2,0,thirties,male,New Zealand English,en,
5c531f367556f798684195ad08d333c891d20416e1b14c5c8f5946ac800350502f1378b271744d4f028bfa57e9fc2dedfa5de163d4bd2575fb60aa8f461d8098,common_voice_en_21494087.mp3,"One of Rebecca's forebears was Quaker missionary, Elizabeth Webb.",2,0,thirties,male,New Zealand English,en,
5c531f367556f798684195ad08d333c891d20416e1b14c5c8f5946ac800350502f1378b271744d4f028bfa57e9fc2dedfa5de163d4bd2575fb60aa8f461d8098,common_voice_en_21494106.mp3,On their way back they were stopped by the crowd.,2,0,thirties,male,New Zealand English,en,
5c531f367556f798684195ad08d333c891d20416e1b14c5c8f5946ac800350502f1378b271744d4f028bfa57e9fc2dedfa5de163d4bd2575fb60aa8f461d8098,common_voice_en_21494110.mp3,"He then joined Reading, where he was loaned out to Barnet and Hereford United.",2,0,thirties,male,New Zealand English,en,
5c531f367556f798684195ad08d333c891d20416e1b14c5c8f5946ac800350502f1378b271744d4f028bfa57e9fc2dedfa5de163d4bd2575fb60aa8f461d8098,common_voice_en_21494149.mp3,"Noel was taken as a prisoner to London, where he died shortly afterwards.",2,0,thirties,male,New Zealand English,en,
5c531f367556f798684195ad08d333c891d20416e1b14c5c8f5946ac800350502f1378b271744d4f028bfa57e9fc2dedfa5de163d4bd2575fb60aa8f461d8098,common_voice_en_21494168.mp3,"However, these were not excavated but instead infilled with rubble.",2,0,thirties,male,New Zealand English,en,
5c531f367556f798684195ad08d333c891d20416e1b14c5c8f5946ac800350502f1378b271744d4f028bfa57e9fc2dedfa5de163d4bd2575fb60aa8f461d8098,common_voice_en_21507081.mp3,"Breccia is an Italian word meaning ""gravel"".",2,0,thirties,male,New Zealand English,en,
5c531f367556f798684195ad08d333c891d20416e1b14c5c8f5946ac800350502f1378b271744d4f028bfa57e9fc2dedfa5de163d4bd2575fb60aa8f461d8098,common_voice_en_21507110.mp3,Minoan art encompassed many media.,2,1,thirties,male,New Zealand English,en,
5c531f367556f798684195ad08d333c891d20416e1b14c5c8f5946ac800350502f1378b271744d4f028bfa57e9fc2dedfa5de163d4bd2575fb60aa8f461d8098,common_voice_en_21507114.mp3,"It also can cause undesirable effects such as unattractive discoloration, bubbling, or devitrification.",2,0,thirties,male,New Zealand English,en,
5c531f367556f798684195ad08d333c891d20416e1b14c5c8f5946ac800350502f1378b271744d4f028bfa57e9fc2dedfa5de163d4bd2575fb60aa8f461d8098,common_voice_en_21507165.mp3,She is unmarried and is a Deputy Lieutenant of the County of Renfrewshire.,2,0,thirties,male,New Zealand English,en,
5c531f367556f798684195ad08d333c891d20416e1b14c5c8f5946ac800350502f1378b271744d4f028bfa57e9fc2dedfa5de163d4bd2575fb60aa8f461d8098,common_voice_en_21507169.mp3,"Thou wilt say then unto me, Why doth He yet find fault?",2,0,thirties,male,New Zealand English,en,
5c531f367556f798684195ad08d333c891d20416e1b14c5c8f5946ac800350502f1378b271744d4f028bfa57e9fc2dedfa5de163d4bd2575fb60aa8f461d8098,common_voice_en_21507248.mp3,Theories differ on why the lower level platform was built.,2,0,thirties,male,New Zealand English,en,
5c531f367556f798684195ad08d333c891d20416e1b14c5c8f5946ac800350502f1378b271744d4f028bfa57e9fc2dedfa5de163d4bd2575fb60aa8f461d8098,common_voice_en_29381016.mp3,This all but assured Titus' return to Congress after a two-year absence.,2,0,thirties,male,New Zealand English,en,
3a4228fd1f7614c4550485d454331fc488ff9d71d5c363080e7ef21e1ca55230f787a622c2932fb10d2f56b3e72e0363ded620f44d41021f6a85d8b9ec25b3e7,common_voice_en_22758593.mp3,"He is known for his fluid skateboarding style and inventing the ""Bigspin"" skateboard trick.",2,0,thirties,male,New Zealand English,en,
3a4228fd1f7614c4550485d454331fc488ff9d71d5c363080e7ef21e1ca55230f787a622c2932fb10d2f56b3e72e0363ded620f44d41021f6a85d8b9ec25b3e7,common_voice_en_22758597.mp3,"Oh, to whom shall a song of battle be chanted?",2,0,thirties,male,New Zealand English,en,
3a4228fd1f7614c4550485d454331fc488ff9d71d5c363080e7ef21e1ca55230f787a622c2932fb10d2f56b3e72e0363ded620f44d41021f6a85d8b9ec25b3e7,common_voice_en_22758602.mp3,"Cordero, who was of African ancestry, was self-educated.",2,0,thirties,male,New Zealand English,en,
3a4228fd1f7614c4550485d454331fc488ff9d71d5c363080e7ef21e1ca55230f787a622c2932fb10d2f56b3e72e0363ded620f44d41021f6a85d8b9ec25b3e7,common_voice_en_22758606.mp3,Gupta received Arjuna Award for his contribution to the Indian badminton.,2,0,thirties,male,New Zealand English,en,
3a4228fd1f7614c4550485d454331fc488ff9d71d5c363080e7ef21e1ca55230f787a622c2932fb10d2f56b3e72e0363ded620f44d41021f6a85d8b9ec25b3e7,common_voice_en_22758612.mp3,This behavior is the exact opposite of that exhibited by hooligans.,2,0,thirties,male,New Zealand English,en,
3a4228fd1f7614c4550485d454331fc488ff9d71d5c363080e7ef21e1ca55230f787a622c2932fb10d2f56b3e72e0363ded620f44d41021f6a85d8b9ec25b3e7,common_voice_en_22758616.mp3,"There's a huge amount of work available, apparently.",2,0,thirties,male,New Zealand English,en,
3a4228fd1f7614c4550485d454331fc488ff9d71d5c363080e7ef21e1ca55230f787a622c2932fb10d2f56b3e72e0363ded620f44d41021f6a85d8b9ec25b3e7,common_voice_en_22758620.mp3,He made significant contributions to the development of computer networks in mainland China.,2,1,thirties,male,New Zealand English,en,
3a4228fd1f7614c4550485d454331fc488ff9d71d5c363080e7ef21e1ca55230f787a622c2932fb10d2f56b3e72e0363ded620f44d41021f6a85d8b9ec25b3e7,common_voice_en_22758629.mp3,Gerry tries to tell Alfie but he thinks that Gerry has helped.,2,0,thirties,male,New Zealand English,en,
3a4228fd1f7614c4550485d454331fc488ff9d71d5c363080e7ef21e1ca55230f787a622c2932fb10d2f56b3e72e0363ded620f44d41021f6a85d8b9ec25b3e7,common_voice_en_22758663.mp3,Doubs was important as a portal to Switzerland through the pass at Joux.,2,0,thirties,male,New Zealand English,en,
3a4228fd1f7614c4550485d454331fc488ff9d71d5c363080e7ef21e1ca55230f787a622c2932fb10d2f56b3e72e0363ded620f44d41021f6a85d8b9ec25b3e7,common_voice_en_22758691.mp3,Roberto Jefferson is married to Ecila Brazil Jefferson Francisco.,3,0,thirties,male,New Zealand English,en,
3a4228fd1f7614c4550485d454331fc488ff9d71d5c363080e7ef21e1ca55230f787a622c2932fb10d2f56b3e72e0363ded620f44d41021f6a85d8b9ec25b3e7,common_voice_en_22758695.mp3,The local school district supports the E. Taylor Hatton Elementary School.,2,0,thirties,male,New Zealand English,en,
3a4228fd1f7614c4550485d454331fc488ff9d71d5c363080e7ef21e1ca55230f787a622c2932fb10d2f56b3e72e0363ded620f44d41021f6a85d8b9ec25b3e7,common_voice_en_22758699.mp3,The genus includes the important group of culinary herbs: marjoram and oregano.,2,0,thirties,male,New Zealand English,en,
3a4228fd1f7614c4550485d454331fc488ff9d71d5c363080e7ef21e1ca55230f787a622c2932fb10d2f56b3e72e0363ded620f44d41021f6a85d8b9ec25b3e7,common_voice_en_22758703.mp3,The album features Restas' Enoesque soundscapes on many of the songs.,2,0,thirties,male,New Zealand English,en,
3a4228fd1f7614c4550485d454331fc488ff9d71d5c363080e7ef21e1ca55230f787a622c2932fb10d2f56b3e72e0363ded620f44d41021f6a85d8b9ec25b3e7,common_voice_en_25639981.mp3,"Wright Company, the manufacturer of Lincoln Logs.",2,0,thirties,male,New Zealand English,en,
3a4228fd1f7614c4550485d454331fc488ff9d71d5c363080e7ef21e1ca55230f787a622c2932fb10d2f56b3e72e0363ded620f44d41021f6a85d8b9ec25b3e7,common_voice_en_25640004.mp3,He is one of the players who surprised everybody.,2,0,thirties,male,New Zealand English,en,
3a4228fd1f7614c4550485d454331fc488ff9d71d5c363080e7ef21e1ca55230f787a622c2932fb10d2f56b3e72e0363ded620f44d41021f6a85d8b9ec25b3e7,common_voice_en_25640025.mp3,Actor Leigh Whipper was her son.,2,0,thirties,male,New Zealand English,en,
3a4228fd1f7614c4550485d454331fc488ff9d71d5c363080e7ef21e1ca55230f787a622c2932fb10d2f56b3e72e0363ded620f44d41021f6a85d8b9ec25b3e7,common_voice_en_25640039.mp3,Other informal learning theories look at the sources of motivation for learning.,2,0,thirties,male,New Zealand English,en,
3a4228fd1f7614c4550485d454331fc488ff9d71d5c363080e7ef21e1ca55230f787a622c2932fb10d2f56b3e72e0363ded620f44d41021f6a85d8b9ec25b3e7,common_voice_en_25640048.mp3,They currently live in New York City.,2,0,thirties,male,New Zealand English,en,
3a4228fd1f7614c4550485d454331fc488ff9d71d5c363080e7ef21e1ca55230f787a622c2932fb10d2f56b3e72e0363ded620f44d41021f6a85d8b9ec25b3e7,common_voice_en_25640075.mp3,"Nevertheless, the Compromise continued but it was in decline.",2,0,thirties,male,New Zealand English,en,
3a4228fd1f7614c4550485d454331fc488ff9d71d5c363080e7ef21e1ca55230f787a622c2932fb10d2f56b3e72e0363ded620f44d41021f6a85d8b9ec25b3e7,common_voice_en_25640092.mp3,The Canadian indie rock band The Violet Archers is named for Archer.,3,0,thirties,male,New Zealand English,en,
3a4228fd1f7614c4550485d454331fc488ff9d71d5c363080e7ef21e1ca55230f787a622c2932fb10d2f56b3e72e0363ded620f44d41021f6a85d8b9ec25b3e7,common_voice_en_25640115.mp3,"When the Egyptians attacked Kadesh, Suppililiuma besieged and retook the town.",2,0,thirties,male,New Zealand English,en,
3a4228fd1f7614c4550485d454331fc488ff9d71d5c363080e7ef21e1ca55230f787a622c2932fb10d2f56b3e72e0363ded620f44d41021f6a85d8b9ec25b3e7,common_voice_en_25640200.mp3,This greatly restricted local video coverage to the length of a power cord.,2,0,thirties,male,New Zealand English,en,
3a4228fd1f7614c4550485d454331fc488ff9d71d5c363080e7ef21e1ca55230f787a622c2932fb10d2f56b3e72e0363ded620f44d41021f6a85d8b9ec25b3e7,common_voice_en_25640234.mp3,It is named after the characteristic shaped hill opposite it.,2,0,thirties,male,New Zealand English,en,
3a4228fd1f7614c4550485d454331fc488ff9d71d5c363080e7ef21e1ca55230f787a622c2932fb10d2f56b3e72e0363ded620f44d41021f6a85d8b9ec25b3e7,common_voice_en_25640260.mp3,"""The Lust..."" ended up being much more influential than the band originally thought.",2,0,thirties,male,New Zealand English,en,
3a4228fd1f7614c4550485d454331fc488ff9d71d5c363080e7ef21e1ca55230f787a622c2932fb10d2f56b3e72e0363ded620f44d41021f6a85d8b9ec25b3e7,common_voice_en_25640288.mp3,"AllMusic, on the other hand, called it half inspired, half-embarrassing and completely self-indulgent.",2,0,thirties,male,New Zealand English,en,
3a4228fd1f7614c4550485d454331fc488ff9d71d5c363080e7ef21e1ca55230f787a622c2932fb10d2f56b3e72e0363ded620f44d41021f6a85d8b9ec25b3e7,common_voice_en_25640298.mp3,There are several different theories concerning the origin of the city's name.,2,0,thirties,male,New Zealand English,en,
3a4228fd1f7614c4550485d454331fc488ff9d71d5c363080e7ef21e1ca55230f787a622c2932fb10d2f56b3e72e0363ded620f44d41021f6a85d8b9ec25b3e7,common_voice_en_25640307.mp3,"The award noted his ""great courage and determination in the face of the enemy"".",2,0,thirties,male,New Zealand English,en,
3a4228fd1f7614c4550485d454331fc488ff9d71d5c363080e7ef21e1ca55230f787a622c2932fb10d2f56b3e72e0363ded620f44d41021f6a85d8b9ec25b3e7,common_voice_en_25640366.mp3,All events have been held inside the Impact!,2,0,thirties,male,New Zealand English,en,
3a4228fd1f7614c4550485d454331fc488ff9d71d5c363080e7ef21e1ca55230f787a622c2932fb10d2f56b3e72e0363ded620f44d41021f6a85d8b9ec25b3e7,common_voice_en_25640379.mp3,Uruk has the first monumental constructions in architectural history.,2,0,thirties,male,New Zealand English,en,
3a4228fd1f7614c4550485d454331fc488ff9d71d5c363080e7ef21e1ca55230f787a622c2932fb10d2f56b3e72e0363ded620f44d41021f6a85d8b9ec25b3e7,common_voice_en_25640387.mp3,"Occasionally, cases of hip dysplasia can occur.",2,0,thirties,male,New Zealand English,en,
3a4228fd1f7614c4550485d454331fc488ff9d71d5c363080e7ef21e1ca55230f787a622c2932fb10d2f56b3e72e0363ded620f44d41021f6a85d8b9ec25b3e7,common_voice_en_25640408.mp3,Incumbent President George W. Bush ran unopposed.,2,0,thirties,male,New Zealand English,en,
3a4228fd1f7614c4550485d454331fc488ff9d71d5c363080e7ef21e1ca55230f787a622c2932fb10d2f56b3e72e0363ded620f44d41021f6a85d8b9ec25b3e7,common_voice_en_25640426.mp3,It does this by adjusting a player's raw statistics for park and league effects.,2,0,thirties,male,New Zealand English,en,
3a4228fd1f7614c4550485d454331fc488ff9d71d5c363080e7ef21e1ca55230f787a622c2932fb10d2f56b3e72e0363ded620f44d41021f6a85d8b9ec25b3e7,common_voice_en_25640552.mp3,The school is based on a long tradition of Lutheran education in the town.,2,0,thirties,male,New Zealand English,en,
3a4228fd1f7614c4550485d454331fc488ff9d71d5c363080e7ef21e1ca55230f787a622c2932fb10d2f56b3e72e0363ded620f44d41021f6a85d8b9ec25b3e7,common_voice_en_25640561.mp3,"At Pine View, students must enroll at the beginning of each school year.",2,0,thirties,male,New Zealand English,en,
3a4228fd1f7614c4550485d454331fc488ff9d71d5c363080e7ef21e1ca55230f787a622c2932fb10d2f56b3e72e0363ded620f44d41021f6a85d8b9ec25b3e7,common_voice_en_25640591.mp3,Ignatz runs away.,2,0,thirties,male,New Zealand English,en,
3a4228fd1f7614c4550485d454331fc488ff9d71d5c363080e7ef21e1ca55230f787a622c2932fb10d2f56b3e72e0363ded620f44d41021f6a85d8b9ec25b3e7,common_voice_en_25640605.mp3,Mass continues to produce and master albums for several international recording artists.,2,0,thirties,male,New Zealand English,en,
3a4228fd1f7614c4550485d454331fc488ff9d71d5c363080e7ef21e1ca55230f787a622c2932fb10d2f56b3e72e0363ded620f44d41021f6a85d8b9ec25b3e7,common_voice_en_25640624.mp3,"As a result, manufacturing was dependent on sales.",2,0,thirties,male,New Zealand English,en,
3a4228fd1f7614c4550485d454331fc488ff9d71d5c363080e7ef21e1ca55230f787a622c2932fb10d2f56b3e72e0363ded620f44d41021f6a85d8b9ec25b3e7,common_voice_en_25640633.mp3,The parade has had several route changes in its history.,2,1,thirties,male,New Zealand English,en,
3a4228fd1f7614c4550485d454331fc488ff9d71d5c363080e7ef21e1ca55230f787a622c2932fb10d2f56b3e72e0363ded620f44d41021f6a85d8b9ec25b3e7,common_voice_en_25640846.mp3,Foster homes are heavily utilized in either case.,2,0,thirties,male,New Zealand English,en,
3a4228fd1f7614c4550485d454331fc488ff9d71d5c363080e7ef21e1ca55230f787a622c2932fb10d2f56b3e72e0363ded620f44d41021f6a85d8b9ec25b3e7,common_voice_en_25640915.mp3,"Candido's distinctive, four-octave speaking voice became familiar to radio listeners and moviegoers.",2,0,thirties,male,New Zealand English,en,
3a4228fd1f7614c4550485d454331fc488ff9d71d5c363080e7ef21e1ca55230f787a622c2932fb10d2f56b3e72e0363ded620f44d41021f6a85d8b9ec25b3e7,common_voice_en_25640929.mp3,It is mandated to develop and review quality assurance and inspection procedures.,2,0,thirties,male,New Zealand English,en,
3a4228fd1f7614c4550485d454331fc488ff9d71d5c363080e7ef21e1ca55230f787a622c2932fb10d2f56b3e72e0363ded620f44d41021f6a85d8b9ec25b3e7,common_voice_en_25641111.mp3,"Friedman's is a popular work based on much personal research, travel, conversation, and reflection.",2,0,thirties,male,New Zealand English,en,
3a4228fd1f7614c4550485d454331fc488ff9d71d5c363080e7ef21e1ca55230f787a622c2932fb10d2f56b3e72e0363ded620f44d41021f6a85d8b9ec25b3e7,common_voice_en_25641144.mp3,The scrollability indicates the direction in which a cursor can move.,2,0,thirties,male,New Zealand English,en,
3a4228fd1f7614c4550485d454331fc488ff9d71d5c363080e7ef21e1ca55230f787a622c2932fb10d2f56b3e72e0363ded620f44d41021f6a85d8b9ec25b3e7,common_voice_en_25641171.mp3,At this point the existing examples could be unified.,2,1,thirties,male,New Zealand English,en,
3a4228fd1f7614c4550485d454331fc488ff9d71d5c363080e7ef21e1ca55230f787a622c2932fb10d2f56b3e72e0363ded620f44d41021f6a85d8b9ec25b3e7,common_voice_en_25641215.mp3,Reflection nebulae may also be the site of star formation.,2,0,thirties,male,New Zealand English,en,
3a4228fd1f7614c4550485d454331fc488ff9d71d5c363080e7ef21e1ca55230f787a622c2932fb10d2f56b3e72e0363ded620f44d41021f6a85d8b9ec25b3e7,common_voice_en_25641264.mp3,The results both supported and extended Mendel's laws of heredity.,2,0,thirties,male,New Zealand English,en,
3a4228fd1f7614c4550485d454331fc488ff9d71d5c363080e7ef21e1ca55230f787a622c2932fb10d2f56b3e72e0363ded620f44d41021f6a85d8b9ec25b3e7,common_voice_en_25641434.mp3,"The star appears stable, with little stellar variation, and is metal-deficient.",2,0,thirties,male,New Zealand English,en,
3a4228fd1f7614c4550485d454331fc488ff9d71d5c363080e7ef21e1ca55230f787a622c2932fb10d2f56b3e72e0363ded620f44d41021f6a85d8b9ec25b3e7,common_voice_en_25641438.mp3,It is not a council estate however.,2,0,thirties,male,New Zealand English,en,
3a4228fd1f7614c4550485d454331fc488ff9d71d5c363080e7ef21e1ca55230f787a622c2932fb10d2f56b3e72e0363ded620f44d41021f6a85d8b9ec25b3e7,common_voice_en_25641452.mp3,"Two main cash crops, coffee and cotton, flank the river.",2,0,thirties,male,New Zealand English,en,
3a4228fd1f7614c4550485d454331fc488ff9d71d5c363080e7ef21e1ca55230f787a622c2932fb10d2f56b3e72e0363ded620f44d41021f6a85d8b9ec25b3e7,common_voice_en_25641458.mp3,"She is a long-term anti-nuclear campaigner, promoting the use of renewable energy.",2,0,thirties,male,New Zealand English,en,
3a4228fd1f7614c4550485d454331fc488ff9d71d5c363080e7ef21e1ca55230f787a622c2932fb10d2f56b3e72e0363ded620f44d41021f6a85d8b9ec25b3e7,common_voice_en_25641482.mp3,"During his imprisonment, he began teaching anthropology to his fellow prisoners.",2,0,thirties,male,New Zealand English,en,
3a4228fd1f7614c4550485d454331fc488ff9d71d5c363080e7ef21e1ca55230f787a622c2932fb10d2f56b3e72e0363ded620f44d41021f6a85d8b9ec25b3e7,common_voice_en_25641495.mp3,"Verifiability, accuracy, and openness to criticism are central tenets of historical scholarship.",2,0,thirties,male,New Zealand English,en,
3a4228fd1f7614c4550485d454331fc488ff9d71d5c363080e7ef21e1ca55230f787a622c2932fb10d2f56b3e72e0363ded620f44d41021f6a85d8b9ec25b3e7,common_voice_en_27870696.mp3,Carniola and Dalmatia joined Yugoslavia.,3,0,thirties,male,New Zealand English,en,
3a4228fd1f7614c4550485d454331fc488ff9d71d5c363080e7ef21e1ca55230f787a622c2932fb10d2f56b3e72e0363ded620f44d41021f6a85d8b9ec25b3e7,common_voice_en_27870757.mp3,"The list below is organized by state and, within each state, by population size.",2,0,thirties,male,New Zealand English,en,
3a4228fd1f7614c4550485d454331fc488ff9d71d5c363080e7ef21e1ca55230f787a622c2932fb10d2f56b3e72e0363ded620f44d41021f6a85d8b9ec25b3e7,common_voice_en_27870809.mp3,She was Britain's first Muslim war heroine.,2,0,thirties,male,New Zealand English,en,
3a4228fd1f7614c4550485d454331fc488ff9d71d5c363080e7ef21e1ca55230f787a622c2932fb10d2f56b3e72e0363ded620f44d41021f6a85d8b9ec25b3e7,common_voice_en_27870847.mp3,"The lead architect of the project was Edward F. Neild of Shreveport, Louisiana.",2,0,thirties,male,New Zealand English,en,
3a4228fd1f7614c4550485d454331fc488ff9d71d5c363080e7ef21e1ca55230f787a622c2932fb10d2f56b3e72e0363ded620f44d41021f6a85d8b9ec25b3e7,common_voice_en_27870903.mp3,"In some Latin American cultures, winking may also be a romantic or sexual invitation.",2,0,thirties,male,New Zealand English,en,
3a4228fd1f7614c4550485d454331fc488ff9d71d5c363080e7ef21e1ca55230f787a622c2932fb10d2f56b3e72e0363ded620f44d41021f6a85d8b9ec25b3e7,common_voice_en_27870966.mp3,An ideal diode allows current in one direction but not in the other.,2,0,thirties,male,New Zealand English,en,
3a4228fd1f7614c4550485d454331fc488ff9d71d5c363080e7ef21e1ca55230f787a622c2932fb10d2f56b3e72e0363ded620f44d41021f6a85d8b9ec25b3e7,common_voice_en_27871004.mp3,Maurizio and Lazzaro.,2,0,thirties,male,New Zealand English,en,
3a4228fd1f7614c4550485d454331fc488ff9d71d5c363080e7ef21e1ca55230f787a622c2932fb10d2f56b3e72e0363ded620f44d41021f6a85d8b9ec25b3e7,common_voice_en_27871033.mp3,The other village used was Martin in Hampshire.,2,0,thirties,male,New Zealand English,en,
3a4228fd1f7614c4550485d454331fc488ff9d71d5c363080e7ef21e1ca55230f787a622c2932fb10d2f56b3e72e0363ded620f44d41021f6a85d8b9ec25b3e7,common_voice_en_27871077.mp3,"Historically, Henley has had several private lunatic asylums.",2,0,thirties,male,New Zealand English,en,
3a4228fd1f7614c4550485d454331fc488ff9d71d5c363080e7ef21e1ca55230f787a622c2932fb10d2f56b3e72e0363ded620f44d41021f6a85d8b9ec25b3e7,common_voice_en_27871177.mp3,"Despite the name, the station is located under Republic Avenue, beside the Kallang Basin.",2,0,thirties,male,New Zealand English,en,
3a4228fd1f7614c4550485d454331fc488ff9d71d5c363080e7ef21e1ca55230f787a622c2932fb10d2f56b3e72e0363ded620f44d41021f6a85d8b9ec25b3e7,common_voice_en_27871194.mp3,A substantial seasonal population swells the city during the winter months.,2,0,thirties,male,New Zealand English,en,
3a4228fd1f7614c4550485d454331fc488ff9d71d5c363080e7ef21e1ca55230f787a622c2932fb10d2f56b3e72e0363ded620f44d41021f6a85d8b9ec25b3e7,common_voice_en_27871213.mp3,"Brooke McEldowney is also the creator of the webcomic ""Pibgorn"", a spin-off.",2,0,thirties,male,New Zealand English,en,
3a4228fd1f7614c4550485d454331fc488ff9d71d5c363080e7ef21e1ca55230f787a622c2932fb10d2f56b3e72e0363ded620f44d41021f6a85d8b9ec25b3e7,common_voice_en_27871238.mp3,Little is known about this kingdom.,2,0,thirties,male,New Zealand English,en,
