file,sentence,scorecommon_voice_en_19547421.mp3,It obtained federal and city landmark status in that same year.,0.4
common_voice_en_19547460.mp3,Las Lomas is served by the Rio Grande City Consolidated Independent School District.,0.4
common_voice_en_19547858.mp3,Pickhaver performed in plays at school and at university.,0.4
common_voice_en_19552446.mp3,"He lives in New York City and Petrolia, California.",0.4
common_voice_en_19562762.mp3,Daejeon Metropolitan City Hall is also located there.,0.4
common_voice_en_19568047.mp3,"The university moved first to Yunnan, and later to North Guangdong.",0.4
common_voice_en_21139193.mp3,"The community has the name of Samuel B. Dresser, an early settler.",0.4
common_voice_en_21139210.mp3,Overland Park is also home to a relatively small Muslim population.,0.4
common_voice_en_21139233.mp3,The ages progressively decrease from east to west.,0.4
common_voice_en_21139294.mp3,He had invited young Korean aristocrats to his school.,0.4
common_voice_en_21139299.mp3,The school was known to have high admission requirements and able pupils.,0.4
common_voice_en_21139300.mp3,The school also has many clubs and community outreach programs.,0.4
common_voice_en_21139523.mp3,Franklin is the third largest town in Franklin County.,0.4
common_voice_en_21139526.mp3,The tips of the long tail feathers are white.,0.4
common_voice_en_21160035.mp3,The school even fielded a six-man football team.,0.4
common_voice_en_21162436.mp3,The road heads south before it curves to the southeast.,0.4
common_voice_en_21183009.mp3,The Redes Natural Park is located nearby.,0.4
common_voice_en_21206741.mp3,Ended up each song turned into one long jam.,0.4
common_voice_en_21208398.mp3,"Because it can never be destroyed, it is sometimes called ""The Eternal City"".",0.4
common_voice_en_21208416.mp3,He left the club at the end of the season and retired from football.,0.4
common_voice_en_21209835.mp3,Congressman and also served in the North Carolina Senate.,0.4
common_voice_en_21210008.mp3,The city traffic becomes more and more congested each year pass.,0.4
common_voice_en_19751562.mp3,The District Munsiff Court and Judicial Magistrate Court are located in the town.,0.375
common_voice_en_19974715.mp3,"Nowadays, the station serves Queens Road Market and Green Street.",0.375
common_voice_en_19616205.mp3,Throughout the year the residence halls participate in competitions and various community service activities.,0.375
common_voice_en_26997529.mp3,He has played for the South Sydney Rabbitohs in the National Rugby League competition.,0.375
common_voice_en_23893312.mp3,Historically the Nogat River divides East Prussia and West Prussia.,0.375
common_voice_en_26985611.mp3,Membership was based almost wholly in large metropolitan areas and on college campuses.,0.375
common_voice_en_26986027.mp3,"Whilst residing in Germany, McCarthy was a member of a band called Kamerakino.",0.375
common_voice_en_19519470.mp3,"""The Cross"" is a local booklet produced monthly by the Anglican church.",0.375
common_voice_en_20999728.mp3,"The Patuca River was featured in the Douglas Preston book ""The Codex"".",0.375
common_voice_en_30645566.mp3,Schmitz served on the Scott County Soil and Conservation District Board.,0.375
common_voice_en_18715606.mp3,"Popular recreational activities in the park include bushwalking, abseiling and gliding.",0.375
common_voice_en_25354175.mp3,"The team colours remained the same throughout; black, gold, red and white.",0.375
common_voice_en_21493994.mp3,"A comparable number of families also moved to Australia, Canada, and the United States.",0.375
common_voice_en_21494108.mp3,Sections of South Kansas City and some Kansas suburbs are also served by Surewest.,0.375
common_voice_en_22758695.mp3,The local school district supports the E. Taylor Hatton Elementary School.,0.375
common_voice_en_25641111.mp3,"Friedman's is a popular work based on much personal research, travel, conversation, and reflection.",0.375
common_voice_en_19547378.mp3,"McQuinn was born in Arlington, Virginia and attended Washington-Lee High School.",0.375
common_voice_en_19553004.mp3,The United States Postal Service operates the Valentine Post Office.,0.375
common_voice_en_21139232.mp3,He previously played for Suntory Sungoliath and the Japan national rugby union team.,0.375
common_voice_en_21182075.mp3,"Whitacre states that the first work that he sang, Mozart's ""Requiem"", changed his life.",0.375
common_voice_en_21185414.mp3,Welk licensed the Ranwood catalog to Concord Music Group for ten years.,0.375
common_voice_en_19547522.mp3,"Gartner clients include large corporations, government agencies, technology companies and the investment community.",0.36363636363636365
common_voice_en_20661767.mp3,The saying originated from early film studios' silent films.,0.3333333333333333
common_voice_en_26792070.mp3,"Quick, somebody get a phone book.",0.3333333333333333
common_voice_en_26350166.mp3,The town lies north of Bournemouth and north of Poole.,0.3333333333333333
common_voice_en_26350170.mp3,"This was also the year they recorded their debut album, ""Surviving the Quiet"".",0.3333333333333333
common_voice_en_20288434.mp3,The latter form is more common and practically amounts to challenge-response authentication.,0.3333333333333333
common_voice_en_31289611.mp3,The road curves to the northeast and enters Smith County.,0.3333333333333333
common_voice_en_31289613.mp3,The game remained close to the very end.,0.3333333333333333
common_voice_en_23870222.mp3,"James Stephens was born in Mount Kisco, New York.",0.3333333333333333
common_voice_en_23870224.mp3,Plans were made to move the school to yet another site.,0.3333333333333333
common_voice_en_23566568.mp3,"Wendy Richard took time off filming for ""EastEnders"" to film.",0.3333333333333333
common_voice_en_19730725.mp3,"Bauer is her married name, from her first husband.",0.3333333333333333
common_voice_en_26997487.mp3,"Original helicopter ""classes"" were based on the engine size.",0.3333333333333333
common_voice_en_26997522.mp3,It neighbours Karepa in the east.,0.3333333333333333
common_voice_en_26997524.mp3,"Because of this, they are sometimes called ""House Amish"".",0.3333333333333333
common_voice_en_23767403.mp3,He was married to Victoria Reich.,0.3333333333333333
common_voice_en_141412.mp3,A woman in a sari is talking to a man in a white shirt.,0.3333333333333333
common_voice_en_141416.mp3,A large crowd of people stand at the start line of a race.,0.3333333333333333
common_voice_en_23893310.mp3,This area also has a Television Channel named as Araniko Television.,0.3333333333333333
common_voice_en_19699944.mp3,"The population centers were, however, all located in the flat plains of the north.",0.3333333333333333
common_voice_en_24569282.mp3,The number often identifies one who is persecuted.,0.3333333333333333
common_voice_en_24569314.mp3,"The area had developed along the Kidderminster and Birmingham Road, which had been turnpiked.",0.3333333333333333
common_voice_en_22708417.mp3,He is currently married to Laura Cole.,0.3333333333333333
common_voice_en_22708461.mp3,"Unlike the original Megatrain concept, this service is available seven days a week.",0.3333333333333333
common_voice_en_22708464.mp3,She married Sipopa Lutangu.,0.3333333333333333
common_voice_en_18977859.mp3,Forestville Mystery Cave State Park is nearby.,0.3333333333333333
common_voice_en_19717534.mp3,The family money actually came from wizardry.,0.3333333333333333
common_voice_en_19717575.mp3,This also was enforced in many of the work positions.,0.3333333333333333
common_voice_en_19717654.mp3,"Allison was born and raised in Columbia, South Carolina.",0.3333333333333333
common_voice_en_20029451.mp3,It is the fourth largest river in the world by discharge volume of water.,0.3333333333333333
common_voice_en_20029485.mp3,"The town has been coined as ""Little Poland"" by a local shopkeeper.",0.3333333333333333
common_voice_en_22443881.mp3,He is recognized as such by the state of Alabama.,0.3333333333333333
common_voice_en_22443953.mp3,Abell died in Copenhagen.,0.3333333333333333
common_voice_en_20049288.mp3,He was the Distinguished Research Professor in the Department of Biology at York University.,0.3333333333333333
common_voice_en_20049352.mp3,Kun chose life.,0.3333333333333333
common_voice_en_22214266.mp3,His father was manager of the local Lands Department office.,0.3333333333333333
common_voice_en_22214336.mp3,The company stock is traded on the New York Stock Exchange.,0.3333333333333333
common_voice_en_22214348.mp3,The term is now used mainly to discuss music of the past.,0.3333333333333333
common_voice_en_22214352.mp3,There were six main Chinese concentrations.,0.3333333333333333
common_voice_en_22749662.mp3,It is set in the key of E major.,0.3333333333333333
common_voice_en_22749677.mp3,Today there is a very limited late evening service provided by South West Trains.,0.3333333333333333
common_voice_en_24895698.mp3,He was an early supporter of Swedish membership of the European Community.,0.3333333333333333
common_voice_en_24895699.mp3,Lynn was associated with Dur-O-Lite for many years.,0.3333333333333333
common_voice_en_23830008.mp3,He resigned from the Bristol and West building society shortly afterwards.,0.3333333333333333
common_voice_en_23830017.mp3,"Ten days later, he discovered the island that was named for him, Beauchene Island.",0.3333333333333333
common_voice_en_23846375.mp3,The park is currently closed for repairs.,0.3333333333333333
common_voice_en_26985733.mp3,"They had two children together, Cliff and Diane.",0.3333333333333333
common_voice_en_26985734.mp3,"However, they do also work outside of ""The Greater Good"" as mercenaries frequently.",0.3333333333333333
common_voice_en_26985911.mp3,With the vinyl release of the album only.,0.3333333333333333
common_voice_en_27292788.mp3,The group began with Pardlo signing on as a solo artist.,0.3333333333333333
common_voice_en_19519473.mp3,"He is buried in the family vault of Newbattle Church, Scotland.",0.3333333333333333
common_voice_en_19946506.mp3,Both were re-elected and served for three terms.,0.3333333333333333
common_voice_en_19946693.mp3,"He was an American lawyer and politician from Franklin County, Georgia.",0.3333333333333333
common_voice_en_19946697.mp3,This controversial development is supposedly in keeping with the local area.,0.3333333333333333
common_voice_en_27637366.mp3,She thought that the man was asking about what she was carrying.,0.3333333333333333
common_voice_en_27637597.mp3,"The city also has an extensive network of buslines, both regional and local.",0.3333333333333333
common_voice_en_27637621.mp3,Sometimes they were formed into small figures.,0.3333333333333333
common_voice_en_89074.mp3,A group of people is traveling through a terminal with moving walkways.,0.3333333333333333
common_voice_en_89119.mp3,A man in construction garb is walking away from a site on a street.,0.3333333333333333
common_voice_en_20999493.mp3,See main WorldSpace article.,0.3333333333333333
common_voice_en_21183219.mp3,It lay to the east of Gibeon.,0.3333333333333333
common_voice_en_21183246.mp3,Achterfeldt was born at Wesel.,0.3333333333333333
common_voice_en_21183296.mp3,He was born in Fukuoka Prefecture.,0.3333333333333333
common_voice_en_30645475.mp3,One sitting member John Lucas did not contest the election.,0.3333333333333333
common_voice_en_30645522.mp3,The first child born in the settlement was named Christopher Bryant Jr.,0.3333333333333333
common_voice_en_30645534.mp3,The video was released along with the song.,0.3333333333333333
common_voice_en_30645567.mp3,She advocated for the importance of black writers in the film and television industry.,0.3333333333333333
common_voice_en_30650392.mp3,That same year the club disaffiliated and never returned to official competitions.,0.3333333333333333
common_voice_en_30650415.mp3,Elgon area and possibly into Uganda.,0.3333333333333333
common_voice_en_19744853.mp3,They educate the majority of children in New Orleans Public Schools.,0.3333333333333333
common_voice_en_19793964.mp3,"It is located on Potter Cove, King George Island, in the South Shetland Islands.",0.3333333333333333
common_voice_en_19793975.mp3,This happens repeatedly with the man playing out his life differently in each cycle.,0.3333333333333333
common_voice_en_19793977.mp3,Danny reports the murder to his father and to the local police.,0.3333333333333333
common_voice_en_19693043.mp3,I was asked to take a man's life.,0.3333333333333333
common_voice_en_19693118.mp3,The song of the scarlet tanager appears high in the first violin.,0.3333333333333333
common_voice_en_19693149.mp3,Napoli where he played for the next four seasons.,0.3333333333333333
common_voice_en_19693266.mp3,It is the third-largest and the most densely populated city in Westchester County.,0.3333333333333333
common_voice_en_19693396.mp3,The track gauge is Indian gauge in the south and in the north.,0.3333333333333333
common_voice_en_19693440.mp3,"He is married to Kristin Ex and father of Hendrik, Irene and Margreet.",0.3333333333333333
common_voice_en_18714488.mp3,"He is mentioned in the ""Domesday Book.",0.3333333333333333
common_voice_en_18714555.mp3,He now lives in South Florida.,0.3333333333333333
common_voice_en_18714575.mp3,The last years of his life Zenker spent in Osterode am Harz.,0.3333333333333333
common_voice_en_18715682.mp3,He also served as a member of the World's Columbian Fair Commission.,0.3333333333333333
common_voice_en_18715684.mp3,The area became known as the Duchy of Prussia.,0.3333333333333333
common_voice_en_27269987.mp3,Deer Creek Reservoir is the main feature of Deer Creek State Park.,0.3333333333333333
common_voice_en_27270030.mp3,The following year was one of redemption for the Crusaders.,0.3333333333333333
common_voice_en_27270034.mp3,Corporate headquarters were located in Downtown Oklahoma City.,0.3333333333333333
common_voice_en_27344521.mp3,"In Brooklyn, he attended Erasmus Hall High School.",0.3333333333333333
common_voice_en_27344684.mp3,David Williams is now in a Kent-based band called Adelaide.,0.3333333333333333
common_voice_en_25354119.mp3,It is the most water-rich river in Dalmatia.,0.3333333333333333
common_voice_en_25354195.mp3,"He was also a guest star in an early episode of ""The Avengers"".",0.3333333333333333
common_voice_en_25359304.mp3,It had been first settled after the American Revolution.,0.3333333333333333
common_voice_en_25380069.mp3,We live in a semi-detached house.,0.3333333333333333
common_voice_en_25380231.mp3,She had suffered a series of strokes.,0.3333333333333333
common_voice_en_19905168.mp3,This policy would not be lifted for over two hundred years.,0.3333333333333333
common_voice_en_23893381.mp3,There is also a buy on board service.,0.3333333333333333
common_voice_en_23893455.mp3,"In addition, the academy attracts students from across the United States.",0.3333333333333333
common_voice_en_23893527.mp3,It is also home to a distinct College of the Arts.,0.3333333333333333
common_voice_en_23893741.mp3,It is located on the southern bank of the Orange River mouth.,0.3333333333333333
common_voice_en_23893762.mp3,The Council meets once a year.,0.3333333333333333
common_voice_en_23893763.mp3,Ashley called Corinthian.,0.3333333333333333
common_voice_en_23893775.mp3,"Russell Company, also of Atlanta.",0.3333333333333333
common_voice_en_23893824.mp3,The government of Japan does not consider it having any crucial value.,0.3333333333333333
common_voice_en_23893826.mp3,The history of the song is unclear.,0.3333333333333333
common_voice_en_23911980.mp3,She received a Bachelor of Science in Theatre from the University of Evansville.,0.3333333333333333
common_voice_en_23912005.mp3,It is commonly known as The City of Ships.,0.3333333333333333
common_voice_en_19852680.mp3,"Sullivan was born on a farm at Kilcrohane, west of Bantry, County Cork, Ireland.",0.3333333333333333
common_voice_en_19852836.mp3,South of the Kuban were Circassians.,0.3333333333333333
common_voice_en_19852864.mp3,The original name of the website was Quakeholio.,0.3333333333333333
common_voice_en_19853484.mp3,Road transport is the primary method of transport in and out of the area.,0.3333333333333333
common_voice_en_19853491.mp3,The bill will need to be re-introduced in order to be considered again.,0.3333333333333333
common_voice_en_19867718.mp3,He attended Lincoln High School in Brighton Beach.,0.3333333333333333
common_voice_en_19867765.mp3,The man collapses in his study.,0.3333333333333333
common_voice_en_19867782.mp3,It is the smallest number with exactly seven divisors.,0.3333333333333333
common_voice_en_19867786.mp3,"This is called ""stopping"" the strings.",0.3333333333333333
common_voice_en_19868025.mp3,Jol was born in The Hague.,0.3333333333333333
common_voice_en_20031188.mp3,Other groups include the Christchurch Archery club and New Brighton long boarders club.,0.3333333333333333
common_voice_en_20166649.mp3,Some military districts could not form a front.,0.3333333333333333
common_voice_en_20166902.mp3,This killing happened in Uvalde County Texas and involved a man called Gilchrist.,0.3333333333333333
common_voice_en_20167585.mp3,Other filmmakers began opening studios in the Hollywood area.,0.3333333333333333
common_voice_en_20167669.mp3,Chuck Berry also came to see the band.,0.3333333333333333
common_voice_en_20167745.mp3,The capital of the state was Rewa.,0.3333333333333333
common_voice_en_20168001.mp3,Extinct peoples are not included.,0.3333333333333333
common_voice_en_20168220.mp3,"The Prince George's County bus system, called simply TheBus, serves this station.",0.3333333333333333
common_voice_en_21493984.mp3,"Staite was born in White Rock, British Columbia.",0.3333333333333333
common_voice_en_21493991.mp3,The company is headquartered in Jakarta.,0.3333333333333333
common_voice_en_21494166.mp3,This was the only year in Eurovision with such wishes.,0.3333333333333333
common_voice_en_21507246.mp3,Tateyama is located in east central Toyama Prefecture.,0.3333333333333333
common_voice_en_22758597.mp3,"Oh, to whom shall a song of battle be chanted?",0.3333333333333333
common_voice_en_22758600.mp3,That company's version was further used in animated public service announcements.,0.3333333333333333
common_voice_en_22758603.mp3,Its county seat is Bayboro.,0.3333333333333333
common_voice_en_22758611.mp3,Nathan Vasquez plays in a band called Deluxin.,0.3333333333333333
common_voice_en_22758617.mp3,His father was a retail merchant.,0.3333333333333333
common_voice_en_22758697.mp3,Its county seat is Jefferson.,0.3333333333333333
common_voice_en_25640010.mp3,The entry to the station is from the Gallery level of Toowong Village.,0.3333333333333333
common_voice_en_25640108.mp3,These were not organized public events.,0.3333333333333333
common_voice_en_25640221.mp3,This song is the album's second track.,0.3333333333333333
common_voice_en_25640289.mp3,Villarrubia was born in Madrid.,0.3333333333333333
common_voice_en_25640376.mp3,North of the village is a Norman motte and earthworks but no bailey.,0.3333333333333333
common_voice_en_25640420.mp3,He is currently the shortest-reigning manager of the club.,0.3333333333333333
common_voice_en_25640561.mp3,"At Pine View, students must enroll at the beginning of each school year.",0.3333333333333333
common_voice_en_25640849.mp3,The book has been widely reviewed in journals.,0.3333333333333333
common_voice_en_25641098.mp3,"She was named for Asbestos, Quebec.",0.3333333333333333
common_voice_en_25641472.mp3,It is considered part of the San Antonio Metropolitan Statistical Area.,0.3333333333333333
common_voice_en_25641484.mp3,The city center is only about a kilometer away.,0.3333333333333333
common_voice_en_27870667.mp3,"William McCormack was born in Saint Lawrence, Queensland.",0.3333333333333333
common_voice_en_27870817.mp3,"She is engaged to be married, so don't be alarmed.",0.3333333333333333
common_voice_en_27870991.mp3,Objecthood is the state of being an object.,0.3333333333333333
common_voice_en_27871033.mp3,The other village used was Martin in Hampshire.,0.3333333333333333
common_voice_en_27871177.mp3,"Despite the name, the station is located under Republic Avenue, beside the Kallang Basin.",0.3333333333333333
common_voice_en_27871334.mp3,"It was named after Lucan, in Ireland.",0.3333333333333333
common_voice_en_27871419.mp3,Its county seat is Ipswich.,0.3333333333333333
common_voice_en_28852697.mp3,"The casino is operated by Wyomissing, Pennsylvania-based Penn National Gaming of the United States.",0.3333333333333333
common_voice_en_28853329.mp3,"It is situated by the Ume River, at the southeastern end of Lake Storuman.",0.3333333333333333
common_voice_en_29373560.mp3,The division trained along the west bank of the river in March.,0.3333333333333333
common_voice_en_18884159.mp3,She also served as provost and dean of the College of Letters and Sciences.,0.3333333333333333
common_voice_en_18884777.mp3,He also refused to be made doctor of music.,0.3333333333333333
common_voice_en_18884860.mp3,It is located in the country's southwest.,0.3333333333333333
common_voice_en_18890716.mp3,This was the only formal education she received.,0.3333333333333333
common_voice_en_18890738.mp3,The Jewish population was important in the town.,0.3333333333333333
common_voice_en_18890751.mp3,"Palladium was also one of the major distributors of ""Robotech"" merchandise for several years.",0.3333333333333333
common_voice_en_18890753.mp3,"Amy was the daughter of the vicar of Saint Stephen's Church, Spring Street, Hull.",0.3333333333333333
common_voice_en_18893473.mp3,His father is Serbian descent.,0.3333333333333333
common_voice_en_18893482.mp3,The executive has the mandate for two years.,0.3333333333333333
common_voice_en_18893507.mp3,Meldrum studied at the National Gallery School in Melbourne.,0.3333333333333333
common_voice_en_18893553.mp3,"Cavendish, however, received no benefit.",0.3333333333333333
common_voice_en_18893576.mp3,Its first shed allocation was at Old Oak Common.,0.3333333333333333
common_voice_en_18893615.mp3,However ill-health prevented further service on his part.,0.3333333333333333
common_voice_en_18893626.mp3,The current strip is black and white horizontal bands.,0.3333333333333333
common_voice_en_18893837.mp3,"Showing an early aptitude for music, he was already composing in his teens.",0.3333333333333333
common_voice_en_18893934.mp3,The band claims to never have performed the same show twice.,0.3333333333333333
common_voice_en_18893969.mp3,"The members don't like each other, but are soon banding together for survival.",0.3333333333333333
common_voice_en_18893971.mp3,The album was praised by Kerrang!,0.3333333333333333
common_voice_en_18893996.mp3,Farnsworth also served as the treasurer of the Pennsylvania Libertarian Party.,0.3333333333333333
common_voice_en_18900720.mp3,Angelina has taken several hiatuses from performing throughout her adult film career.,0.3333333333333333
common_voice_en_18900721.mp3,The division's largest urban community is the Town of Hinton.,0.3333333333333333
common_voice_en_18900790.mp3,"It is bordered to the north by its twin city of Copperhill, Tennessee.",0.3333333333333333
common_voice_en_18900792.mp3,Half-wave antennas are also common.,0.3333333333333333
common_voice_en_18909326.mp3,This third form is rarely seen outside of this context.,0.3333333333333333
common_voice_en_18909339.mp3,Weddings also take place in the chapel.,0.3333333333333333
common_voice_en_18909355.mp3,It also had a presence in popular culture.,0.3333333333333333
common_voice_en_18909372.mp3,Its county seat is Greenfield.,0.3333333333333333
common_voice_en_18935338.mp3,The song was covered for the United Kingdom by Petula Clark.,0.3333333333333333
common_voice_en_18935341.mp3,The main source of income is the College of Nursing and Agriculture.,0.3333333333333333
common_voice_en_18963316.mp3,He liked their company and he visited church and started reading the Bible.,0.3333333333333333
common_voice_en_18967257.mp3,The bass filled Chad's time as he was unable to go to school.,0.3333333333333333
common_voice_en_18985401.mp3,"The steel is named after Damascus, the capital city of Syria.",0.3333333333333333
common_voice_en_18985496.mp3,This means that surface area is invariant under the group of Euclidean motions.,0.3333333333333333
common_voice_en_18985542.mp3,"He died in Sofia, Bulgaria.",0.3333333333333333
common_voice_en_19005148.mp3,"After the closure of this weather station, the nearest one is located at Pershore.",0.3333333333333333
common_voice_en_19005152.mp3,The West was unable to break the Soviet encryption at this time.,0.3333333333333333
common_voice_en_19034514.mp3,It is also a popular spot for tomb-stoning.,0.3333333333333333
common_voice_en_19034546.mp3,The first league the club played in was the Border Junior League.,0.3333333333333333
common_voice_en_25345715.mp3,"The song is also appeared in another part of the ""Terminator"" series, ""Terminator Salvation"".",0.3333333333333333
common_voice_en_19547295.mp3,The parish of Saint Giles Knowles was part of the South Petherton Hundred.,0.3333333333333333
common_voice_en_19547296.mp3,Wirthlin's career was spent as a prominent business leader in Salt Lake City.,0.3333333333333333
common_voice_en_19547365.mp3,"Callahan enrolled in the University of Washington, but left after two months.",0.3333333333333333
common_voice_en_19547369.mp3,"It is approximately long, wide, and thick.",0.3333333333333333
