file,sentence,scorecommon_voice_en_19547400.mp3,"It is today a National Historic Landmark, but not open to the public.",0.3333333333333333
common_voice_en_19547461.mp3,"John Douglas-Gray in his thriller ""The Novak Legacy""",0.3333333333333333
common_voice_en_19547473.mp3,Other 'Lakheys' or demons are also said to be from this place.,0.3333333333333333
common_voice_en_19547480.mp3,I have been trouble enough to my relations in my day.,0.3333333333333333
common_voice_en_19547510.mp3,The next day Magne again had trouble.,0.3333333333333333
common_voice_en_19547530.mp3,Macdonald's career began while she was working as a barmaid in Glasgow.,0.3333333333333333
common_voice_en_19547534.mp3,His degrees included an M. Div.,0.3333333333333333
common_voice_en_19547553.mp3,The majority of the township is served by Dundee Community Schools.,0.3333333333333333
common_voice_en_19547694.mp3,Eighty Four was originally named Smithville.,0.3333333333333333
common_voice_en_19547828.mp3,He was early known in the pastoral genre.,0.3333333333333333
common_voice_en_19547860.mp3,Rochon had died that June after a long struggle with cancer.,0.3333333333333333
common_voice_en_19550894.mp3,The Vineyarders have a long-standing rivalry with Nantucket High School.,0.3333333333333333
common_voice_en_19550973.mp3,Two years later he succeeded his father as chief executive officer.,0.3333333333333333
common_voice_en_19552151.mp3,"The film also received three awards and was nominated for ""Best Film"".",0.3333333333333333
common_voice_en_19552195.mp3,I thought it was a perfect name for the album.,0.3333333333333333
common_voice_en_19552440.mp3,"In this context it may be called a ""continuation"".",0.3333333333333333
common_voice_en_19552563.mp3,"It lies near the German coast, west of the island of Juist.",0.3333333333333333
common_voice_en_19562756.mp3,The matter was taken on appeal to the United States Supreme Court.,0.3333333333333333
common_voice_en_19573619.mp3,These jobs included a long stretch with the London Underground.,0.3333333333333333
common_voice_en_19573620.mp3,"Since the town faces west, the sunsets are visible and are sometimes beautiful.",0.3333333333333333
common_voice_en_21137565.mp3,There are also numerous small groups which meet at the church during the week.,0.3333333333333333
common_voice_en_21139158.mp3,"Popular songs on the album include ""Dusty Turnaround"", ""Sometime"", and ""Holy Road"".",0.3333333333333333
common_voice_en_21139189.mp3,The team moved in that September.,0.3333333333333333
common_voice_en_21139263.mp3,"It was in the south-east of the county, roughly corresponding to today's Harborough district.",0.3333333333333333
common_voice_en_21139301.mp3,It is very popular in Eastern Europe.,0.3333333333333333
common_voice_en_21162453.mp3,Burroughs Street in Bon Air was named for the couple.,0.3333333333333333
common_voice_en_21162484.mp3,The school then named Doctor Alexander Guerry as its second headmaster.,0.3333333333333333
common_voice_en_21181890.mp3,It is also the earliest known European work to mention the game of Mancala.,0.3333333333333333
common_voice_en_21182063.mp3,He received his information from court records.,0.3333333333333333
common_voice_en_21185434.mp3,"Known locally as ""The Deuce"", it is a popular watering hole.",0.3333333333333333
common_voice_en_21185463.mp3,By now the team was struggling with injury.,0.3333333333333333
common_voice_en_21185482.mp3,"He is buried in Saint Philip's church yard, Birmingham.",0.3333333333333333
common_voice_en_21206808.mp3,"However, it lost this position in the two following years.",0.3333333333333333
common_voice_en_21207723.mp3,The original web site can still be seen.,0.3333333333333333
common_voice_en_21208019.mp3,"The High Road mentioned in ""Loch Lomond"" is also a reference to it.",0.3333333333333333
common_voice_en_21208420.mp3,"With this form for the displacement, the velocity now is found.",0.3333333333333333
common_voice_en_21208423.mp3,Besides there is no female saint in christianity with this name.,0.3333333333333333
common_voice_en_21209888.mp3,"During the end of the race, Schatz was in second place.",0.3333333333333333
common_voice_en_21210133.mp3,Members were especially numerous in Paris.,0.3333333333333333
common_voice_en_23893790.mp3,"Boston Town Football Club is a football club based in Boston, Lincolnshire, England.",0.3
common_voice_en_19852886.mp3,"Rubin's role was highlighted in a Public Broadcasting Service ""Frontline"" report, ""The Warning"".",0.3
common_voice_en_27325811.mp3,Seven cutters of the United States Coast Guard have borne the name Alert.,0.2857142857142857
common_voice_en_26350163.mp3,Numerous hotels are located there and the area has expanded into a tourist Mecca.,0.2857142857142857
common_voice_en_19962237.mp3,"In addition to several area lakes with swimming, boating and water sports.",0.2857142857142857
common_voice_en_22053848.mp3,"These are all along Margonda Raya and Cinere Raya, the main road through Depok.",0.2857142857142857
common_voice_en_23767416.mp3,You can do this experiment several times increasing electrode potentials from low to high.,0.2857142857142857
common_voice_en_19597593.mp3,Cilla Black introduced and closed each show by singing a theme song.,0.2857142857142857
common_voice_en_24569315.mp3,Grant laid out his agenda for good common school education.,0.2857142857142857
common_voice_en_18977858.mp3,"After his arrival, he bought into a cattle station near Kempsey, north of Sydney.",0.2857142857142857
common_voice_en_20048846.mp3,In June the group had their first Annual Meeting with eighteen people in attendance.,0.2857142857142857
common_voice_en_22749671.mp3,Early air conditioner units used water to cool the condenser.,0.2857142857142857
common_voice_en_24957159.mp3,"The north end of the lake is swampy, making navigation with a motorboat difficult.",0.2857142857142857
common_voice_en_26986070.mp3,"It was founded as Air Alba, operating for four years as a flying school.",0.2857142857142857
common_voice_en_27292840.mp3,The singles from this album helped launch the band to mainstream success.,0.2857142857142857
common_voice_en_19519450.mp3,Edith's father Amasa A. Redfield was a New York attorney and author.,0.2857142857142857
common_voice_en_19519471.mp3,"As the boar charged towards the old man, the son cried ""taga itay!"".",0.2857142857142857
common_voice_en_20196330.mp3,Serkis's film work in motion capture has been critically acclaimed.,0.2857142857142857
common_voice_en_27637639.mp3,"In addition, one charter schools and five private schools are located in the county.",0.2857142857142857
common_voice_en_27637765.mp3,The Men's Basketball team was coached for many years by Stan Gooch.,0.2857142857142857
common_voice_en_20999719.mp3,"They have four walking legs, a small pincer, a large pincer, and antennae.",0.2857142857142857
common_voice_en_19744912.mp3,"A fight ensues and Rayne decapitates her father, avenging her family.",0.2857142857142857
common_voice_en_19793980.mp3,"Southeast of Center, at Nelson Lake there is a large power plant.",0.2857142857142857
common_voice_en_19693240.mp3,"Their remains are interred at Woodlawn Cemetery in The Bronx, New York City.",0.2857142857142857
common_voice_en_18714929.mp3,Philo is the closest municipality to Blue Rock State Park.,0.2857142857142857
common_voice_en_18714952.mp3,Narlikar has received several national and international awards and honorary doctorates.,0.2857142857142857
common_voice_en_18714997.mp3,"The Windsor Blacks then began their activities, copying the Hampshire group.",0.2857142857142857
common_voice_en_18715664.mp3,"Apart from the Meuse river another waterway, the Albert Canal, passes through this town.",0.2857142857142857
common_voice_en_27269984.mp3,The paper publishes weekly during the university semesters and online throughout the year.,0.2857142857142857
common_voice_en_27284688.mp3,His elder brother James also served as a colonial officer on the island.,0.2857142857142857
common_voice_en_27284770.mp3,Sharon Miller began serving as script editor for this series.,0.2857142857142857
common_voice_en_27344596.mp3,It was a signature song of the music hall star Harry Champion.,0.2857142857142857
common_voice_en_19905289.mp3,"Another neurologist, Franz Nissl, began to work in the same asylum with Alzheimer.",0.2857142857142857
common_voice_en_23893369.mp3,"The roadway heads north through a wooded area, passing several farms.",0.2857142857142857
common_voice_en_23893528.mp3,Atlanta's dialect has traditionally been a variation of Southern American English.,0.2857142857142857
common_voice_en_23893788.mp3,"He was married to writer Katherine Govier, and has two children, Robin and Emily.",0.2857142857142857
common_voice_en_23893806.mp3,"Sapolsky was born in Brooklyn, New York, to immigrants from the Soviet Union.",0.2857142857142857
common_voice_en_23911882.mp3,"Previously the city housed a Brazilian school, Centro Educacional Canarinho.",0.2857142857142857
common_voice_en_19852814.mp3,Famous examples include English comedian David Mitchell.,0.2857142857142857
common_voice_en_19853448.mp3,"Chini River, which drains from the lake, flows into Pahang River.",0.2857142857142857
common_voice_en_19853485.mp3,Bentonia began as a postal town along the Illinois Central Railway.,0.2857142857142857
common_voice_en_19867623.mp3,"The Cebu Schools Athletic Foundation, Incorporated is based in the city.",0.2857142857142857
common_voice_en_19867733.mp3,The Buddhist Kothduwa temple is situated on an isolated island in the lake.,0.2857142857142857
common_voice_en_19867743.mp3,By the time of Choe's return Silla was in an advanced state of collapse.,0.2857142857142857
common_voice_en_20166558.mp3,The song combines elements of traditional Eastern as well as Western music.,0.2857142857142857
common_voice_en_20166899.mp3,Sunny Isles Beach is within the Miami-Dade County Public Schools system.,0.2857142857142857
common_voice_en_20167543.mp3,The album was produced by the John Butler Trio and Shaun O'Callaghan.,0.2857142857142857
common_voice_en_21507126.mp3,Calverton Park is served by the Calverton Park Police Department.,0.2857142857142857
common_voice_en_22758614.mp3,"He was son of Joseph Hayward, and was born in Wilton, near Salisbury, Wiltshire.",0.2857142857142857
common_voice_en_22758630.mp3,The United States participates in the Federation of International Lacrosse competitions.,0.2857142857142857
common_voice_en_22758689.mp3,I kept thinking of those clean-cut young American guards at Abu Ghraib.,0.2857142857142857
common_voice_en_22758696.mp3,For parliamentary purposes it falls within North West Cambridgeshire constituency.,0.2857142857142857
common_voice_en_25640260.mp3,"""The Lust..."" ended up being much more influential than the band originally thought.",0.2857142857142857
common_voice_en_25640313.mp3,"Burr has also written for ""The Atlantic"" on epidemiology and public health.",0.2857142857142857
common_voice_en_25640364.mp3,State education is managed by Barnsley Local Education Authority.,0.2857142857142857
common_voice_en_25641452.mp3,"Two main cash crops, coffee and cotton, flank the river.",0.2857142857142857
common_voice_en_28852456.mp3,It was also composer Yuzo Koshiro's first video game music soundtrack.,0.2857142857142857
common_voice_en_28852631.mp3,"The same year, the bridge carrying the highway over Edgemoor Road was completed.",0.2857142857142857
common_voice_en_28852659.mp3,"Iseult agrees to go, and the ship races home, white sails high.",0.2857142857142857
common_voice_en_28852733.mp3,"It is part of ""The Politically Incorrect Guide"" series by Regnery Publishing.",0.2857142857142857
common_voice_en_28853207.mp3,Many people and businesses help sponsor the picnic and donate money and time.,0.2857142857142857
common_voice_en_28853346.mp3,John Bratton's career soon moved from performer to composer and producer.,0.2857142857142857
common_voice_en_18838392.mp3,"The caverns were named the Zane Caverns, after the nearby village of Zanesfield.",0.2857142857142857
common_voice_en_18884688.mp3,The airport is located approximately three miles northeast of the central business district.,0.2857142857142857
common_voice_en_18884795.mp3,He died shortly afterwards and is buried in Saint Peter's graveyard Salesbury.,0.2857142857142857
common_voice_en_18896542.mp3,Bell City was situated along the Saint Louis Southwestern Railway.,0.2857142857142857
common_voice_en_18909317.mp3,"Their father, Albert Brown, was a prominent politician of the Old Granite State.",0.2857142857142857
common_voice_en_18909369.mp3,The road starts in Keswick and passes alongside Derwent Water.,0.2857142857142857
common_voice_en_18935304.mp3,"McKay campaigns across the state, his message growing more generic each day.",0.2857142857142857
common_voice_en_18946873.mp3,"Somerset had a son, Charles, with a mistress named Joan Hill.",0.2857142857142857
common_voice_en_18967246.mp3,The Sunflower County Library operates the Drew Public Library.,0.2857142857142857
common_voice_en_18985450.mp3,"The town is named after Russell Attwater, the pioneer land owner.",0.2857142857142857
common_voice_en_19547572.mp3,Future plans include a ramp and hangars on the north side of the airfield.,0.2857142857142857
common_voice_en_19547581.mp3,Elmont Memorial is also known for having its award-winning Model United Nations club.,0.2857142857142857
common_voice_en_19547698.mp3,Cereal cropping is also prevalent in the nutrient-rich soils of the South East.,0.2857142857142857
common_voice_en_19547826.mp3,William Sampson had served in the American Revolution with the Virginia troops.,0.2857142857142857
common_voice_en_19747049.mp3,"Born in Montgomery, Alabama, Smith was formerly a linebacker for the University of Alabama.",0.2857142857142857
common_voice_en_21139293.mp3,"Recently, hobbyists have started designing and building examples of the early instruments.",0.2857142857142857
common_voice_en_21139513.mp3,"At an early stage in secondary education, Bush dropped out of school.",0.2857142857142857
common_voice_en_21159967.mp3,The Young Progressive Democrats earned coverage in the national media in the past.,0.2857142857142857
common_voice_en_21207750.mp3,"After a nuclear war engulfs the earth, she is born as a half-medusa half-harpy.",0.2857142857142857
common_voice_en_21208384.mp3,"The moviemakers built a bandstand on the town common, which still stands there today.",0.2857142857142857
common_voice_en_21208419.mp3,His brother Jim Baker was also a footballer who played for Leeds United.,0.2857142857142857
common_voice_en_21209797.mp3,"""Acorn"" refers to a fictitious town somewhere in isolated west Texas.",0.2857142857142857
common_voice_en_21209953.mp3,"It includes the villages of Royalton, South Royalton, and North Royalton.",0.2857142857142857
common_voice_en_21210095.mp3,"Jonas was born with a cleft lip, undergoing three surgeries within his first year.",0.2857142857142857
common_voice_en_21229016.mp3,"After launch, the game received generally positive reviews from critics.",0.2857142857142857
common_voice_en_19642355.mp3,Support for video game regulation has at times been linked to moral panic.,0.25
common_voice_en_19962333.mp3,They are white circles that can be both in groups and single.,0.25
common_voice_en_31289370.mp3,The top four teams of each group advanced to the second stage.,0.25
common_voice_en_19616287.mp3,He also represents matter in its lifeless state.,0.25
common_voice_en_18497004.mp3,I've been transferred between offices a dozen times already.,0.25
common_voice_en_26986213.mp3,Clovis High also has numerous choirs.,0.25
common_voice_en_20284803.mp3,The player can jump off of the dinosaur at any time.,0.25
common_voice_en_27560836.mp3,The cup glory continued the following year.,0.25
common_voice_en_20562387.mp3,It should also be working with the community for the benefit of the community.,0.25
common_voice_en_23767411.mp3,Honeywell started shopping around for just such a system at about this time.,0.25
common_voice_en_141401.mp3,Two women stand outside with a young girl.,0.25
common_voice_en_23893339.mp3,He is currently incarcerated in the New Jersey State Prison.,0.25
common_voice_en_22708434.mp3,The local police arrested a member of staff whom Faulds believed to be innocent.,0.25
common_voice_en_18977850.mp3,Martin Schempp was born in Stuttgart.,0.25
common_voice_en_18977851.mp3,Clothes are soaked in a solvent other than water.,0.25
common_voice_en_18977867.mp3,It is completely surrounded by the City of Palmdale.,0.25
common_voice_en_20176966.mp3,Several of his students went on to become bishops in the Church in Wales.,0.25
common_voice_en_19717529.mp3,United States Northern Command is the controlling Unified Combatant Command.,0.25
common_voice_en_19717646.mp3,"Talk of your German universities, said the little old man.",0.25
common_voice_en_20029536.mp3,What is clear is that the game has deeply evolved.,0.25
common_voice_en_20029561.mp3,"Archer also turned out for the Marylebone Cricket Club and Shropshire, a minor county.",0.25
common_voice_en_22443827.mp3,"She was born in Levanger, and studied for a cand.mag.",0.25
common_voice_en_22443833.mp3,She subsequently spent several years in Italy.,0.25
common_voice_en_22443932.mp3,Portions of the Alamosa-Durango Line survive to this day.,0.25
common_voice_en_20048849.mp3,"He escaped unhurt, but his war minister, Marshal Bittencourt, died defending him.",0.25
common_voice_en_20049027.mp3,Both were already established as painters at the time of their marriage.,0.25
common_voice_en_20049349.mp3,Cunningham choreographed almost two hundred works for his company.,0.25
common_voice_en_22749679.mp3,Diane's son was paralyzed from the chest down.,0.25
common_voice_en_22749699.mp3,He was professor of zoology at the University of Halle.,0.25
common_voice_en_24895697.mp3,Wood Buffalo is located directly north of the Athabasca Oil Sands.,0.25
common_voice_en_24949178.mp3,He was particularly noted for his work on protecting the natural environment.,0.25
common_voice_en_23830007.mp3,Guy was married to Beverly Guy.,0.25
common_voice_en_23830015.mp3,"His head was always high, his mane was always flying.",0.25
common_voice_en_23846346.mp3,The Incahuasi Archeological complex is located there.,0.25
common_voice_en_23846356.mp3,"""Black Hawk"" was a name that Brigham Young, in jest, called the Ute leader.",0.25
common_voice_en_23846359.mp3,"Local stores are Co-op on Willoughby Road, and Asda on Burringham Road.",0.25
common_voice_en_23846399.mp3,"He is interred at the United States Naval Academy Cemetery in Annapolis, Maryland.",0.25
common_voice_en_26985968.mp3,There seemed nothing common or unclean that fresh morning.,0.25
common_voice_en_19519436.mp3,File rate is different from service level.,0.25
common_voice_en_19519439.mp3,He was well known as a lecturer on English literature and the Orient.,0.25
common_voice_en_19946508.mp3,"""The Pebbles and Bamm-Bamm Show"" is the first spinoff series of ""The Flintstones"".",0.25
common_voice_en_19946555.mp3,These accounts may also refer to the Selk'nam people.,0.25
common_voice_en_19946558.mp3,A related data structure is the Young tableau.,0.25
common_voice_en_19946621.mp3,The Dolly Copp campground is located here.,0.25
common_voice_en_19946654.mp3,"This made Benji annoyed, and he tried to make him choose a team.",0.25
common_voice_en_19946670.mp3,It is the administrative headquarters of Dungarpur District.,0.25
common_voice_en_19946674.mp3,The original Canadian cassette issue of this album came in a glow-in-the-dark cassette shell.,0.25
common_voice_en_19946700.mp3,After this no new praetors were added even though the number of provinces increased.,0.25
common_voice_en_27637591.mp3,MacDonald has since started another relationship and married.,0.25
common_voice_en_27637702.mp3,"Cournoyer was born in Drummondville, Quebec.",0.25
common_voice_en_27637831.mp3,Croatia is a major tourist centre.,0.25
common_voice_en_89079.mp3,A young kid is walking very carefully.,0.25
common_voice_en_21183215.mp3,It lives in water at about above sea level.,0.25
common_voice_en_21183217.mp3,The quality of the river has now greatly improved.,0.25
common_voice_en_21183277.mp3,"Together, the couple has four children, ten grandchildren and two great-grandchildren.",0.25
common_voice_en_21183323.mp3,"He served under Sherman, who regarded him highly.",0.25
common_voice_en_21183327.mp3,"Willy is controlled using only left, right and jump.",0.25
common_voice_en_30650356.mp3,The song also charted in Austria and Switzerland.,0.25
common_voice_en_30650437.mp3,Its site is located in Asiatic Turkey.,0.25
common_voice_en_30650438.mp3,Louis Turner was the team captain.,0.25
common_voice_en_19744068.mp3,"First, he received a Fellowship from the Rockefeller Foundation.",0.25
common_voice_en_19744544.mp3,"He was educated by the Irish Christian Brothers at Saint Mary's College, Crosby.",0.25
common_voice_en_19744886.mp3,It is part of the London census metropolitan area.,0.25
common_voice_en_19751408.mp3,The ad aired again during the Republican National Convention.,0.25
common_voice_en_19793965.mp3,Vincent was born in Toulouse in Gaul.,0.25
common_voice_en_19692698.mp3,"No additional information has been located, and its fate is unknown.",0.25
common_voice_en_19692953.mp3,"Andrews enlisted Jules to sing the song, while Andrews himself played the piano.",0.25
common_voice_en_19692962.mp3,Today it is occupied by a golf club and the Musick Memorial Radio Station.,0.25
common_voice_en_19693090.mp3,The Eastern crosier is found in two common forms.,0.25
common_voice_en_19693142.mp3,He coined Thai words from English which are in use today.,0.25
common_voice_en_19693154.mp3,"Early on, he was an actor in at the Burgtheater in Vienna.",0.25
common_voice_en_19693193.mp3,"Attree writes as the editor at large for the satirical magazine ""The Chap"".",0.25
common_voice_en_19693212.mp3,"A novel, ""Opening Day"", was published the following year.",0.25
common_voice_en_19693265.mp3,"A four-time Pro Bowl selection, Madison also played for the New York Giants.",0.25
common_voice_en_18714950.mp3,Kingswear is not mentioned in the Domesday Book.,0.25
common_voice_en_18714978.mp3,It is often erroneously called Masson's trichrome.,0.25
common_voice_en_18715610.mp3,John Lanham is currently Chairman of the Parish.,0.25
common_voice_en_18715652.mp3,Elmhurst is located at above sea level.,0.25
common_voice_en_18715661.mp3,At the time of his death only the horse had been cast.,0.25
common_voice_en_18715662.mp3,It will be renamed South Coast Marketplace.,0.25
common_voice_en_18715676.mp3,"He now teaches at the University of California, Irvine.",0.25
common_voice_en_27270001.mp3,The exact form of the angels is uncertain.,0.25
common_voice_en_27284720.mp3,Carrasquel was married to Virginia Johnson.,0.25
common_voice_en_27284744.mp3,There was always a family presence and the locals protected us.,0.25
common_voice_en_27344551.mp3,He continued his secondary education in Ravenna at the Dante Alighieri High School.,0.25
common_voice_en_27344649.mp3,"She has been called one of ""Australia's most important and admired writers"".",0.25
common_voice_en_25353880.mp3,This gave them political and military power over the people.,0.25
common_voice_en_25353916.mp3,He has also appeared several times on the Audi Channel.,0.25
common_voice_en_25357984.mp3,"This game is similar in concept to the venerable ""Starfire"" system.",0.25
common_voice_en_25359217.mp3,Watford Stadium station will not re-open.,0.25
common_voice_en_25359389.mp3,It's resistant to small arms fire and shrapnel.,0.25
common_voice_en_25380141.mp3,Reading disorder is also called dyslexia.,0.25
common_voice_en_25380226.mp3,The Bears eventually make it to the championship game.,0.25
common_voice_en_19905124.mp3,With Hapoel he won an Israeli State Cup.,0.25
common_voice_en_19905171.mp3,Eutychius was born at Theium in Phrygia.,0.25
common_voice_en_19905233.mp3,"Later, Russian forces used it in the First Chechen War.",0.25
common_voice_en_19905235.mp3,The title track is known by a number of slightly different names.,0.25
common_voice_en_19905288.mp3,"Following German reunification, the East German leagues were merged into the West German system.",0.25
common_voice_en_23893408.mp3,"Bulfinch himself lived on Bowdoin Street, briefly.",0.25
common_voice_en_23893457.mp3,The bureau was re-integrated into Tupolev the following year.,0.25
common_voice_en_23893524.mp3,This characteristic derives from large numbers of fine white hairs on the leaves.,0.25
common_voice_en_23893687.mp3,There exist several circulating outtakes from the album.,0.25
common_voice_en_23893756.mp3,Thaxton earned a doctorate in physical chemistry from Iowa State University.,0.25
common_voice_en_23893769.mp3,"As a young child, he was adopted from an orphanage.",0.25
common_voice_en_23893795.mp3,The yolk is absorbed by the developing young.,0.25
common_voice_en_23893820.mp3,At that time there were no printing shops in Finland.,0.25
common_voice_en_23911915.mp3,During her early childhood she was a ballet dancer.,0.25
common_voice_en_19852663.mp3,Paris Dauphine University is nearby.,0.25
common_voice_en_19852665.mp3,"Sutro was born in Aachen, Germany.",0.25
common_voice_en_19852943.mp3,Eight women in all have won this award multiple times.,0.25
common_voice_en_19853435.mp3,He also had a further son and a daughter from a previous marriage.,0.25
common_voice_en_19853440.mp3,It is a leftbank tributary to the river Meuse.,0.25
