uoa_nz_mansfield_sh_0025.wav,all the ladies eat to especially the ladies
uoa_nz_mansfield_sh_0026.wav,every Sunday morning
uoa_nz_mansfield_sh_0027.wav,heaven knows what infectious disease may be breeding now in that boots
uoa_nz_mansfield_sh_0028.wav,and then in the Rocky Gateway the shepherd himself appeared
uoa_nz_mansfield_sh_0029.wav,even for the most jaded of us life holds its thrilling moments
uoa_nz_mansfield_sh_0030.wav,the piles of dirty cups dirty dishes were washed and dried
uoa_nz_mansfield_sh_0031.wav,why did the photographs of dead people always fade so
uoa_nz_mansfield_sh_0032.wav,fastidiously his lips curling Andreas picked his way through the water
uoa_nz_mansfield_sh_0033.wav,The Poets from Munich never took his eyes off the pear
uoa_nz_mansfield_sh_0034.wav,but I was exceedingly nice a trifle diffident appropriately reverential
uoa_nz_mansfield_sh_0035.wav,a nice shake up in the bus never improved his appetite
uoa_nz_mansfield_sh_0036.wav,thought Viola and looking at him again he did not seem quite so jolly
uoa_nz_mansfield_sh_0037.wav,he wore a very Chevy dressing gown and carried a crumpled newspaper in one hand
uoa_nz_mansfield_sh_0038.wav,she said horrified however are we going to stop everything
uoa_nz_mansfield_sh_0039.wav,Stan Lee was halfway up The Path Before He Saw Linda
uoa_nz_mansfield_sh_0040.wav,and in a vacant chair beside him he placed a little black leather bag
uoa_nz_mansfield_sh_0041.wav,all the exhibitions all the Art and Soul life of Germany are in Munchen
uoa_nz_mansfield_sh_0042.wav,the servant brought in veal with sauerkraut and potatoes
uoa_nz_mansfield_sh_0043.wav,he put his face into her bosom and his arms and folded her
uoa_nz_mansfield_sh_0044.wav,the Samuel Joseph's never played by themselves or managed their own game
uoa_nz_mansfield_sh_0045.wav,the professor Drew in his feet and set up sharply pulling down his waistcoat
uoa_nz_mansfield_sh_0046.wav,she came to my bedroom and offered to massage my arm
uoa_nz_mansfield_sh_0047.wav,now there is something peculiarly intimate and sharing an umbrella
uoa_nz_mansfield_sh_0048.wav,that's one thing I can do said I laughing brightly
uoa_nz_mansfield_sh_0049.wav,and just look at this new guy he cried ecstatically just look at it
uoa_nz_mansfield_sh_0050.wav,just the butterfly always came down in a silk Peter coach and a kimono jacket
uoa_nz_mansfield_sh_0051.wav,he looked as though he could order a magnificent dinner
uoa_nz_mansfield_sh_0052.wav,I told young girl got out leading a child by the hand
uoa_nz_mansfield_sh_0053.wav,they watch their Forks upon black bread and started again
uoa_nz_mansfield_sh_0054.wav,to her relief Grandma seemed no longer sad
uoa_nz_mansfield_sh_0055.wav,on his lap their Lair beautiful pale yellow silk handkerchief
uoa_nz_mansfield_sh_0056.wav,there were no white Dunes covered with reddish grass Beyond them
uoa_nz_mansfield_sh_0057.wav,he looked down at the row of garden strips and backyards
uoa_nz_mansfield_sh_0058.wav,he also forsook work and stood by the window picking his nose
uoa_nz_mansfield_sh_0059.wav,a young girl scratched a lullaby on a young fiddle
uoa_nz_mansfield_sh_0060.wav,in Austria even the cab man have serviettes
uoa_nz_mansfield_sh_0061.wav,she dipped a piece of sugar in her coffee and watched it dissolve
uoa_nz_mansfield_sh_0062.wav,that made the student from Barnes sit
uoa_nz_mansfield_sh_0063.wav,I order double portions and eat them in peace
uoa_nz_mansfield_sh_0064.wav,we shouldn't be able to hear each other speak
uoa_nz_mansfield_sh_0065.wav,from the hollow classrooms came a quick drumming of voices
uoa_nz_mansfield_sh_0066.wav,she had meant to have fish mayonnaise for lunch and now
uoa_nz_mansfield_sh_0067.wav,but should never heard his name until she saw it on the theaters
uoa_nz_mansfield_sh_0068.wav,go on now clear out
uoa_nz_mansfield_sh_0069.wav,I think he's a little gone here tapping her forehead
uoa_nz_mansfield_sh_0070.wav,sometimes I think the solution lies in marriage Sid Fraulein Sonia
uoa_nz_mansfield_sh_0071.wav,and the carpet we made ourselves out of old clothes
uoa_nz_mansfield_sh_0072.wav,they entered the whole were greeted and shown to their room
uoa_nz_mansfield_sh_0073.wav,I suppose you are frightened of an invasion to a
uoa_nz_mansfield_sh_0074.wav,I must be back in London in September
uoa_nz_mansfield_sh_0075.wav,the dishes were changed for beef red currants and spinach
uoa_nz_mansfield_sh_0076.wav,you will marry a redhead man and have three children
uoa_nz_mansfield_sh_0077.wav,I've left them at the hotel for you to digest later on
uoa_nz_mansfield_sh_0078.wav,she would like to have kept those wisps as a Keepsake as a remembrance
uoa_nz_mansfield_sh_0079.wav,Isabel we're all going for a bath
uoa_nz_mansfield_sh_0080.wav,he's only staying until tomorrow evening
uoa_nz_mansfield_sh_0081.wav,the icy wind blew out her apron into a balloon
uoa_nz_mansfield_sh_0082.wav,I think I prefer both equally well
uoa_nz_mansfield_sh_0083.wav,nurse Andrews head of course jumped at the idea
uoa_nz_mansfield_sh_0084.wav,four men in their shirt sleeves stood grouped together on the Garden Path
uoa_nz_mansfield_sh_0085.wav,she breathed in a small whisper to the boy hello my funny
uoa_nz_mansfield_sh_0086.wav,funded the Gray beard with pristine freshness
uoa_nz_mansfield_sh_0087.wav,my insides are all twisted up with having children too quickly
uoa_nz_mansfield_sh_0088.wav,a delicate woman volunteered the Hungarian but Pleasant
uoa_nz_mansfield_sh_0089.wav,do you know that poem of sapo about her hands in the Stars
uoa_nz_mansfield_sh_0090.wav,my peaceful attitude of mine towards it is completely destroyed
uoa_nz_mansfield_sh_0091.wav,psychologically I understood your refusal
uoa_nz_mansfield_sh_0092.wav,not even an efficient waiter can you have by yourselves
uoa_nz_mansfield_sh_0093.wav,will you to a Convent fly so young So Fresh So Far
uoa_nz_mansfield_sh_0094.wav,when the door was closed we raised a triumphant cry
uoa_nz_mansfield_sh_0095.wav,oh what a load something to have done
uoa_nz_mansfield_sh_0096.wav,I think it's up to Moira to use her little ads and Wiles
uoa_nz_mansfield_sh_0097.wav,our client moreover is positive
uoa_nz_mansfield_sh_0098.wav,she turned away from the Buddha with one of her vague gestures
uoa_nz_mansfield_sh_0099.wav,but it was most unfortunate
uoa_nz_mansfield_sh_0100.wav,but it all seemed blurred unreal like a picture in the newspaper
uoa_nz_mansfield_sh_0101.wav,why is it so exciting to be awake when everybody else is asleep
uoa_nz_mansfield_sh_0102.wav,Heaven reward thee sweet patience lady mine he murmured
uoa_nz_mansfield_sh_0103.wav,what are you looking at my grandma
uoa_nz_mansfield_sh_0104.wav,but Lottie always makes a floating island don't you Lottie
uoa_nz_mansfield_sh_0105.wav,ignorance must not go uncontradicted
uoa_nz_mansfield_sh_0106.wav,and so large that I can go down there and walk about
uoa_nz_mansfield_sh_0107.wav,he allowed slightly hash voice filled the salon
uoa_nz_mansfield_sh_0108.wav,it is beautiful enough to hang from a Watch chain
uoa_nz_mansfield_sh_0109.wav,she asked leaning her arms on the table and pillowing her breasts against them
uoa_nz_mansfield_sh_0110.wav,which resolution comforted her absolutely
uoa_nz_mansfield_sh_0111.wav,Youngblood answered the hair rat Genie
uoa_nz_mansfield_sh_0112.wav,naturally absent from home one must expect much discomfort and strange food
uoa_nz_mansfield_sh_0113.wav,Paw Patrol
uoa_nz_mansfield_sh_0114.wav,each year I come expecting to find you with an empty nest
uoa_nz_mansfield_sh_0115.wav,Frau Hoffman I congratulate you
uoa_nz_mansfield_sh_0116.wav,I chewed a leaf and hugged my knees
uoa_nz_mansfield_sh_0117.wav,they Sway and languish extremely and we close pressed are kissing their
uoa_nz_mansfield_sh_0118.wav,she very obviously followed the advice
uoa_nz_mansfield_sh_0119.wav,somehow or other he managed to shake some sort of smile at her
uoa_nz_mansfield_sh_0120.wav,he flung his head onto the huge bed and went towards her
uoa_nz_mansfield_sh_0121.wav,the straw basket of programs was tossed from arm to arm
uoa_nz_mansfield_sh_0122.wav,peering through that round eye she could see fire off some rocks
uoa_nz_mansfield_sh_0123.wav,I saw a beautiful umbrella broken in half like that on my way over
uoa_nz_mansfield_sh_0124.wav,a lady with a box of sardines said Dennis Gravely
uoa_nz_mansfield_sh_0125.wav,she was sitting in the open taxi outside
uoa_nz_mansfield_sh_0126.wav,I could have sworn I left a teaspoon full of cocoa in the tin
uoa_nz_mansfield_sh_0127.wav,the result looked like a gigantic Dustbin
uoa_nz_mansfield_sh_0128.wav,I say he cried there's an English bulldog
uoa_nz_mansfield_sh_0129.wav,there's some marmalade in the sideboard
uoa_nz_mansfield_sh_0130.wav,must they be hidden by a Mackey
uoa_nz_mansfield_sh_0131.wav,it was muffled as though the dog had its head in a sack
uoa_nz_mansfield_sh_0132.wav,draw up your chair my dear said Mrs Stubbs beginning to pour out
uoa_nz_mansfield_sh_0133.wav,The Bell jangled the red surge curtains parted and Mrs Stubbs appeared
uoa_nz_mansfield_sh_0134.wav,pity to have made herself so conspicuous
uoa_nz_mansfield_sh_0135.wav,yes that was her real grudge against life
uoa_nz_mansfield_sh_0136.wav,Linda saw that River very wide covered with little rafts and boats
uoa_nz_mansfield_sh_0137.wav,she was a long strange looking woman with narrow hands and feet
uoa_nz_mansfield_sh_0138.wav,first man in as usual
uoa_nz_mansfield_sh_0139.wav,big twists and curls jostled and shouldered each other as the Silvery beams broadened
uoa_nz_mansfield_sh_0140.wav,how could the poor darling help not having any money
uoa_nz_mansfield_sh_0141.wav,I'd far rather you loved other things Sid the strange man slowly
uoa_nz_mansfield_sh_0142.wav,she is the Incarnation of comprehending love
uoa_nz_mansfield_sh_0143.wav,after all they were young still
uoa_nz_mansfield_sh_0144.wav,he'd take her away and I'd love about to give us somewhere
uoa_nz_mansfield_sh_0145.wav,2 Stone heavier than I if he's a pound thought Andreas
uoa_nz_mansfield_sh_0146.wav,it doesn't matter they're all busy upstairs
uoa_nz_mansfield_sh_0147.wav,lights were turned on immediately the cafe opened and business was very brisk
uoa_nz_mansfield_sh_0148.wav,is red face was covered with pimples and his nails in describable filthy
uoa_nz_mansfield_sh_0149.wav,would you come with me as far as the railway station and back
uoa_nz_mansfield_sh_0150.wav,and retired the very young gentleman dodging her trained and scowling
uoa_nz_mansfield_sh_0151.wav,it is a great pity that the English nation is so unusual
uoa_nz_mansfield_sh_0152.wav,but doubtless they have not the same symbolical value for the English
uoa_nz_mansfield_sh_0153.wav,the quantity of fruit I have eaten on this bench he sighed
uoa_nz_mansfield_sh_0154.wav,that is almost a mouthful in itself
uoa_nz_mansfield_sh_0155.wav,or perhaps you do not care to eat the worms
uoa_nz_mansfield_sh_0156.wav,you go into the bedroom and fetch my blue silk handkerchief
uoa_nz_mansfield_sh_0157.wav,nothing rested him so much then as for me to stroke his head
uoa_nz_mansfield_sh_0158.wav,Dia Frau Fisher once you take your coffee out in the garden
uoa_nz_mansfield_sh_0159.wav,four of the clock one July afternoon she appeared at the pension Muller
uoa_nz_mansfield_sh_0160.wav,but they are beautifully kept said the sister of the baroness Shiley
uoa_nz_mansfield_sh_0161.wav,but she graciously suffered our worship and we were more than content
uoa_nz_mansfield_sh_0162.wav,I found myself pitying the baron
uoa_nz_mansfield_sh_0163.wav,there you are I said
uoa_nz_mansfield_sh_0164.wav,no man had a right to such eyes such lashes and such lips
uoa_nz_mansfield_sh_0165.wav,Harold was too handsome to handsome by far
uoa_nz_mansfield_sh_0166.wav,Harold hadn't come back from lunch until close on 4:00
uoa_nz_mansfield_sh_0167.wav,no she said I won't go outside
uoa_nz_mansfield_sh_0168.wav,no she said I won't go outside
uoa_nz_mansfield_sh_0169.wav,how strange should never thought of it like that before
uoa_nz_mansfield_sh_0170.wav,they sat outside the house in Long chairs under colored parasols
uoa_nz_mansfield_sh_0171.wav,we shall have to anoint ourselves with butter said Dennis
uoa_nz_mansfield_sh_0172.wav,he touched her cool hand her cool cheek
uoa_nz_mansfield_sh_0173.wav,it would frighten ethyl out of her life
uoa_nz_mansfield_sh_0174.wav,she unhooked her Warren jacket and hung that up to
uoa_nz_mansfield_sh_0175.wav,but it was a Charming are
uoa_nz_mansfield_sh_0176.wav,she put the big frothing cups before them and pushed across my clear glass
uoa_nz_mansfield_sh_0177.wav,when a faint violin sounded she winced and bit her lip again
uoa_nz_mansfield_sh_0178.wav,calm yourself she said superbly
uoa_nz_mansfield_sh_0179.wav,how long how Wicked feeling as I do
uoa_nz_mansfield_sh_0180.wav,he tried to smile to say I'm glad
uoa_nz_mansfield_sh_0181.wav,it is tomorrow that you're going isn't it
uoa_nz_mansfield_sh_0182.wav,but his luck gave him a nasty jar to say the least almost immediately
uoa_nz_mansfield_sh_0183.wav,it was 35 years old
uoa_nz_mansfield_sh_0184.wav,but at that moment in the street below a barrel organ struck up
uoa_nz_mansfield_sh_0185.wav,they are such awfully nice men
uoa_nz_mansfield_sh_0186.wav,the very idea made one shutter
uoa_nz_mansfield_sh_0187.wav,I've got the name somewhere on the back of an envelope
uoa_nz_mansfield_sh_0188.wav,she had no idea that he was Gray
uoa_nz_mansfield_sh_0189.wav,that's a more intolerable situation than the other
uoa_nz_mansfield_sh_0190.wav,but Jonathan only answered a Little Love a Little kindness
uoa_nz_mansfield_sh_0191.wav,she hated her grandma to be sad
uoa_nz_mansfield_sh_0192.wav,he could not be disloyal
uoa_nz_mansfield_sh_0193.wav,and when you turned it over the outside was a deep bronze color
uoa_nz_mansfield_sh_0194.wav,they were the trout boys
uoa_nz_mansfield_sh_0195.wav,No Time to Say Goodbye
uoa_nz_mansfield_sh_0196.wav,you haven't been using it to poke the kitchen fire with by any chance
uoa_nz_mansfield_sh_0197.wav,their cry sounded in the dreams of little children
uoa_nz_mansfield_sh_0198.wav,and now big spots of light gleamed in the Mist
uoa_nz_mansfield_sh_0199.wav,then something immense came into view
uoa_nz_mansfield_sh_0200.wav,why even a prostitute has a greater sense of generosity
uoa_nz_mansfield_sh_0201.wav,he paused by the window and glanced at her a moment over his shoulder
uoa_nz_mansfield_sh_0202.wav,what does the Pussycat do all day
uoa_nz_mansfield_sh_0203.wav,I just saw her go out to buy some
uoa_nz_mansfield_sh_0204.wav,they had looked at each other stand with the conflict and sympathized
uoa_nz_mansfield_sh_0205.wav,I know no such name in a sharp voice
uoa_nz_mansfield_sh_0206.wav,you look like a little boy with your hair blowing about and the wind
uoa_nz_mansfield_sh_0207.wav,Oh What a Beautiful Noble idea
uoa_nz_mansfield_sh_0208.wav,as you please send the landlord obviously scorning us
uoa_nz_mansfield_sh_0209.wav,but by that time she had to pick out the washing for the Frau
uoa_nz_mansfield_sh_0210.wav,shouted hands hitting Anton over the head with his empty cup
uoa_nz_mansfield_sh_0211.wav,she's got twice the nerve of you and me rolled into one
uoa_nz_mansfield_sh_0212.wav,he wore an immense geranium flower stuck in the lapel of his coat
uoa_nz_mansfield_sh_0213.wav,straight away Andreas felt that he was being accused
uoa_nz_mansfield_sh_0214.wav,from the Pine Forest streamed wild perfume the branches swayed together rhythmically sonorously
uoa_nz_mansfield_sh_0215.wav,then you are an English woman
uoa_nz_mansfield_sh_0216.wav,oh I spend the day here now she answered
uoa_nz_mansfield_sh_0217.wav,what a fire she shrieked stretching out her hands
uoa_nz_mansfield_sh_0218.wav,oh mama please don't say such things Sonya flushed and grew very angry
uoa_nz_mansfield_sh_0219.wav,such a brilliant way of putting things
uoa_nz_mansfield_sh_0220.wav,this is my little English friend of whom I have spoken
uoa_nz_mansfield_sh_0221.wav,such a cloud on the air as you gave me
uoa_nz_mansfield_sh_0222.wav,her rough and hands clasped and unclass themselves in the folds of her skirt
uoa_nz_mansfield_sh_0223.wav,that's not how a wedding should be she said
uoa_nz_mansfield_sh_0224.wav,you must tuck the ends into your boots until we get there
uoa_nz_mansfield_sh_0225.wav,but I consider childbearing the most ignominious of all professions I said
uoa_nz_mansfield_sh_0226.wav,I said he was a sea captain on a long and perilous voyage
uoa_nz_mansfield_sh_0227.wav,when I meet new people I squeeze them dry like a sponge
uoa_nz_mansfield_sh_0228.wav,a chestnut tree pushed green Bells against the window
uoa_nz_mansfield_sh_0229.wav,I am not accustomed to such company
uoa_nz_mansfield_sh_0230.wav,he and Frau Fisher were old friends
uoa_nz_mansfield_sh_0231.wav,you do not seem to enjoy discussing the functions of the body
uoa_nz_mansfield_sh_0232.wav,her Highborn reply was what interested me
uoa_nz_mansfield_sh_0233.wav,youth should be like a wild rose
uoa_nz_mansfield_sh_0234.wav,coffee and rolls took on the nature of an orgy
uoa_nz_mansfield_sh_0235.wav,Afflicted children have such pretty ways
uoa_nz_mansfield_sh_0236.wav,I really do not know I answered
uoa_nz_mansfield_sh_0237.wav,I assure you we are not afraid
uoa_nz_mansfield_sh_0238.wav,how long are you remaining here
uoa_nz_mansfield_sh_0239.wav,whoever heard of having children upon vegetables
uoa_nz_mansfield_sh_0240.wav,I have not eaten meat for 3 years
uoa_nz_mansfield_sh_0241.wav,my lady put me into colors and cuffs from the first
uoa_nz_mansfield_sh_0242.wav,they were ever so kind to me
uoa_nz_mansfield_sh_0243.wav,come along I'd say come along and I'll lay out your patience for you
uoa_nz_mansfield_sh_0244.wav,but it's always boiling before my lady is half through
uoa_nz_mansfield_sh_0245.wav,she looked at Ethel over her spectacles
uoa_nz_mansfield_sh_0246.wav,The Carriage Gates were pushed back
uoa_nz_mansfield_sh_0247.wav,they are hard to resist
uoa_nz_mansfield_sh_0248.wav,they are eagerly bought by the soldiers
uoa_nz_mansfield_sh_0249.wav,she lay on his breast but so lightly so remotely
uoa_nz_mansfield_sh_0250.wav,he bent over her and she looked up with her familiar half smile
uoa_nz_mansfield_sh_0251.wav,his heart was wrong with such a spasm that he could have cried out
uoa_nz_mansfield_sh_0252.wav,he was something between the Sheepdog and the shepherd
uoa_nz_mansfield_sh_0253.wav,as much expression as you can put into it
uoa_nz_mansfield_sh_0254.wav,the willow trees outside the high narrow Windows waved in the Wind
uoa_nz_mansfield_sh_0255.wav,she didn't even recognize him again
uoa_nz_mansfield_sh_0256.wav,and when Leila compared him with her other partners he looked shabby
uoa_nz_mansfield_sh_0257.wav,it gave her quite a shock again to see how old he was
uoa_nz_mansfield_sh_0258.wav,draw the faint voice close to her ear
uoa_nz_mansfield_sh_0259.wav,make passed him on to Layla
uoa_nz_mansfield_sh_0260.wav,there was a joyful flutter among the girls
uoa_nz_mansfield_sh_0261.wav,strange voices answered of course my dear
uoa_nz_mansfield_sh_0262.wav,it must have had a knock somehow
uoa_nz_mansfield_sh_0263.wav,1 golden hour sit with 60 Diamond minutes
uoa_nz_mansfield_sh_0264.wav,they're lying to one side on an immense bed lay Grandpa
uoa_nz_mansfield_sh_0265.wav,but Grandma remembered too at the same time
uoa_nz_mansfield_sh_0266.wav,such a very nice stewardess came to meet them
uoa_nz_mansfield_sh_0267.wav,grandma made a small astonished face
uoa_nz_mansfield_sh_0268.wav,he clasped grandma in his arms and pressed her to him
uoa_nz_mansfield_sh_0269.wav,beside him her grandma bustled along and her crackling black Ulster
uoa_nz_mansfield_sh_0270.wav,look here said William how are we going to sit
uoa_nz_mansfield_sh_0271.wav,may they hid William Leck not ointment
uoa_nz_mansfield_sh_0272.wav,you think they are another bad sign
uoa_nz_mansfield_sh_0273.wav,we are inclined to reconsider
uoa_nz_mansfield_sh_0274.wav,my pocket threw the counterpane over the bed
uoa_nz_mansfield_sh_0275.wav,my pocket gave no answer
uoa_nz_mansfield_sh_0276.wav,will you stay in the car while I go and look
uoa_nz_mansfield_sh_0277.wav,and then we were outside again
uoa_nz_mansfield_sh_0278.wav,I sipped my tea leaned back and even asked if I might smoke
uoa_nz_mansfield_sh_0279.wav,oh well there seems nowhere else said she
uoa_nz_mansfield_sh_0280.wav,how can you talk of cutting off now
uoa_nz_mansfield_sh_0281.wav,oh if you only knew how hard I feel
uoa_nz_mansfield_sh_0282.wav,and where are you going if your mother may ask
uoa_nz_mansfield_sh_0283.wav,it was the Shadow from the tree outside
uoa_nz_mansfield_sh_0284.wav,well we can't postpone it again said Josephine
uoa_nz_mansfield_sh_0285.wav,oh eggs in various forms
uoa_nz_mansfield_sh_0286.wav,and this time said Josephine firmly we must come to a definite decision
uoa_nz_mansfield_sh_0287.wav,she raised her pale eyebrows until they rippled away into her pale hair
uoa_nz_mansfield_sh_0288.wav,ask Josephine trying to begin to concentrate
uoa_nz_mansfield_sh_0289.wav,I'm afraid I shouldn't be able to stay very long with grandfather
uoa_nz_mansfield_sh_0290.wav,but we mustn't let you off with that
uoa_nz_mansfield_sh_0291.wav,it would be somehow so satisfactory
uoa_nz_mansfield_sh_0292.wav,the cab was dreadfully stuffy
uoa_nz_mansfield_sh_0293.wav,she heard his stick thumping
uoa_nz_mansfield_sh_0294.wav,we can't disturb Kate again she said Softly
uoa_nz_mansfield_sh_0295.wav,a spasm of pity squeezed her heart
uoa_nz_mansfield_sh_0296.wav,he was given up to his dream
uoa_nz_mansfield_sh_0297.wav,run down Just As You Are
uoa_nz_mansfield_sh_0298.wav,and somehow that seemed quite the best plan
uoa_nz_mansfield_sh_0299.wav,Mrs Sheridan got up and came over to her carrying the Hat
uoa_nz_mansfield_sh_0300.wav,what's giving you such a color
uoa_nz_mansfield_sh_0301.wav,Joe's began to be seriously annoyed
uoa_nz_mansfield_sh_0302.wav,but still one must go everywhere
uoa_nz_mansfield_sh_0303.wav,Sadie had her hand clap to her cheek as though she had to take
uoa_nz_mansfield_sh_0304.wav,she looked mournfully and enigmatically at her mother and Laura as they came in
uoa_nz_mansfield_sh_0305.wav,let's try over this life is weary
uoa_nz_mansfield_sh_0306.wav,but at that moment Mrs Sheridan joined them
uoa_nz_mansfield_sh_0307.wav,it was the heavy piano being moved on its stiff casters
uoa_nz_mansfield_sh_0308.wav,how very nice workmen were
uoa_nz_mansfield_sh_0309.wav,but me could not possibly go and supervise the men
uoa_nz_mansfield_sh_0310.wav,you enjoy yourself while you're young
uoa_nz_mansfield_sh_0311.wav,let us live our life all new all hours from the very beginning
uoa_nz_mansfield_sh_0312.wav,my very own forever
uoa_nz_mansfield_sh_0313.wav,oh what a joy it is to own things
uoa_nz_mansfield_sh_0314.wav,I've had the hell of a day
uoa_nz_mansfield_sh_0315.wav,he lived across the flower bed and seized her in his arms
uoa_nz_mansfield_sh_0316.wav,I must go seek those heirs to my fame and fortune
uoa_nz_mansfield_sh_0317.wav,no guiding principle let us call it
uoa_nz_mansfield_sh_0318.wav,I'm exactly like that insect again
uoa_nz_mansfield_sh_0319.wav,why don't I fly out again
uoa_nz_mansfield_sh_0320.wav,he was always full of new ideas schemes plans
uoa_nz_mansfield_sh_0321.wav,would you have me laugh my fair sister
uoa_nz_mansfield_sh_0322.wav,it must be awful she said slowly
uoa_nz_mansfield_sh_0323.wav,greeting my Celestial peach blossom
uoa_nz_mansfield_sh_0324.wav,the gorgeous sunset head blazed and died
uoa_nz_mansfield_sh_0325.wav,whatever did we shut the door for
uoa_nz_mansfield_sh_0326.wav,Alice did wish they'd been a bit of life on the road though
uoa_nz_mansfield_sh_0327.wav,I never seen anyone so eaten
uoa_nz_mansfield_sh_0328.wav,but still her grandma was silent
uoa_nz_mansfield_sh_0329.wav,grandma she said in a startled voice
uoa_nz_mansfield_sh_0330.wav,and how strong how damp the seaweed smelt in the hot sun
uoa_nz_mansfield_sh_0331.wav,we know all about that
uoa_nz_mansfield_sh_0332.wav,but she checked herself and said to the boy coldly I don't like babies
uoa_nz_mansfield_sh_0333.wav,the boy had turned over
uoa_nz_mansfield_sh_0334.wav,and she gave her strange name laugh and grimmest at the other women
uoa_nz_mansfield_sh_0335.wav,of course there were stories but such stories
uoa_nz_mansfield_sh_0336.wav,he ignored his wife just as she ignored him
uoa_nz_mansfield_sh_0337.wav,but aren't you going to bathe here
uoa_nz_mansfield_sh_0338.wav,then the children were unbuttoned
uoa_nz_mansfield_sh_0339.wav,this one was as big as a star and Far More Beautiful
uoa_nz_mansfield_sh_0340.wav,the little girls ran into the paddock like chickens lit out of a coupe
uoa_nz_mansfield_sh_0341.wav,there was no man to disturb them
uoa_nz_mansfield_sh_0342.wav,they're very voices were changed as they called to one another
uoa_nz_mansfield_sh_0343.wav,why can't you eat your food properly like Isabel and Lottie
uoa_nz_mansfield_sh_0344.wav,she smiled and a look of deep contention in her eyes
uoa_nz_mansfield_sh_0345.wav,he only woke up once last night
uoa_nz_mansfield_sh_0346.wav,they settled themselves on the bench opposite Stanley and Barrel
uoa_nz_mansfield_sh_0347.wav,they were dressed alike in blue jerseys and knickers
uoa_nz_mansfield_sh_0348.wav,as Stanley helped himself his blue eyes widened
uoa_nz_mansfield_sh_0349.wav,this Mania for conversation irritated Stanley beyond words
uoa_nz_mansfield_sh_0350.wav,but Jonathan was a match for him
uoa_nz_mansfield_sh_0351.wav,the same soaking bushes showed on either side and the same shadowy palings
uoa_nz_mansfield_sh_0352.wav,there was nothing to Mark which was Beach and where was the sea
uoa_nz_mansfield_sh_0353.wav,the Garden Party by Katherine Mansfield
uoa_nz_mansfield_sh_0354.wav,I sent him home to change his clothes
