uoa_nz_mansfield_jh_0001.wav,each guess who came into the breakfast room was bombarded with a wonderful news
uoa_nz_mansfield_jh_0002.wav,the gentleman wore black coats white silk ties and funny buttonholes tickling the chin
uoa_nz_mansfield_jh_0003.wav,myself I felt disappointed that there was not a salute to 25 guns
uoa_nz_mansfield_jh_0004.wav,did the spirits of romance spread a rose rings only over aristocratic Germany
uoa_nz_mansfield_jh_0005.wav,I supposed to sitting at the front line Shafer doesn't occupy all your days
uoa_nz_mansfield_jh_0006.wav,9 versus equally lovely commanded her to equally violence action
uoa_nz_mansfield_jh_0007.wav,warm the teapot interrupted to hear it pushing away his suplex
uoa_nz_mansfield_jh_0008.wav,as for me I've had all I wanted from women without marriage
uoa_nz_mansfield_jh_0009.wav,but a dumbass with unwashed years struck me as a most depressing object
uoa_nz_mansfield_jh_0010.wav,living with her a love of the coffin of my unborn aspirations
uoa_nz_mansfield_jh_0011.wav,cheer up old woman shouted her husband digging her in the ribs
uoa_nz_mansfield_jh_0012.wav,it's 9:00 I drank some malt coffee and began my cure
uoa_nz_mansfield_jh_0013.wav,by this time he had walked the length of fashionable High Court Avenue
uoa_nz_mansfield_jh_0014.wav,do you looked at me shaking their heads the mouth full of cherry stones
uoa_nz_mansfield_jh_0015.wav,you're rotten to the core and so am I but your heavenly beautiful
uoa_nz_mansfield_jh_0016.wav,the piano was closed and I'm sure was placed in the center of the platform
uoa_nz_mansfield_jh_0017.wav,they were even Rich butts and folding and the least Sean like oil
uoa_nz_mansfield_jh_0018.wav,he measured a good picture and height and I smiled
uoa_nz_mansfield_jh_0019.wav,some little spares young spaces sounded tripped on the window ledge
uoa_nz_mansfield_jh_0020.wav,she snout and swimming over she fastened her teeth in his glove
uoa_nz_mansfield_jh_0021.wav,but she has no right to let her daughter wear such short sailor suits
uoa_nz_mansfield_jh_0022.wav,a great Bush of pebble lilac grew behind the summer house
uoa_nz_mansfield_jh_0023.wav,we got on scandals of high birth generously busted
uoa_nz_mansfield_jh_0024.wav,I've been reading all about your English play in the newspaper
uoa_nz_mansfield_jh_0025.wav,all the ladies eat too especially the ladies
uoa_nz_mansfield_jh_0026.wav,every Sunday morning if they would read aloud while my Pocket Edition
uoa_nz_mansfield_jh_0027.wav,heaven knows what infectious disease may be breeding now in that boots
uoa_nz_mansfield_jh_0028.wav,and then in the Rocky Gateway the ship itself appeared
uoa_nz_mansfield_jh_0029.wav,even for the most jaded of us life holds us feeling moments
uoa_nz_mansfield_jh_0030.wav,did Pals of dirty cups dirty dishes were washed and dried
uoa_nz_mansfield_jh_0031.wav,why did a photographs of dead people always face so
uoa_nz_mansfield_jh_0032.wav,fastidiously his lips curling and just picked his way through the water
uoa_nz_mansfield_jh_0033.wav,do poets from Munich never took his eyes off the pier
uoa_nz_mansfield_jh_0034.wav,but I was exceedingly nice I tried for dividend appropriately differential
uoa_nz_mansfield_jh_0035.wav,a nice shake up in the bus never improved his appetite
uoa_nz_mansfield_jh_0036.wav,thought Viola and looking at him again he did not seem quite so jolly
uoa_nz_mansfield_jh_0037.wav,he wore a very shabby dressing gown and carried a crumpled newspaper in one hand
uoa_nz_mansfield_jh_0038.wav,she said horrified however are we going to stop everything
uoa_nz_mansfield_jh_0039.wav,Stanley was halfway up The Path Before He Saw Linda
uoa_nz_mansfield_jh_0040.wav,and in a vacant chair beside him he plays a little black little bag
uoa_nz_mansfield_jh_0041.wav,old exhibitions all the atom Soul life of Germany and Munchen
uoa_nz_mansfield_jh_0042.wav,do 740 and potatoes
uoa_nz_mansfield_jh_0043.wav,he puts his face into a bosom and his arms and folded her
uoa_nz_mansfield_jh_0044.wav,the Samuel Joseph never played by themselves or managed their own game
uoa_nz_mansfield_jh_0045.wav,the professor Drew and his feet and set up sharply pulling down his waistcoat
uoa_nz_mansfield_jh_0046.wav,she came to my bedroom and offered to massage my arm
uoa_nz_mansfield_jh_0047.wav,now there's something peculiarly intimate and sharing an umbrella
uoa_nz_mansfield_jh_0048.wav,that's one thing I can do said I loving brightly
uoa_nz_mansfield_jh_0049.wav,and just look at this new guy he cried ecstatically just look at it
uoa_nz_mansfield_jh_0050.wav,Joyce the butterfly always came down in a silk Petticoat and a kimono jacket
uoa_nz_mansfield_jh_0051.wav,he looked the store he could order a magnificent dinner
uoa_nz_mansfield_jh_0052.wav,a toy young girl got out leading a child by the hand
uoa_nz_mansfield_jh_0053.wav,they wiped their folks upon black bread and started again
uoa_nz_mansfield_jh_0054.wav,to her relief Grandma seemed no longer sad
uoa_nz_mansfield_jh_0055.wav,on his lap they lay a beautiful pale yellow silk handkerchief
uoa_nz_mansfield_jh_0056.wav,there was no white students covered with reddish grass Beyond them
uoa_nz_mansfield_jh_0057.wav,he looked down at the row of garden strips and backyards
uoa_nz_mansfield_jh_0058.wav,he also forced work and stood by the window picking his nose
uoa_nz_mansfield_jh_0059.wav,the youngest scratched a lullaby on a young fiddle
uoa_nz_mansfield_jh_0060.wav,in Austria even the cab man have Soviets
uoa_nz_mansfield_jh_0061.wav,she dipped a piece of sugar in a coffee and wash the dissolve
uoa_nz_mansfield_jh_0062.wav,that made the student from Bon Secours
uoa_nz_mansfield_jh_0063.wav,I ordered double portions and eat them in paste
uoa_nz_mansfield_jh_0064.wav,we shall not be able to hear each other speak
uoa_nz_mansfield_jh_0065.wav,from the Holocaust rooms came a quick drawing of voices
uoa_nz_mansfield_jh_0066.wav,she had meant to fish mayonnaise for lunch and now
uoa_nz_mansfield_jh_0067.wav,but she never heard his name until she saw it on the theaters
uoa_nz_mansfield_jh_0068.wav,go now clear out
uoa_nz_mansfield_jh_0069.wav,I think he's a little gone here tapping her forehead
uoa_nz_mansfield_jh_0070.wav,sometimes I think the solution lies in marriage said Fraulein Sonia
uoa_nz_mansfield_jh_0071.wav,and the carpets we made ourselves out of old clothes
uoa_nz_mansfield_jh_0072.wav,they entered the whole were greeted and shown to the room
uoa_nz_mansfield_jh_0073.wav,I suppose you are fraction of an invasion too
uoa_nz_mansfield_jh_0074.wav,I must be back in London in September
uoa_nz_mansfield_jh_0075.wav,do dishes will change for beef red currants and spinach
uoa_nz_mansfield_jh_0076.wav,you marry a redhead man and have three children
uoa_nz_mansfield_jh_0077.wav,I've left him at the hotel for you to digest later on
uoa_nz_mansfield_jh_0078.wav,she would like to keep this with as a Keepsake as remembrance
uoa_nz_mansfield_jh_0079.wav,Isabel we are going for bed
uoa_nz_mansfield_jh_0080.wav,he's only staying until tomorrow evening
uoa_nz_mansfield_jh_0081.wav,did I see when blew out to apron into a balloon
uoa_nz_mansfield_jh_0082.wav,I think I prefer both equally well
uoa_nz_mansfield_jh_0083.wav,nurse Andrews head of course jumped at the idea
uoa_nz_mansfield_jh_0084.wav,four men in the short sleeves Street group together on the Garden Path
uoa_nz_mansfield_jh_0085.wav,she breathes in a small whisper to the boy hello my funny
uoa_nz_mansfield_jh_0086.wav,Sunday to gray bed with pristine freshness
uoa_nz_mansfield_jh_0087.wav,my insides are all twisted up with having children too quickly
uoa_nz_mansfield_jh_0088.wav,a delicate woman volunteered to Hungarian but Pleasant
uoa_nz_mansfield_jh_0089.wav,do you know that poem of Sephora about her hands in the Stars
uoa_nz_mansfield_jh_0090.wav,my peaceful attitude of mine towards it is completely destroyed
uoa_nz_mansfield_jh_0091.wav,psychologically I understood your refusal
uoa_nz_mansfield_jh_0092.wav,not even an efficient waiter can you have by yourself
uoa_nz_mansfield_jh_0093.wav,will you to a conference fly so young So Fresh So Far
uoa_nz_mansfield_jh_0094.wav,when the door was closed we raised a triumphant cry
uoa_nz_mansfield_jh_0095.wav,what's a loaf something to have done
uoa_nz_mansfield_jh_0096.wav,I think it's up to Moira to use a little arts and wires
uoa_nz_mansfield_jh_0097.wav,our clients moreover is positive
uoa_nz_mansfield_jh_0098.wav,she turned away from the Buddha with one of her vague gestures
uoa_nz_mansfield_jh_0099.wav,but it was most unfortunate
uoa_nz_mansfield_jh_0100.wav,but it all seemed blurred unreal like a picture in the newspaper
uoa_nz_mansfield_jh_0101.wav,why is it so exciting to be awake when everybody else is asleep
uoa_nz_mansfield_jh_0102.wav,Heaven reward thee sweet patience lady mine he murmured
uoa_nz_mansfield_jh_0103.wav,what are you looking at my grandma
uoa_nz_mansfield_jh_0104.wav,but lucky always makes a floating island don't you Lottie
uoa_nz_mansfield_jh_0105.wav,ignorance must not go uncontradicted
uoa_nz_mansfield_jh_0106.wav,and so large that I can go down there and walk about
uoa_nz_mansfield_jh_0107.wav,her loud slightly hash voice filter salon
uoa_nz_mansfield_jh_0108.wav,it's as beautiful enough to hang from my Watch chain
uoa_nz_mansfield_jh_0109.wav,she asked leaning her arms on the table and pulling her breast against them
uoa_nz_mansfield_jh_0110.wav,which resolution comforted her absolutely
uoa_nz_mansfield_jh_0111.wav,Youngblood answer to here at genially
uoa_nz_mansfield_jh_0112.wav,naturally Epson from home one must expect much discomfort and strange food
uoa_nz_mansfield_jh_0113.wav,poverty stricken her limbs with tattered Rags half covered
uoa_nz_mansfield_jh_0114.wav,each year I come expecting to find you with an empty nest
uoa_nz_mansfield_jh_0115.wav,from Hoffman I congratulate you
uoa_nz_mansfield_jh_0116.wav,I chewed a leaf and hugged my knees
uoa_nz_mansfield_jh_0117.wav,they sway in language extremely and we close pressed are kissing their
uoa_nz_mansfield_jh_0118.wav,she very obviously followed the advice
uoa_nz_mansfield_jh_0119.wav,somehow or other he managed to shake some sort of smile at her
uoa_nz_mansfield_jh_0120.wav,he flung his head on to the huge bed and went towards her
uoa_nz_mansfield_jh_0121.wav,the straw basket of programs was tossed from arm to arm
uoa_nz_mansfield_jh_0122.wav,peering through that round eye she could see far off some rocks
uoa_nz_mansfield_jh_0123.wav,I saw a beautiful umbrella broken in half like that on my way over
uoa_nz_mansfield_jh_0124.wav,a lady with a box of sardines sit Dennis Gravely
uoa_nz_mansfield_jh_0125.wav,she was sitting in the open taxi outside
uoa_nz_mansfield_jh_0126.wav,I could have sworn and left a teaspoonful of cocoa in the tin
uoa_nz_mansfield_jh_0127.wav,the result look like a gigantic Dustbin
uoa_nz_mansfield_jh_0128.wav,I say he cried Jason English bulldog
uoa_nz_mansfield_jh_0129.wav,there's some marmalade in the sideboard
uoa_nz_mansfield_jh_0130.wav,must they be hidden by Mackey
uoa_nz_mansfield_jh_0131.wav,it was muffled I stole the dog had his head in a sack
uoa_nz_mansfield_jh_0132.wav,show up your chair my dear send Mrs Stubbs beginning to pour out
uoa_nz_mansfield_jh_0133.wav,do Bojangles the red surge curtains parted and Mrs Stubbs appeared
uoa_nz_mansfield_jh_0134.wav,pity to have made herself so conspicuous
uoa_nz_mansfield_jh_0135.wav,yes that was a real garage against life
uoa_nz_mansfield_jh_0136.wav,Linda saw that River very wide cover with little rough and boats
uoa_nz_mansfield_jh_0137.wav,she was a long strange looking woman with no hands and feet
uoa_nz_mansfield_jh_0138.wav,first man in as usual
uoa_nz_mansfield_jh_0139.wav,big twist and kiss dresser and showed each other as the Silvery beans broadened
uoa_nz_mansfield_jh_0140.wav,how could the poor darling help not having any money
uoa_nz_mansfield_jh_0141.wav,I'd far rather you left other things said the strange man slowly
uoa_nz_mansfield_jh_0142.wav,she is the Incarnation of comprehending love
uoa_nz_mansfield_jh_0143.wav,after all Dash it they were young still
uoa_nz_mansfield_jh_0144.wav,he take her away and they love about together somewhere
uoa_nz_mansfield_jh_0145.wav,two Stone heavier than I if he's a pound thought Andres
uoa_nz_mansfield_jh_0146.wav,it doesn't matter they're all busy upstairs
uoa_nz_mansfield_jh_0147.wav,lights were turned on immediately the cafe opened and business was very brisk
uoa_nz_mansfield_jh_0148.wav,has red face was covered with pimples and his nails indescribably filthy
uoa_nz_mansfield_jh_0149.wav,would you come with me as far as the railway station and back
uoa_nz_mansfield_jh_0150.wav,and retired the very young gentleman dodging her trained and scowling
uoa_nz_mansfield_jh_0151.wav,it is a great pity that the English nation is so unusual
uoa_nz_mansfield_jh_0152.wav,but doubtless they have not the same symbolical value for the English
uoa_nz_mansfield_jh_0153.wav,the quantity of fruits I've eaten on this bench he sighed
uoa_nz_mansfield_jh_0154.wav,that is almost a mouthful in itself
uoa_nz_mansfield_jh_0155.wav,or perhaps you do not care to eat the worms
uoa_nz_mansfield_jh_0156.wav,you go into the bedroom and fish my blue silk handkerchief
uoa_nz_mansfield_jh_0157.wav,nothing wrist to him so much then as for me to stroke his head
uoa_nz_mansfield_jh_0158.wav,do you have fried Fisher why don't you take your coffee out in the garden
uoa_nz_mansfield_jh_0159.wav,4:00 when July afternoon she appeared at the pension mother
uoa_nz_mansfield_jh_0160.wav,but they're beautiful
uoa_nz_mansfield_jh_0161.wav,but she graciously suffered our worship and we were more than content
uoa_nz_mansfield_jh_0162.wav,I found myself putting the baron
uoa_nz_mansfield_jh_0163.wav,there you are I said
uoa_nz_mansfield_jh_0164.wav,no man had a right to such eyes such lashes and such lips
uoa_nz_mansfield_jh_0165.wav,Harold was too handsome too handsome by far
uoa_nz_mansfield_jh_0166.wav,Harold hadn't come back from lunch until close on 4:00
uoa_nz_mansfield_jh_0167.wav,did Carlos with silence and cold
uoa_nz_mansfield_jh_0168.wav,no she said I won't go outside
uoa_nz_mansfield_jh_0169.wav,how strange she never thought of it like that before
uoa_nz_mansfield_jh_0170.wav,they sat outside the house in Long chairs under colored pencils
uoa_nz_mansfield_jh_0171.wav,we shall have to anoint ourselves with butter said Dennis
uoa_nz_mansfield_jh_0172.wav,he touched her cool hand her cool cheek
uoa_nz_mansfield_jh_0173.wav,it would frighten Ethel out of her life
uoa_nz_mansfield_jh_0174.wav,she unhooked her Warren jacket and hang that up too
uoa_nz_mansfield_jh_0175.wav,but it was a Charming are
uoa_nz_mansfield_jh_0176.wav,she put the big frozen cups before then and pushed across my clear glass
uoa_nz_mansfield_jh_0177.wav,when a faint balance sounded she wins and bit her lip again
uoa_nz_mansfield_jh_0178.wav,calm yourself she says superbly
uoa_nz_mansfield_jh_0179.wav,how wrong how Wicked feeling as I do
uoa_nz_mansfield_jh_0180.wav,he tried to smile to say I'm glad
uoa_nz_mansfield_jh_0181.wav,it says tomorrow that you going isn't it
uoa_nz_mansfield_jh_0182.wav,but his luck gave him a nasty job to say the least almost immediately
uoa_nz_mansfield_jh_0183.wav,it was 35 years old
uoa_nz_mansfield_jh_0184.wav,but at that moment in the street below a barrel organ struck up
uoa_nz_mansfield_jh_0185.wav,there's such a nice man
uoa_nz_mansfield_jh_0186.wav,the very idea made one shutter
uoa_nz_mansfield_jh_0187.wav,I've got the name somewhere on the back of an envelope
uoa_nz_mansfield_jh_0188.wav,she had no idea that he was Gray
uoa_nz_mansfield_jh_0189.wav,that's some more intolerable situation than the other
uoa_nz_mansfield_jh_0190.wav,but Jonathan only answered a Little Love a Little kindness
uoa_nz_mansfield_jh_0191.wav,she hated her grandma to be sad
uoa_nz_mansfield_jh_0192.wav,he could not be disloyal
uoa_nz_mansfield_jh_0193.wav,and when you turned it over the outside was a deep bronze color
uoa_nz_mansfield_jh_0194.wav,they were the Charles boys pip and rags
uoa_nz_mansfield_jh_0195.wav,No Time to Say Goodbye
uoa_nz_mansfield_jh_0196.wav,you haven't been using it to put the kitchen fire with by any chance
uoa_nz_mansfield_jh_0197.wav,they cry sounded in the dreams of little children
uoa_nz_mansfield_jh_0198.wav,and now big spots of light cleaned in the Mist
uoa_nz_mansfield_jh_0199.wav,then something immense came into view
uoa_nz_mansfield_jh_0200.wav,why even a prostitute has the greatest sense of generosity
uoa_nz_mansfield_jh_0201.wav,he paused by the window and glanced her a moments over his shoulder
uoa_nz_mansfield_jh_0202.wav,what does a pussycat do all day
uoa_nz_mansfield_jh_0203.wav,I just saw her go out to buy some
uoa_nz_mansfield_jh_0204.wav,they had looked at each other stunt with the conflict and sympathized
uoa_nz_mansfield_jh_0205.wav,I know no such name in a shop voice
uoa_nz_mansfield_jh_0206.wav,you look like a little boy with your hair blowing about in the Wind
uoa_nz_mansfield_jh_0207.wav,Oh What a Beautiful Noble idea
uoa_nz_mansfield_jh_0208.wav,ask you please set the landlord obviously scrolling us
uoa_nz_mansfield_jh_0209.wav,but by that time she had to pick out the washing for the Frog
uoa_nz_mansfield_jh_0210.wav,shut your hands hitting Anton over the head with a empty cup
uoa_nz_mansfield_jh_0211.wav,she's got twice the Nerf of you and me rolled into one
uoa_nz_mansfield_jh_0212.wav,he will an immense geranium flowers stuck in the lapel of his coat
uoa_nz_mansfield_jh_0213.wav,straight away and just thought that he was being accused
uoa_nz_mansfield_jh_0214.wav,from the Pine Forest streamed a wild perfume the branches sway together rhythmically sonorously
uoa_nz_mansfield_jh_0215.wav,then you are an English woman
uoa_nz_mansfield_jh_0216.wav,oh I spend a day here now she answered
uoa_nz_mansfield_jh_0217.wav,what's a fire she streaked shutting out her hands
uoa_nz_mansfield_jh_0218.wav,oh mama please don't say such things Sonya flushed and grew very angry
uoa_nz_mansfield_jh_0219.wav,such a brilliant way of putting things
uoa_nz_mansfield_jh_0220.wav,this is my little English friend of whom I have spoken
uoa_nz_mansfield_jh_0221.wav,such a clout on the year as you gave me
uoa_nz_mansfield_jh_0222.wav,who roughened hands clasped and in class themselves in the folds of her skirt
uoa_nz_mansfield_jh_0223.wav,that's not how wedding should be she said
uoa_nz_mansfield_jh_0224.wav,you must talk to ants into your boots until we get there
uoa_nz_mansfield_jh_0225.wav,but I consider child bearing the most ignominious of all professions I said
uoa_nz_mansfield_jh_0226.wav,I said he was a sea captain on a long and perilous voyage
uoa_nz_mansfield_jh_0227.wav,when I meet new people I squeeze them dry like a sponge
uoa_nz_mansfield_jh_0228.wav,a chestnut tree push green balls against the window
uoa_nz_mansfield_jh_0229.wav,I'm not accustomed to such company
uoa_nz_mansfield_jh_0230.wav,he and Frau Fisher were old friends
uoa_nz_mansfield_jh_0231.wav,you do not seem to enjoy discussing the functions of the body
uoa_nz_mansfield_jh_0232.wav,Highborn reply was what interested me
uoa_nz_mansfield_jh_0233.wav,you should be like a wild rose
uoa_nz_mansfield_jh_0234.wav,coffee and Rose took on the nature of an orgy
uoa_nz_mansfield_jh_0235.wav,Afflicted children have such pretty ways
uoa_nz_mansfield_jh_0236.wav,I really do not know I answered
uoa_nz_mansfield_jh_0237.wav,I assure you we are not afraid
uoa_nz_mansfield_jh_0238.wav,how long are you remaining here
uoa_nz_mansfield_jh_0239.wav,whoever heard of having children upon vegetables
uoa_nz_mansfield_jh_0240.wav,I have not eaten meat for 3 years
uoa_nz_mansfield_jh_0241.wav,my lady put me into colors and cups from the first
uoa_nz_mansfield_jh_0242.wav,they were even so kind to me
uoa_nz_mansfield_jh_0243.wav,come along I'll say come along and now lay out your patience for you
uoa_nz_mansfield_jh_0244.wav,but it's always boiling before my lady is half full
uoa_nz_mansfield_jh_0245.wav,she looked at ESO over her spectacles
uoa_nz_mansfield_jh_0246.wav,The Carriage Gates were pushed back
uoa_nz_mansfield_jh_0247.wav,they are hard to resist
uoa_nz_mansfield_jh_0248.wav,they are eagerly bought by the soldiers
uoa_nz_mansfield_jh_0249.wav,she lay on his breast but so lightly so remotely
uoa_nz_mansfield_jh_0250.wav,he bent over her and she looked up with her familiar half smile
uoa_nz_mansfield_jh_0251.wav,his hats was wrong with such a spasm that he could have cried out
uoa_nz_mansfield_jh_0252.wav,he was something between the Sheepdog and the shepherd
uoa_nz_mansfield_jh_0253.wav,as much expression as you can put into it
uoa_nz_mansfield_jh_0254.wav,the willow tree outside the high near Windows waved in the Wind
uoa_nz_mansfield_jh_0255.wav,she didn't even recognize him again
uoa_nz_mansfield_jh_0256.wav,and when Layla compared him with her other partners he looks Chevy
uoa_nz_mansfield_jh_0257.wav,it gave her quite a shock again to see how old he was
uoa_nz_mansfield_jh_0258.wav,wrote a French voice close to a year
uoa_nz_mansfield_jh_0259.wav,make possible to Layla
uoa_nz_mansfield_jh_0260.wav,there was a joyful flutter among the girls
uoa_nz_mansfield_jh_0261.wav,strange voices answered of course my dear
uoa_nz_mansfield_jh_0262.wav,it must have had a knock somehow
uoa_nz_mansfield_jh_0263.wav,one golden hour 6 or 60 Diamond minutes
uoa_nz_mansfield_jh_0264.wav,they're lying to one side on an immense bit late Grandpa
uoa_nz_mansfield_jh_0265.wav,but Grandma remembered too at the same time
uoa_nz_mansfield_jh_0266.wav,such a very nice stewardess came to meet them
uoa_nz_mansfield_jh_0267.wav,grandma made a small face
uoa_nz_mansfield_jh_0268.wav,he called grandma in his arms and press her to him
uoa_nz_mansfield_jh_0269.wav,beside him her grandma puzzled along and her crackling black Ulster
uoa_nz_mansfield_jh_0270.wav,look here said William how are we going to sit
uoa_nz_mansfield_jh_0271.wav,May the head William let not ointment
uoa_nz_mansfield_jh_0272.wav,you think they are another bad sign
uoa_nz_mansfield_jh_0273.wav,we are inclined to reconsider
uoa_nz_mansfield_jh_0274.wav,ma Paka through the counter pain over the bed
uoa_nz_mansfield_jh_0275.wav,my Parker gave no answer
uoa_nz_mansfield_jh_0276.wav,will you stay in the car while I go and look
uoa_nz_mansfield_jh_0277.wav,and then we were outside again
uoa_nz_mansfield_jh_0278.wav,I sipped my tea lean back and even asked if I might smoke
uoa_nz_mansfield_jh_0279.wav,oh well there seems nowhere else should she
uoa_nz_mansfield_jh_0280.wav,how can you talk of cutting off now
uoa_nz_mansfield_jh_0281.wav,if you own in your heart I feel
uoa_nz_mansfield_jh_0282.wav,and where are you going if your mother may ask
uoa_nz_mansfield_jh_0283.wav,it was the Shadow from the tree outside
uoa_nz_mansfield_jh_0284.wav,well we can postpone it again say Josephine
uoa_nz_mansfield_jh_0285.wav,oh it's in various forms
uoa_nz_mansfield_jh_0286.wav,and this time say Josephine family we must come to a definite decision
uoa_nz_mansfield_jh_0287.wav,she raised her pale eyebrows until they ripped away into a pale hair
uoa_nz_mansfield_jh_0288.wav,ask Josephine trying to begin to concentrate
uoa_nz_mansfield_jh_0289.wav,I'm afraid I shall not be able to stay very long with grandfather
uoa_nz_mansfield_jh_0290.wav,but we mustn't let you off of that
uoa_nz_mansfield_jh_0291.wav,it would be somehow so satisfactory
uoa_nz_mansfield_jh_0292.wav,the cat was dreadfully stuffy
uoa_nz_mansfield_jh_0293.wav,she heard his stick thumping
uoa_nz_mansfield_jh_0294.wav,we got to step Kate again she said Softly
uoa_nz_mansfield_jh_0295.wav,a specimen of pity squeeze too hot
uoa_nz_mansfield_jh_0296.wav,he was given up to his dream
uoa_nz_mansfield_jh_0297.wav,run down Just As You Are
uoa_nz_mansfield_jh_0298.wav,and somehow that seemed quite the best plan
uoa_nz_mansfield_jh_0299.wav,Mrs Sheridan got up and came over to her carrying the Hat
uoa_nz_mansfield_jh_0300.wav,what's giving you such a color
uoa_nz_mansfield_jh_0301.wav,Jose began to be seriously annoyed
uoa_nz_mansfield_jh_0302.wav,but still one must go everywhere
uoa_nz_mansfield_jh_0303.wav,Sadie had her hand clap your cheek after she had toothache
uoa_nz_mansfield_jh_0304.wav,she looked mentally and enigmatically at her mother and Laura as they came in
uoa_nz_mansfield_jh_0305.wav,let's try over this life is weary
uoa_nz_mansfield_jh_0306.wav,but at that moment Mrs Sheridan joined them
uoa_nz_mansfield_jh_0307.wav,it was the heavy piano being moved on a stiff pastures
uoa_nz_mansfield_jh_0308.wav,how very nice workmen were
uoa_nz_mansfield_jh_0309.wav,but make not possibly go and supervise the men
uoa_nz_mansfield_jh_0310.wav,you enjoy yourself while you're young
uoa_nz_mansfield_jh_0311.wav,let us live our life on you or else from the very beginning
uoa_nz_mansfield_jh_0312.wav,my very own forever
uoa_nz_mansfield_jh_0313.wav,oh what a joy it is to own things
uoa_nz_mansfield_jh_0314.wav,I've had the hell of a day
uoa_nz_mansfield_jh_0315.wav,he lives across the flower bed and seized her in his arms
uoa_nz_mansfield_jh_0316.wav,I must go seek those ears to my fame and fortune
uoa_nz_mansfield_jh_0317.wav,no guiding principle let us call it
uoa_nz_mansfield_jh_0318.wav,I'm exactly like that insect again
uoa_nz_mansfield_jh_0319.wav,why don't I fly out again
uoa_nz_mansfield_jh_0320.wav,he was always full of new ideas schemes plans
uoa_nz_mansfield_jh_0321.wav,would you have me laugh my fair sister
uoa_nz_mansfield_jh_0322.wav,it must be awful she said slowly
uoa_nz_mansfield_jh_0323.wav,greeting my Celestial peach blossom
uoa_nz_mansfield_jh_0324.wav,the gorgeous sunset have placed and died
uoa_nz_mansfield_jh_0325.wav,whatever that we shut the door for
uoa_nz_mansfield_jh_0326.wav,Alice did wish that being a bit of life on the road though
uoa_nz_mansfield_jh_0327.wav,I never seen anyone so eaten
