uoa_nz_mansfield_jh_0328.wav,but still her grandma was silent
uoa_nz_mansfield_jh_0329.wav,Grandma she's in the startled voice
uoa_nz_mansfield_jh_0330.wav,and how strong how damp the seaweed smells in the hot sun
uoa_nz_mansfield_jh_0331.wav,we know all about that
uoa_nz_mansfield_jh_0332.wav,but she checked herself and sit to the boy totally I don't like babies
uoa_nz_mansfield_jh_0333.wav,the boy had turned over
uoa_nz_mansfield_jh_0334.wav,and she gave a strange name laugh and grimmest at The Other Woman
uoa_nz_mansfield_jh_0335.wav,of course there were stories but such stories
uoa_nz_mansfield_jh_0336.wav,he ignored his wife just as she ignored him
uoa_nz_mansfield_jh_0337.wav,but aren't you going to Bath here
uoa_nz_mansfield_jh_0338.wav,then the children were unbuttoned
uoa_nz_mansfield_jh_0339.wav,this one was as big as a star and Far More Beautiful
uoa_nz_mansfield_jh_0340.wav,the little girls ran into the paddock like chicken set out of a cube
uoa_nz_mansfield_jh_0341.wav,there was no man to disturb them
uoa_nz_mansfield_jh_0342.wav,the very voices were changed as a call to one another
uoa_nz_mansfield_jh_0343.wav,why can't you eat your food properly like Isabel and Lottie
uoa_nz_mansfield_jh_0344.wav,she smiled and look of deep content showing in her eyes
uoa_nz_mansfield_jh_0345.wav,he only woke up once last night
uoa_nz_mansfield_jh_0346.wav,Barrel
uoa_nz_mansfield_jh_0347.wav,they would dress like in blue jerseys in the kiss
uoa_nz_mansfield_jh_0348.wav,has Danny helped himself has blue eyes widened
uoa_nz_mansfield_jh_0349.wav,this man you have a conversation irritated standing beyond words
uoa_nz_mansfield_jh_0350.wav,but Jonathan was a match for him
uoa_nz_mansfield_jh_0351.wav,the same soaking bushes showed on either side and the same shadowy palings
uoa_nz_mansfield_jh_0352.wav,there was nothing to Mark which was speech and where was to see
uoa_nz_mansfield_jh_0353.wav,the Garden Party by Katherine Mansfield
uoa_nz_mansfield_jh_0354.wav,I sent him home to change his clothes
uoa_nz_mansfield_jh_0355.wav,she struggled and was quite amazed to realize how angry she felt
uoa_nz_mansfield_jh_0356.wav,yes I'm not busy tomorrow she said
uoa_nz_mansfield_jh_0357.wav,was it possible that the strange man was still there
uoa_nz_mansfield_jh_0358.wav,that was the life for her
uoa_nz_mansfield_jh_0359.wav,well that had been a fascinating interlude
uoa_nz_mansfield_jh_0360.wav,drops of water fell from her hair onto the paper
uoa_nz_mansfield_jh_0361.wav,no she's not living here answered viola
uoa_nz_mansfield_jh_0362.wav,8 km it must be
uoa_nz_mansfield_jh_0363.wav,from the road a sudden shout of Triumph
uoa_nz_mansfield_jh_0364.wav,my dear little lady you must not take the quotation literally
uoa_nz_mansfield_jh_0365.wav,what is it your Shakespeare says
uoa_nz_mansfield_jh_0366.wav,oh because they live close to the Earth and therefore the spices
uoa_nz_mansfield_jh_0367.wav,brother under the lion guard of false masculinity
uoa_nz_mansfield_jh_0368.wav,what's right have they even to Christian each other
uoa_nz_mansfield_jh_0369.wav,Fritz Escape that truly Christian trap by saying I asked you first
uoa_nz_mansfield_jh_0370.wav,being interpreted admit single file which was distressing for Elsa and Friends
uoa_nz_mansfield_jh_0371.wav,we March a mess along the Station Road
uoa_nz_mansfield_jh_0372.wav,duh that child has such energy
uoa_nz_mansfield_jh_0373.wav,allow me to introduce you to each other
uoa_nz_mansfield_jh_0374.wav,yes not in graciously to the advanced lady
uoa_nz_mansfield_jh_0375.wav,the Frog Professor is going to be one of us for the afternoon
uoa_nz_mansfield_jh_0376.wav,shall We join the others
uoa_nz_mansfield_jh_0377.wav,the only received the letters of blessing from the parents yesterday morning
uoa_nz_mansfield_jh_0378.wav,for us she said there will be a double Joy
uoa_nz_mansfield_jh_0379.wav,you know cry anymore or wake up in the night
uoa_nz_mansfield_jh_0380.wav,such great big black trees on either side
uoa_nz_mansfield_jh_0381.wav,once upon a time she was walking along a little white Road
uoa_nz_mansfield_jh_0382.wav,there was a little piece of candle burning in the enamel bracket
uoa_nz_mansfield_jh_0383.wav,they were laughing and holding each other by the hand
uoa_nz_mansfield_jh_0384.wav,standing on tiptoe in the yard she almost felt she would be blown away
uoa_nz_mansfield_jh_0385.wav,that's why I'm not awake
uoa_nz_mansfield_jh_0386.wav,don't cancel it yourself or I'll know
uoa_nz_mansfield_jh_0387.wav,well she's hooked a boy this time
uoa_nz_mansfield_jh_0388.wav,he had to force her out of it that's all
uoa_nz_mansfield_jh_0389.wav,he began to plan a little trip for them
uoa_nz_mansfield_jh_0390.wav,well once this boy business was over she'd get stronger
uoa_nz_mansfield_jh_0391.wav,she's certainly was a little thing
uoa_nz_mansfield_jh_0392.wav,they stood something in him those bells something big and tender
uoa_nz_mansfield_jh_0393.wav,ask Andreas loathing the man
uoa_nz_mansfield_jh_0394.wav,no time to indulge in pernicious little habits
uoa_nz_mansfield_jh_0395.wav,he took up a book and wield his armchair over to the window
uoa_nz_mansfield_jh_0396.wav,the doctor was sold a little tune and flick the mirror again
uoa_nz_mansfield_jh_0397.wav,tell me on the way up
uoa_nz_mansfield_jh_0398.wav,on Sunday a man has the right to expect his family
uoa_nz_mansfield_jh_0399.wav,it's partly the effect of Sunday
uoa_nz_mansfield_jh_0400.wav,two dogs sprout in the middle of the road scuffling and biting
uoa_nz_mansfield_jh_0401.wav,the gutters would choke with the leaves of Saturday night
uoa_nz_mansfield_jh_0402.wav,but the master gave her no opening
uoa_nz_mansfield_jh_0403.wav,she was full of terrified joy and importance in the goings on upstairs
uoa_nz_mansfield_jh_0404.wav,I suppose I better not disturb her
uoa_nz_mansfield_jh_0405.wav,there was a gentle knock at the door and his mother came in
uoa_nz_mansfield_jh_0406.wav,he repeated it quickly several times with a snapping movement of the Jaws
uoa_nz_mansfield_jh_0407.wav,what are you going to do this afternoon
uoa_nz_mansfield_jh_0408.wav,fancy she has a separate plate for each of her front teeth
uoa_nz_mansfield_jh_0409.wav,she turned around and leaned on one elbow
uoa_nz_mansfield_jh_0410.wav,it makes such a pleasant Excursion for fine Saturday afternoon
uoa_nz_mansfield_jh_0411.wav,I wouldn't want compasses us all about
uoa_nz_mansfield_jh_0412.wav,I think it must be the umbrellas which make us look ridiculous
uoa_nz_mansfield_jh_0413.wav,he was someone beside her laughing too
uoa_nz_mansfield_jh_0414.wav,but you're out the door suddenly opening she sprang to her feet and laughed
uoa_nz_mansfield_jh_0415.wav,in her hands
uoa_nz_mansfield_jh_0416.wav,well you are funny one she said
uoa_nz_mansfield_jh_0417.wav,you go downstairs leave me alone
uoa_nz_mansfield_jh_0418.wav,Sabrina took on the extra work without any thoughts of extra pay
uoa_nz_mansfield_jh_0419.wav,it meant an extra half hour in bed for her
uoa_nz_mansfield_jh_0420.wav,and I do not see any possible light out of this Darkness
uoa_nz_mansfield_jh_0421.wav,but what's a bother said I
uoa_nz_mansfield_jh_0422.wav,and I found ourselves together Under the Stars
uoa_nz_mansfield_jh_0423.wav,my spirit stops for once of that
uoa_nz_mansfield_jh_0424.wav,he was off duty and intended to show it
uoa_nz_mansfield_jh_0425.wav,then presumably the windshield structure color brooch
uoa_nz_mansfield_jh_0426.wav,yes I know you have no love for me and no forget me not
uoa_nz_mansfield_jh_0427.wav,what do you intend to recite Fraulein Sonia
uoa_nz_mansfield_jh_0428.wav,I forget nothing Mama answer Sonia
uoa_nz_mansfield_jh_0429.wav,you a great deal about England
uoa_nz_mansfield_jh_0430.wav,but the tragedy of the story is this
uoa_nz_mansfield_jh_0431.wav,the conversation is not out of your death
uoa_nz_mansfield_jh_0432.wav,I've been making music for them on my trombone
uoa_nz_mansfield_jh_0433.wav,the children were all soundly sleeping
uoa_nz_mansfield_jh_0434.wav,God the trouble you gave me
uoa_nz_mansfield_jh_0435.wav,he told you back in his chair chuckling with laughter
uoa_nz_mansfield_jh_0436.wav,it's not religion to love to men
uoa_nz_mansfield_jh_0437.wav,who was the traveler and only stayed at the house tonight
uoa_nz_mansfield_jh_0438.wav,he winked at the Guess Who broke into loud laughter
uoa_nz_mansfield_jh_0439.wav,it was easier when they came into the village
uoa_nz_mansfield_jh_0440.wav,so young and yet to suffer so cruelty she murmured
uoa_nz_mansfield_jh_0441.wav,then dear child where's your husband
uoa_nz_mansfield_jh_0442.wav,you look like a little person kitten
uoa_nz_mansfield_jh_0443.wav,that is a very nice idea
uoa_nz_mansfield_jh_0444.wav,there's a piece of that beautiful flannel picture you left us last summer
uoa_nz_mansfield_jh_0445.wav,the Washington has of course been scrapped over with soda
uoa_nz_mansfield_jh_0446.wav,are there many people here just now
uoa_nz_mansfield_jh_0447.wav,how you keep them all I don't know
uoa_nz_mansfield_jh_0448.wav,Bertha turn into the youngest of the five how changed
uoa_nz_mansfield_jh_0449.wav,and the greetings were so long and loud that's a very sympathetic glow
uoa_nz_mansfield_jh_0450.wav,how much should a door to kiss you mimic the student
uoa_nz_mansfield_jh_0451.wav,what's love didn't question of manicure
uoa_nz_mansfield_jh_0452.wav,I picked up my ears
uoa_nz_mansfield_jh_0453.wav,she sighed and turned up her eyes
uoa_nz_mansfield_jh_0454.wav,and fancy now she has already has six proposals of marriage
uoa_nz_mansfield_jh_0455.wav,I have written these lines
uoa_nz_mansfield_jh_0456.wav,he fixed a Stony eye on her and she blushed
uoa_nz_mansfield_jh_0457.wav,search Reserve such a tender way with the child
uoa_nz_mansfield_jh_0458.wav,attractive
uoa_nz_mansfield_jh_0459.wav,the manager immediately left the room to find a new nib
uoa_nz_mansfield_jh_0460.wav,but the child is dumb Venture the manager apologetically
uoa_nz_mansfield_jh_0461.wav,there was a picture of her only last week in sport and Salon
uoa_nz_mansfield_jh_0462.wav,I have only received a letter acquainting me with the fact this morning
uoa_nz_mansfield_jh_0463.wav,when we arrived at the pension there was very nearly an open right
uoa_nz_mansfield_jh_0464.wav,a wise idea I answered
uoa_nz_mansfield_jh_0465.wav,I fear he said that my luggage will be damned
uoa_nz_mansfield_jh_0466.wav,but he himself wanted some information
uoa_nz_mansfield_jh_0467.wav,together we walked through the mud and slush
uoa_nz_mansfield_jh_0468.wav,who could tell what the future held
uoa_nz_mansfield_jh_0469.wav,followed a complete and dislike silence
uoa_nz_mansfield_jh_0470.wav,suddenly the door opened and admitted to Barron
uoa_nz_mansfield_jh_0471.wav,never had I seen him at the casino or the Bob establishment
uoa_nz_mansfield_jh_0472.wav,at the end of the meal we were served with coffee
uoa_nz_mansfield_jh_0473.wav,there was a lady from the Spanish Court here in the summer
uoa_nz_mansfield_jh_0474.wav,I closed the door after me
uoa_nz_mansfield_jh_0475.wav,but you cannot be in earnest
uoa_nz_mansfield_jh_0476.wav,this morning I took a half bath
uoa_nz_mansfield_jh_0477.wav,of course she was very proud
uoa_nz_mansfield_jh_0478.wav,I can make very good tea
uoa_nz_mansfield_jh_0479.wav,do they really eat so much
uoa_nz_mansfield_jh_0480.wav,nothing at all right here Hoffman from Berlin
uoa_nz_mansfield_jh_0481.wav,there he goes again so Andreas earring office knowledge
uoa_nz_mansfield_jh_0482.wav,oil lamps hanging from the ceiling shed warm bright light
uoa_nz_mansfield_jh_0483.wav,I don't know how far I didn't run
uoa_nz_mansfield_jh_0484.wav,the little dressing table and mirror at the far end
uoa_nz_mansfield_jh_0485.wav,a bell sounded far over the water
uoa_nz_mansfield_jh_0486.wav,Stanley lifted up to see a dog head bobbing far out and then I'm lifting
uoa_nz_mansfield_jh_0487.wav,I've had my Easter lilies with a gorgeous star
uoa_nz_mansfield_jh_0488.wav,some Dreadful man tried to kiss her at the club ball
uoa_nz_mansfield_jh_0489.wav,it had been a rule for years never to disturb father in the morning
uoa_nz_mansfield_jh_0490.wav,I am by Norman in my room
uoa_nz_mansfield_jh_0491.wav,they took it for granted it was your job to slave away for them
uoa_nz_mansfield_jh_0492.wav,I don't know if much joy
uoa_nz_mansfield_jh_0493.wav,but in the afternoon 6:07 Choice Spirits played cards
uoa_nz_mansfield_jh_0494.wav,not have cared enough to scratch out that word disgust
uoa_nz_mansfield_jh_0495.wav,he too felt his base was spoiled
uoa_nz_mansfield_jh_0496.wav,the other grass a beautifully smooth yellow stick
uoa_nz_mansfield_jh_0497.wav,the soft switch of the sea a full-time sweeping the Pebbles
uoa_nz_mansfield_jh_0498.wav,breathless half choking she told the Dreadful story
uoa_nz_mansfield_jh_0499.wav,class being the old fish bag that held her cleaning things
uoa_nz_mansfield_jh_0500.wav,you might have seen a big fish flicking in at the window and gone again
uoa_nz_mansfield_jh_0501.wav,and quite big girls older than me even with riding them
uoa_nz_mansfield_jh_0502.wav,that looked at low tide like Shaggy Beast come down to the water to drink
uoa_nz_mansfield_jh_0503.wav,she saw her great big shadow on the wall
uoa_nz_mansfield_jh_0504.wav,the thing to do was to let Kissimmee go on his wild goose chase
uoa_nz_mansfield_jh_0505.wav,the second best run she urged knowing perfectly well she was telling a story
uoa_nz_mansfield_jh_0506.wav,I wonder if any air enters by the ears
uoa_nz_mansfield_jh_0507.wav,wasn't there anywhere in the world where she could have her cry out
uoa_nz_mansfield_jh_0508.wav,when I was the age I used to go to bed hugging an old town with a knot in it
uoa_nz_mansfield_jh_0509.wav,with little red shadows and blue Bridals and bells jingle jingling on their ears
uoa_nz_mansfield_jh_0510.wav,another queer thing about it was Reggie had an idea
uoa_nz_mansfield_jh_0511.wav,laughing sneering jeering stretching out the hands while she read them William Slater
uoa_nz_mansfield_jh_0512.wav,a whole pound of butter and such a large Johnny cake that look like an advertisement for somebody's baking powder
uoa_nz_mansfield_jh_0513.wav,we could manage our own food
uoa_nz_mansfield_jh_0514.wav,the three little girls appeared each carrying a porch plate
uoa_nz_mansfield_jh_0515.wav,a large red washing can on the other
uoa_nz_mansfield_jh_0516.wav,it is a very strange thing but whenever I'm in a company of newly engaged couples I blossom
uoa_nz_mansfield_jh_0517.wav,one bird drifted high like a dark flick in a jewel
uoa_nz_mansfield_jh_0518.wav,you sit down on the side of your bed change your shoes and dash out again
uoa_nz_mansfield_jh_0519.wav,suddenly it was a terrible effort to greet as usual
uoa_nz_mansfield_jh_0520.wav,and now that little ancient fellow was climbing down in this flights
uoa_nz_mansfield_jh_0521.wav,walking on again with a little air of remoteness
uoa_nz_mansfield_jh_0522.wav,old Mr Neve got up and went to join that little old climbing fellow just as far as his dressing room
uoa_nz_mansfield_jh_0523.wav,how handsome he had looked in that bright blue suit
uoa_nz_mansfield_jh_0524.wav,to raise enthusiasm in the heart of the average British has been
uoa_nz_mansfield_jh_0525.wav,two very handsome reads sent me by my first husband's brother
uoa_nz_mansfield_jh_0526.wav,his blue uniform shining with an enthusiasm which nothing but official buttons could possibly persist
uoa_nz_mansfield_jh_0527.wav,death spasms of his oldest solitude
uoa_nz_mansfield_jh_0528.wav,counting up the missing buttons on my husband's uniform jacket
uoa_nz_mansfield_jh_0529.wav,did GoldenEye marigold glittered
uoa_nz_mansfield_jh_0530.wav,ladies and gentlemen I'm an Auctioneer by profession
uoa_nz_mansfield_jh_0531.wav,get up and light the oven or I'll shake every bone out of your body
uoa_nz_mansfield_jh_0532.wav,Regional soda Garden open to the light
uoa_nz_mansfield_jh_0533.wav,she even thoughts for moments of hiding the watch
uoa_nz_mansfield_jh_0534.wav,a dark porch half hidden by Passion vine
uoa_nz_mansfield_jh_0535.wav,and it's not very sympathetic to sweat everybody's enjoyment as you're doing now
uoa_nz_mansfield_jh_0536.wav,he would have taken a taxi off to a decent toy shop
uoa_nz_mansfield_jh_0537.wav,I'll get the office boy to drop it and fix it
uoa_nz_mansfield_jh_0538.wav,she tossed a boy out and said a goose a guy
uoa_nz_mansfield_jh_0539.wav,I have so seldom the time or opportunity to open my heart to a woman
uoa_nz_mansfield_jh_0540.wav,I'm making my own curb and living entirely on raw vegetables and nuts
uoa_nz_mansfield_jh_0541.wav,I was admitted into the enclosure for the first time
uoa_nz_mansfield_jh_0542.wav,the Frog got out of bed walked in a determined fashion into the kitchen
uoa_nz_mansfield_jh_0543.wav,looking at this strange man with a mysterious voluptuous glands
uoa_nz_mansfield_jh_0544.wav,I can't help seeking admiration anymore than a cat can help going to people to be stroked
uoa_nz_mansfield_jh_0545.wav,he had a little flower shop just down the road
uoa_nz_mansfield_jh_0546.wav,to leap and puree on the porch lawn
uoa_nz_mansfield_jh_0547.wav,she wanted to push him out of the room and slam the door on him
uoa_nz_mansfield_jh_0548.wav,quick as a flash she remembered childish parties when they have played charades
uoa_nz_mansfield_jh_0549.wav,immersed and does Wells of English thoughts
uoa_nz_mansfield_jh_0550.wav,God bless has come and now Sadie is showing out of the pantry
uoa_nz_mansfield_jh_0551.wav,I wish you cut down to the gate and stop the coach
uoa_nz_mansfield_jh_0552.wav,well Isabel's precious friends didn't hesitate to help themselves
uoa_nz_mansfield_jh_0553.wav,I'm a ranch stuff with Chestnut and a tiny horn filled with fresh strawberries
uoa_nz_mansfield_jh_0554.wav,then the corners of the mouth dropped and his skin packet
uoa_nz_mansfield_jh_0555.wav,then put the coffee from the oven where jug into the saucepan
uoa_nz_mansfield_jh_0556.wav,get up cry to child speaking in the voice of immense Authority
uoa_nz_mansfield_jh_0557.wav,an expression was suggested a thousand premeditated invasions
uoa_nz_mansfield_jh_0558.wav,it wasn't to come upon a sheep with three legs
uoa_nz_mansfield_jh_0559.wav,at the end of the 6th I saw from the window the system of the baroness
uoa_nz_mansfield_jh_0560.wav,he was the son of the butcher
uoa_nz_mansfield_jh_0561.wav,one request so little for servants are untrustworthy
uoa_nz_mansfield_jh_0562.wav,sitting on the gate post far too early as usual
uoa_nz_mansfield_jh_0563.wav,but if you up and the cold flu after
uoa_nz_mansfield_jh_0564.wav,walking through air that has somehow grown heavy and solid like water
uoa_nz_mansfield_jh_0565.wav,running with an impudent smile
uoa_nz_mansfield_jh_0566.wav,the whole time was spent and rescuing him
uoa_nz_mansfield_jh_0567.wav,the humiliation of it I adore you
uoa_nz_mansfield_jh_0568.wav,and Miss Bruce moved the newspaper a store it was a manuscript of a part
uoa_nz_mansfield_jh_0569.wav,nothing each other in a way that is peculiarly trying to debutant
uoa_nz_mansfield_jh_0570.wav,they stand as close up to the Musicians as they can get
uoa_nz_mansfield_jh_0571.wav,they are you serving the Privileges of the beaches and wisest
uoa_nz_mansfield_jh_0572.wav,for then it is impossible for her to accept the attention of others
uoa_nz_mansfield_jh_0573.wav,Harrison perfectly turned out as usual cool Suave smiling The Peculiar little half smile
uoa_nz_mansfield_jh_0574.wav,did little squat hand with a brass and Turquoise Ring forces The Reluctant flute
uoa_nz_mansfield_jh_0575.wav,Rosa dragged off her mother's shoulders and wounded carefully around her own
uoa_nz_mansfield_jh_0576.wav,I want passion and love and Adventure are you in for them
uoa_nz_mansfield_jh_0577.wav,when I look back on my early years
uoa_nz_mansfield_jh_0578.wav,that was hilarious watching people listening to TV because of a dumb thing
uoa_nz_mansfield_jh_0579.wav,this is a doily
uoa_nz_mansfield_jh_0580.wav,I was much smaller than the average child in my class
uoa_nz_mansfield_jh_0581.wav,they are in the academic field and the educational field
uoa_nz_mansfield_jh_0582.wav,there's quite a strong influential body of opinion
uoa_nz_mansfield_jh_0583.wav,there's not the same enthusiasm for it
uoa_nz_mansfield_jh_0584.wav,my Association goes back even earlier than you mentioned in your preamble
uoa_nz_mansfield_jh_0585.wav,we go out for dozen oysters and don't think about these blocks
uoa_nz_mansfield_jh_0586.wav,I enjoyed your sort of bashing around and driving myself
uoa_nz_mansfield_jh_0587.wav,the protest without the desire to contribute is rather lacking in any sort of effectiveness
uoa_nz_mansfield_jh_0588.wav,we pay $0.30 a dozen for oysters
uoa_nz_mansfield_jh_0589.wav,now after all the present numbers of the present government party at 44
uoa_nz_mansfield_jh_0590.wav,he was the epitome of the phrase in English gentleman
uoa_nz_mansfield_jh_0591.wav,she was very anxious that her three children should be well educated
uoa_nz_mansfield_jh_0592.wav,three people from the national executive of the party make the choice
uoa_nz_mansfield_jh_0593.wav,he didn't even have those oysters
uoa_nz_mansfield_jh_0594.wav,it will be extremely short on food and fuel
uoa_nz_mansfield_jh_0595.wav,this is an assumption easy to demonstrate
uoa_nz_mansfield_jh_0596.wav,my tea bag thickens only when the water is warm enough
uoa_nz_mansfield_jh_0597.wav,I saw a cigar and believably long
uoa_nz_mansfield_jh_0598.wav,he prefers taking a bath after doing push-ups
uoa_nz_mansfield_jh_0599.wav,the iceberg vanish when we got closer
uoa_nz_mansfield_jh_0600.wav,the pink Blossom touching the green leaves
uoa_nz_mansfield_jh_0601.wav,she was holding a little umbrella
uoa_nz_mansfield_jh_0602.wav,this company developed a plan toy of solicitors to make more profits
uoa_nz_mansfield_jh_0603.wav,we are facing a slur organization process of the city
uoa_nz_mansfield_jh_0604.wav,zinc has a very strange molecular configuration
uoa_nz_mansfield_jh_0605.wav,the spa getting more customers than the little ale house across the street
uoa_nz_mansfield_jh_0606.wav,did Baba entertains the red bearded man with a great ape
uoa_nz_mansfield_jh_0607.wav,the Dutch abolished intra Urban traffic
uoa_nz_mansfield_jh_0608.wav,the Fisher ate rice to kill his new ache
uoa_nz_mansfield_jh_0609.wav,he got to Scott eight times the size of his thumb because of the Troublesome obstacle
uoa_nz_mansfield_jh_0610.wav,this place is too far although cheaper oil I would have gone there
uoa_nz_mansfield_jh_0611.wav,the shy eating patient was waiting for scanner outside the room
uoa_nz_mansfield_jh_0612.wav,she drank the whole job after she thought she had seen the forgiving angel
uoa_nz_mansfield_jh_0613.wav,I saw the weirdest car ever mentioning the price of the fuel
uoa_nz_mansfield_jh_0614.wav,you will find both objects in the path after defense
uoa_nz_mansfield_jh_0615.wav,a proper traveler airport should provide a good luggage organization
uoa_nz_mansfield_jh_0616.wav,the movie we watched for Action evening was a little odd
uoa_nz_mansfield_jh_0617.wav,the consumption age has overcome the slow ancient barter system
uoa_nz_mansfield_jh_0618.wav,I found a new recipe of bread but it requires a special sort of yeast
uoa_nz_mansfield_jh_0619.wav,I learned how to play the guitar easily
uoa_nz_mansfield_jh_0620.wav,I just walked past a dry Erie District
uoa_nz_mansfield_jh_0621.wav,the gorillas are is over let's be friends
uoa_nz_mansfield_sh_0001.wav,each guest who came into the breakfast room was bombarded with the wonderful news
uoa_nz_mansfield_sh_0002.wav,the gentleman wore black coats white silk ties and Fernie buttonholes tickling the chin
uoa_nz_mansfield_sh_0003.wav,myself I felt disappointed that there was not a salute of 25 guns
uoa_nz_mansfield_sh_0004.wav,did the spirit of romance spread her Rose Wings only over aristocratic Germany
uoa_nz_mansfield_sh_0005.wav,I suppose the searching after Fraulein Shaffer doesn't occupy all your days
uoa_nz_mansfield_sh_0006.wav,9 versus equally lovely commanded her to equally violent action
uoa_nz_mansfield_sh_0007.wav,warm the tea pots interrupted the hair rats pushing away his soup plates
uoa_nz_mansfield_sh_0008.wav,as for me I have had all I wanted from women without marriage
uoa_nz_mansfield_sh_0009.wav,that's a dumb niece with unwashed ears struck me as a most depressing object
uoa_nz_mansfield_sh_0010.wav,living with her I live with the coffin of my unborn aspirations
uoa_nz_mansfield_sh_0011.wav,cheer up old woman shouted her husband digging her in the ribs
uoa_nz_mansfield_sh_0012.wav,at 9:00 I drank some malt coffee and began my cure ribs
uoa_nz_mansfield_sh_0013.wav,by this time he had walked the length of fashionable Harcourt Avenue
uoa_nz_mansfield_sh_0014.wav,they all looked at me shaking their heads their mouths full of cherry stones
uoa_nz_mansfield_sh_0015.wav,you're rotten to the core and so am I but you're Heath initially beautiful
uoa_nz_mansfield_sh_0016.wav,the piano was closed and armchair was placed in the center of the platform
uoa_nz_mansfield_sh_0017.wav,there were even Rich buds unfolding and the leaves Sean like oil
uoa_nz_mansfield_sh_0018.wav,he measured a good wash stand picture in height and I smiled
uoa_nz_mansfield_sh_0019.wav,some little sparrows young sparrows they sounded chirped on the window ledge
uoa_nz_mansfield_sh_0020.wav,she smiled and swooping over she fastened her teeth in his glove
uoa_nz_mansfield_sh_0021.wav,but she has no right to let her daughters wear such short sailor suits
uoa_nz_mansfield_sh_0022.wav,a great Bush of purple lilac grew behind the summer house
uoa_nz_mansfield_sh_0023.wav,we gorged on scandals of high birth generously buttered
uoa_nz_mansfield_sh_0024.wav,I've been reading all about your English play in a newspaper
