common_voice_en_27344688.mp3,THOMPSON AND HIS WIFE KATHIE HAVE TWO DAUGHTERS ERIKA AND BROOK
common_voice_en_27284769.mp3,OTHERS NAMES ADJUSTS THE MAIN HOUNDS ARE MURDERED TYPEVILLE AND MUTINY
common_voice_en_19852813.mp3,WHILE GROWING UP AND CULTORY SEEING ATTENDED NUMEROUS STAMPEDE WRESTLING ADVENTURES WITH HER MOTHER
common_voice_en_19552441.mp3,THE STATION ALSO EXPANDED AND SNOOZED TO AN HOUR
common_voice_en_27560851.mp3,CODY OFFERS AN ANTI REDUCTIVEEST ACCOUNT OF TASTE OF MONEY
common_voice_en_28853281.mp3,THEY ARE SPECIALLY ACTIVE IN KEEN COUNTRY APOTHECI WAPATO AND HASTINGS
common_voice_en_21185596.mp3,CAN I DO ANYTHING FOR YOU
common_voice_en_25640010.mp3,THE ENTRY TO THE STATION IS FROM THE GALLERY LEVEL OF TWO LONG VILLAGE
common_voice_en_19743939.mp3,SAINT CYCLIN THE SKULL HAS USED THE OFF TEMPEST HAREFIELD FOR FOOTBALL GAMES
common_voice_en_19005146.mp3,THE CAMPAIGNS COULD NOT AGREE ON EITHER OF THEM
common_voice_en_23911917.mp3,HE LIVES IN SWITZERLAND AND HOLD THE SWISS CITIZENSHIP TO
common_voice_en_19852945.mp3,SHE DIED WHEN DAPHNE WAS TEN
common_voice_en_22749661.mp3,SHE BECAME THE SICKENED WOMAN FOR HER COUNTRY TO WIN THE TITLE
common_voice_en_23893756.mp3,SEXTON EARNED A DOCTOR AND PHYSICAL CHEMISTRY FROM IRELAND UNIVERSITY
common_voice_en_22758618.mp3,HOWEVER HIS FEELINGS TOWARDS THE RECORD WERE LARGELY NEGATIVE LEAVING HIM DEPRESSED
common_voice_en_18893964.mp3,CULTURALISM IS BECOMING AN INCREASINGLY IMPORTANT PART OF THE WIDER TOURIST INDUSTRY
common_voice_en_19852552.mp3,CRAYON IS SPOKEN MOSTLY AS AN INTERTRIBAL LINGUA FRANKLIN IN THE INTERIOR OF LIBERIA
common_voice_en_23893820.mp3,AT THAT TIME THERE WERE NO PRINTING SHOPS AND FINLAND
common_voice_en_18893619.mp3,AND I WAS THEN SINK TO BISHOP HONOR AND LONDON
common_voice_en_25641184.mp3,THE EXHIBITION WAS THE LARGEST DISPLAY OF MACKINTOSH DESIGN IN ENGLAND
common_voice_en_19550748.mp3,HE OWNS EIGHT FIRE BIRDS OVER ALL
common_voice_en_21162464.mp3,THE PART WHICH IS BANDS MOST NETWORK BORDER INSTINCT PUBLIC RECOGNITION
common_voice_en_19852648.mp3,THE GORGE IS OVERLONG AND STRETCHES FROM NEAR PUCKERANDI TO SOUTHEASTER OR TRAMP
common_voice_en_18967257.mp3,THE BASE FILLED CHAD'S TIME AS HE WAS UNABLE TO GO TO SCHOOL
common_voice_en_19853503.mp3,IT WAS FORMED AFTER THE MURDER OF THE FORMER CITIES OF CAIRO AND SUNSHINE
common_voice_en_19852814.mp3,FAMOUS EXAMPLES INCLUDE ENGLISH CANADIAN DAVID MITCHELL
common_voice_en_25359181.mp3,OR ELSE GENTLEMEN DESCENDED FROM THE ANCIENT BRITISH KINGS HIS FATHER WAS A FARMER
common_voice_en_25640917.mp3,BAGS STARTED WORK IN JOURNALISM AS A REPORTER
common_voice_en_21162485.mp3,HE WAS CHARGED WITH LEAVING THE SCENE OF AN ACCIDENT
common_voice_en_24957101.mp3,SOULS FOR CYCLING SHOES ARE USUALLY DIVIDED INTO THREE CATEGORIES
common_voice_en_27284712.mp3,SHERMAN'S TEST WAS PRESENTED UNCENSORED
common_voice_en_27637366.mp3,SHE THOUGHT THAT THE MAN WAS ASKING ABOUT WHAT SHE WAS CARRYING
common_voice_en_20049246.mp3,A LESS EXTENSIVE BUT SIMILAR INITIATIVE WAS INTENDED FOR THE EAST COAST OF AFRICA
common_voice_en_19547490.mp3,THE TAVERN WOULD SERVE AS MASONIC LODGE AND NORTH TORONTO TOWNSHIRE COUNCIL OFFICE
common_voice_en_21139513.mp3,SIMILARLY EDUCATION WAS DROPPED OUT OF SCHOOL
common_voice_en_19853804.mp3,SHE CURRENTLY IS A MOTHER OF A DAUGHTER AERONAUT
common_voice_en_18890738.mp3,THE JEWISH POPULATION WAS IMPORTANT IN THE TOWN
common_voice_en_27270035.mp3,EDITH NO HARMER WAS ELECTED THE FIRST NATIONAL PRESIDENT
common_voice_en_30650361.mp3,THEY CAN BE USED WITH POWER
common_voice_en_23911982.mp3,HUMANS HAVE ALSO COLONIZED THE JOVIAN MOON'S GANYMEDE AND CLUSTER
common_voice_en_23893799.mp3,THE PROJECT WAS SUSPECTED BY MATTHEW KIRKWOOD WHO BECAME THE FIRST GENERAL MANAGER
common_voice_en_19547520.mp3,OH REGINALD INTERRUPTED CARRIERS ALSO USE THE SELF TERMINAL
common_voice_en_18906284.mp3,THE SITE STILL REMAINS TO BE EXCAVATED BY ARCHAEOLOGISTS
common_voice_en_23566576.mp3,KITCHEN WASTE BROKEN OBJECTS AND SIMILAR MATERIAL ALL NEED TO BE DISPOSED OF
common_voice_en_21162432.mp3,MOST SUSPENICS AND SELF HEARSTON WHEREOF MEXICAN DESCENT
common_voice_en_19692991.mp3,THERE WERE SOME SURPRISES DURING THE COURSE OF THE CAMPAIGN
common_voice_en_18985471.mp3,THESE COMICS HAD TURNED OUT TO BE A SUCCESS VISITED BY THE LOCAL POPULACE
common_voice_en_28852478.mp3,INDIANA PACES HONOURS HAD SAID THE FEVER HAVE BEEN LOSING MONEY
common_voice_en_26986082.mp3,HE ALSO PROMULGATED A MODERN NEW SET OF BANKING AND INVESTMENT LAWS
common_voice_en_20049378.mp3,THESE LOCATIONS WERE CHOSEN SINCE THEY WERE THE SOURCE OF FREQUENT BOTTLE NECKS
common_voice_en_18977852.mp3,THAT HIS IMPLICATIONS ON THE EDUCATION OF NON NATIVE SPEAKERS
common_voice_en_23893767.mp3,HIS BRIGHT TONES FOCUSSED ON WHAT HE CALLED THE FAR CORNER WASHINGTON OR AGAIN IN IDAHOW
common_voice_en_18838320.mp3,THE TRADITIONAL LIFE STYLE WAS NOMADIC BASED ON CAMEL HERDING
common_voice_en_25641170.mp3,THE FEUD WITH RANSOM PUT THE REST OF THE BAND IN THE MIDDLE
common_voice_en_21181950.mp3,MOST ISSUES ARE CENTERED ON A DIFFERENT CITY OR STATE
common_voice_en_21160077.mp3,TWO MAJOR BRANDS OF DRIED GINGER ALE
common_voice_en_27871077.mp3,HISTORICALLY HENLEY HAS HAD SEVERAL PRIVATE LUNATIC ASYLUMS
common_voice_en_19547830.mp3,HIS FIRST MARRIAGE WAS TO AVOID WINNING A SHORT STOREY NOVELIST CARROLL BLIND
common_voice_en_21139234.mp3,HE LAUGHS UNCONTROLLABLY AND EXCLAIMS THAT HE REFUSES TO DIE AGAIN
common_voice_en_21185416.mp3,SHALL BE WENT THROUGH AN EXPERIMENTAL DRUG TREATMENT STRICT ARISING THAT MADE HER CAUSE SOME SEVERE COMPLICATIONS
common_voice_en_18893875.mp3,IN THE MIDDLE THE PLAYER CHARACTERS PLUMMETED TO A STRANGE PARTIAL PLANE
common_voice_en_18714511.mp3,IN SOME OCCASIONS VARIOUS MATERIALS WERE DUMPED IN MANY FIELDS AND LANDS
common_voice_en_25040768.mp3,UNDER GOVERNMENT PRESSURE THE MASSES HAD SHUT DOWN
common_voice_en_18893570.mp3,SOME OF MORE STRIPWORK HAS BEEN PUNISHED IN PARADISE TOO
common_voice_en_18884680.mp3,THERE IS NOT A SOLITARY METHOD USED TO SPARK A CHURCH PLANTING MOVEMENT
common_voice_en_23893800.mp3,AND MAY HAD BELONGED TO A JUVENILE
common_voice_en_18884757.mp3,THE NEIGHBOURHOOD IS PRIMARILY MADE UP OF PORTO RICANS DOMINICANS AND AFRICAN AMERICANS
common_voice_en_19561823.mp3,IT IS THE OPPOSITE OF AN EMBELLISHMENT
common_voice_en_25359455.mp3,THE BRITISH REFUSED AND THE TALKS BROKE UP
common_voice_en_21493991.mp3,THE COMPANY IS HE QUOTED AND JIKATA
common_voice_en_18893811.mp3,THE EMPHASIS IS ON GRANDEUR AND COMFORT AND STIR OF THE PRINTS
common_voice_en_19547486.mp3,THEY OPERATED AND THUS WITHOUT THE BEE NATIONALITY PREFIX
common_voice_en_19793981.mp3,THESE HAVE BEEN ENCOUNTERED IN THE PHONETIC EXTENSIONS AND PHONETIC EXCHANGE AND SUPPLEMENT BLOCKS
common_voice_en_19905200.mp3,THE SCHOOL COLORS ARE ORANGE AND BLACK
common_voice_en_27292376.mp3,MONSIEUR CLINICS HAVE FREQUENTLY BEEN THE SITE OF PROTESTS BY EMPTY ABORTION ACTIVISTS
common_voice_en_30650415.mp3,ELGINARIA AND POSSIBLY INTO UGANDA
common_voice_en_21139533.mp3,A PRECARIZED CABIN WAS TO BE PROVIDED
common_voice_en_21162483.mp3,RELIGIOUS ISLAMIC ART FORBIDS ICONOGRAPHY AND EXPRESSES RELIGIOUS IDEAS THROUGH GEOMETRY INSTEAD
common_voice_en_18906286.mp3,THE BANK FOLLOWS THE INTIMATE BANKING CODE NET BANKING AND SECURITY IS ENTRUSTED BY VERY SIGN
common_voice_en_25357984.mp3,THIS GAME A CELLAR AND CONCERT A VENERABLE STAR FIRE SYSTEM
common_voice_en_19692987.mp3,LOCATED MONSEY AND JEFFERSON COUNTY IT LIES IMMEDIATELY WEST OF LITTLETON
common_voice_en_22708466.mp3,FURTHERMORE HE LIKED TO PHOTOGRAPH AND OWNED A SMALL FRUIT FAT FAWN
common_voice_en_19547372.mp3,DURING THE SEVILLE THERE ARE MANY EVENTS HOWEVER INCLUDING CONCERTS QUIZ COMPETITIONS AND KAYOKI
common_voice_en_21203426.mp3,THEIR USE IS COMMONPLACE IN NEW ZEALAND WHERE THE POSSUM IS AN INTRODUCED PEST
common_voice_en_19552836.mp3,DETAILED DRAWINGS OF THE TOWEL WERE MADE
common_voice_en_20031462.mp3,IT OCCURRED MORE ACCOMMODATING AND OLDER PEOPLE
common_voice_en_21208422.mp3,LEARNING LEADERS WAS AND CONTINUES TO BE A KEY PARTNER IN THIS EFFORT
common_voice_en_18893534.mp3,DRIED ROSETTES ARE ALSO SOLD FOR PRIMITIVE CRAFTS AND HOME FRAGRANCE PURPOSES
common_voice_en_19547475.mp3,PRINT LAID ASIDE WITH GOOD AND SAVES HIS FATHER FROM THE MUTATION
common_voice_en_19852551.mp3,SATELLITE CONNECTION WITH THE REST OF THE WORLD ARE ALSO AVAILABLE
common_voice_en_19693303.mp3,A RELATED AND MORE GENERAL PHENOMENON IS THAT OF SUBJECTIVE VALIDATION
common_voice_en_18893624.mp3,THE BRIDGE PATTERN IS OFTEN CONFUSED WITH THE ADAPTA PATTERN
common_voice_en_25641428.mp3,HE WAS A MICHIGAN JOURNALISM FELLOW AND EDITOR OF NEW MEDIA FOR EDUCATION WEAK
common_voice_en_23911853.mp3,SEE BY CONTINENTAL COUNTRIES
common_voice_en_19693392.mp3,I HAVE DONE WHAT THE HIGGINS DECIDED HAD TO BE DONE
common_voice_en_20166903.mp3,FOR THE ELEPHANT ALEXANDRIA'S LEND IT ON THE ROOF OF BUNCH TOWERS
common_voice_en_20167440.mp3,THE MAJORITY AND MINORITY CATEGORIES AND SOCIETY CULTURAL VICES ENSUE
common_voice_en_23798440.mp3,MOREOVER THE MUD ALGAE AND LECTURES COMPROMISE THE LAKES APPEAL AS A SWIMMING DESTINATION
common_voice_en_25640532.mp3,IT IS BORDERED TO THE SOUTH WEST BY THE BOROUGH OF NEW WASHINGTON
common_voice_en_20029534.mp3,HE WAS THE HALF GIANT'S SON OF POSEIDON AND DYER
common_voice_en_18496989.mp3,I WAS TRAINED IN THE DARK HEARTS OF ASSEMBLY CODIN
common_voice_en_19692966.mp3,THE TOWN IS SURROUNDED ON THREE SIDES BY MOUNTAINS OF SEVERAL HUNDRED FEET
common_voice_en_22443856.mp3,HE WAS ENTRUSTED WITH OTHER OFFICERS CALLING FOR VIGOR OF ACTION AND PRACTICAL WISDOM
common_voice_en_21208416.mp3,HE LIFTED A CLUB AT THE END OF THE SEASON AND RETIRED FROM FOOTBALL
common_voice_en_22749715.mp3,THERE ISN'T A FOOL ELSE KNOWN ABOUT HIM
common_voice_en_28853078.mp3,WILLIAMS HIMSELF PLAYED ACCUSTA GUITAR ON A COVER OF CARROLL KINGS SO FAR AWAY
common_voice_en_23893313.mp3,WATTEAU TURNED ON A NUMBER OF CHALLENGING PROJECTS AND SOON DEMONSTRATED A STRONG ABILITY
common_voice_en_19867856.mp3,FANS WERE UPSET ENOUGH TO WRITE IN ASKING TO SAVE GRAHAM
common_voice_en_21139526.mp3,THE TIPS OF THE LONG TAIL FEATHERS ARE WHITE
common_voice_en_18967258.mp3,A PLAYER WHO CAPTURES THE OPPONENT SALT REMAINING KING OR PRINTS WINS THE GAME
common_voice_en_19547615.mp3,DENIS'S STORYTIME LATER CEASED OPERATIONS
common_voice_en_19852732.mp3,THE UNIVERSITY SHARES THE CAMPUS WITH JAMES A RHODES STATE COLLEGE
common_voice_en_25641458.mp3,SHE IS A LONG TORMENTING YOU CLEAR CAMPAIGNER PROMOTING THE USE OF RENEWABLE ENERGY
common_voice_en_18714586.mp3,ZHUKOVSKY LIES TO THE SOUTH WEST OF THE DRIFT JACKSON BASIN
common_voice_en_23893765.mp3,SOME CENTRAL AUTHORITY MUST BE THERE TO PLAN AND REGULATE ALL THIS
common_voice_en_21206866.mp3,RECENTLY THERE ARE ELECTRIC STRING TREMORS THAT OFFER THE SAME PERFORMANCE AS GASOLINE POWDERED TREMORS
common_voice_en_19519456.mp3,THE NORTH LONDON SIDE ALSO HIRED DAVID SALMON AS GOKEEPING COACH
common_voice_en_21230374.mp3,THE SEAT IS LOCATED IN THE CITY OF CELLAR
common_voice_en_22758629.mp3,JERRY TRIES TO TELL ELSIE BUT HE THINKS THAT JERRY HAS HELPED
common_voice_en_19693298.mp3,IT WAS CREATED BY SCULPTOR J BRICK GRILL OF COLUMBIA MISSOURI
common_voice_en_27870757.mp3,THE LIST BELOW IS ORGANIZED BY STATE AND WITHIN EACH STATE BY POPULATION SIZE
common_voice_en_19547384.mp3,SOMETIMES THE TERM AND OF POPULATION IS APPLIED TO A SPECIFIC ECONOMIC SYSTEM
common_voice_en_18896541.mp3,AN ARCHAEOLOGICAL MUSEUM IT CONTAINS THE ISLAMIC ART MUSEUM OF MIRACLES
common_voice_en_20166624.mp3,TWO NEW ADDITIONAL REACTORS ARE PLANNED
common_voice_en_20167620.mp3,IT CAN ALSO BE MADE FROM CHEMICAL RECITING OF CARBON DIOXIDE
common_voice_en_19693091.mp3,HE CLAIMED DORISMOND GRABBED THE GUN CAUSING IT TO DISCHARGE INTO HIS CHEST
common_voice_en_20166698.mp3,BUT TWICE THEY HAVE ELECTION
common_voice_en_25640550.mp3,HE WAS AN ESSAY WHICH MEANS THAT HE IS A SECOND GENERATION JAPANESE AMERICAN
common_voice_en_19962236.mp3,THE VAST PARK N IS A RECENTLY REFERBUSHED FAMILY MOTOR WITHOUT D'ARTAGNAN'S EATING
common_voice_en_21209910.mp3,WHILE IN CONGRESS HE SERVED AS THE CHAIRMAN OF THE COMMITTEE ON WOMAN'S SUFFRAGE
common_voice_en_19852734.mp3,IT HAS RECENTLY BEEN PLACED ON JAPAN'S RED LIST OF THREATENED AND PHOBIANS
common_voice_en_18909346.mp3,IT IS LOCATED TO THE NORTH OF NEWBURY NEAR THE VILLAGE OF DONINGTON
common_voice_en_25640004.mp3,HE IS ONE OF THE PLAYERS WHO SURPRISED EVERYBODY
common_voice_en_27871225.mp3,SALAM BURNED UP DYKE HIMSELF
common_voice_en_22749686.mp3,SAID LYCIA SURPASSED BY D'ARTAGNAN'S DAY'S BIRD SEASON PERIOD
common_voice_en_18963324.mp3,THERE ARE CIVIL TRIPS DAILY
common_voice_en_21159887.mp3,THE SONG IS IN THE KEY OF YE MAJOR
common_voice_en_28853066.mp3,ONE ADDED THAT SHE HAD MARRIED AND DIVORCED THE PIANIST TWICE
common_voice_en_20031593.mp3,THEY'RE A QUESTING UNIT BUT DIRECT THE INSTRUCTS
common_voice_en_25640599.mp3,SHALLOW WATER IS THE NORTHERN TERMINUS OF THE GARDEN CITY WESTERN RAILWAY
common_voice_en_20167624.mp3,IT WAS DIRECTED BY FRANK LLOYD
common_voice_en_27344635.mp3,HOWEVER IT SENDS ME TO SYMPATHY IT BY EVEN MORE STABLE COMBATS SUCH AS PETROL
common_voice_en_25345715.mp3,THE SONG AS ALSO APPEARED IN ANOTHER PART OF THE TERMINATED SERIES TERMINATED SALVATION
common_voice_en_23893454.mp3,AGRICULTURE AND CLOTHES VINEYARDS SERIALS AND OLIVE GROVES
common_voice_en_19547444.mp3,MALCOLM MAC DOWELL PLAYED THE BELLY ACCOMPANY'S ARTISTIC DIRECTOR A CHARACTER BASED ON GERALD D'ARTAGNAN
common_voice_en_25354173.mp3,HE WAS LATE AS SAID TO BE IN A STABLE CONDITION
common_voice_en_19551003.mp3,THERE ARE TWO POPULAR MODES OF DUE APOLOGY THAT IS CAN ALL SWALLOW AND TREMBLE AND SMUDDLE
common_voice_en_18714488.mp3,HE IS MENTIONED IN THE DOMESDAY BOOK
common_voice_en_19547539.mp3,THE HOSPITAL IS ACCREDITED BY THE TREATY COMMISSION
common_voice_en_21139176.mp3,THEY PLAYED CLUBS AND DALES AND IN DELLA'S SPACE DRAMA DOMINIC WEIR AND STUDDED PLAIN SHOWS
common_voice_en_18893479.mp3,THIS WAS ALSO A HISTORICAL USAGE OF THE CHARACTER IN CHINA
common_voice_en_19519472.mp3,FRANCE NO LONGER POSSESSES LAND BASED NEW CREATURES
common_voice_en_23893581.mp3,HIS SON WAS ADOLPH'S SEX WHO INVENTED THEIR SEX AFIRE IN THE SEX HORN IN THE SEX OR TREMBLING
common_voice_en_27292481.mp3,HE WAS ON THE BASKETBALL AND TRACK TEAMS AT BOTH SCHOOLS
common_voice_en_18893905.mp3,WINDICH'S FIRST EXPIRATORY EXPEDITION WAS THE THIRD EXPEDITION OF THE EXPLORER CHARLES HUNT
common_voice_en_19552432.mp3,CAMILLA MAYHAP THE FIRST FIGURE IS UNPROPER
common_voice_en_18714490.mp3,MURRAY DEPARTED THE RED WINGS FOLLOWING THE SEASON
common_voice_en_19693151.mp3,A CROP DUSTER PILOT JOHN CURRY WAS ALSO KILLED IN THE CRASH
common_voice_en_19905234.mp3,THIS IS WHAT ALLOWED HIM TO INTRODUCE MANY REGIONS OF TREASON
common_voice_en_27284740.mp3,IT TYPICALLY INVOLVES A SULPHUR AGENT WHICH IS DIFFICULT TO DETECT FOR A MOMENT
common_voice_en_30120327.mp3,THE MILITARY BASE IS MANAGED BY THE DEVOTED DEFINITE SPACEPORT GROPE
common_voice_en_21185324.mp3,OF THE FIVE ONLY SURER ONE HIS WORDS PLAYING FOR TWO DIFFERENT TEAMS
common_voice_en_19553002.mp3,SHE ALSO SUCCEEDED TO THE BARONY OF LUCAS
common_voice_en_19552195.mp3,I THOUGHT IT WAS A PERFECT NAME FOR THE ALGER
common_voice_en_20049030.mp3,HOWEVER TREATMENT SHOULD BE TAILORED TO THE PARTICULAR TYPE OF PERIODIC PARALYSIS
common_voice_en_20049245.mp3,THE ENSIGN ALSO BREAKS DOWN STORED PROTEINS INTO THEIR MINERAL ACID DERIVATIVES
common_voice_en_24569296.mp3,WITH AN EXPLORATION OF ASSOCIATED RISKS
common_voice_en_23893339.mp3,HE IS CURRENTLY AND CONSULTED IN THE NEWS JERSEY STATE PRISON
common_voice_en_27870806.mp3,MINNIE WERE FEATURED IN THE TELEGRAPHED GREETINGS METROPAND
common_voice_en_18985520.mp3,THE PHONE CONSISTS PRIMARILY OF THE INTERRUPTIONS BETWEEN THE CHARACTERS
common_voice_en_20168244.mp3,HE PLAYED CLUB HOCKEY FOR SALSCAPE
common_voice_en_20031189.mp3,FIVE YEARS BEFORE HIS TEETH FAIRLY RETURNED TO HIS NATIVE COUNTRY
common_voice_en_19552184.mp3,ABOUT THE SCOURGE THERE WAS AN INTEGRAL BRAKE WHEEL ABOUT WIDE
common_voice_en_18935391.mp3,MITROGATE ALSO PROVIDES BLOCK CHARTERS FOR CLIENTS WHO REQUIRE FREQUENT TRAVEL
common_voice_en_27870871.mp3,ABRAM KEEN WAS BLAMED FOR THE DISASTER FOR SEVERAL REASONS
common_voice_en_21139169.mp3,AN AUTOMATIC WITHOUT A DRIV
common_voice_en_28852736.mp3,IT FLOWS THROUGH THE MAGDALENA RIVER VALLEY
common_voice_en_18967260.mp3,NOR DID HE WEAR THE FAMED COLORS OF SILVER AND BLACK
common_voice_en_19553054.mp3,HE HAS MARRIED TO NICAMA RUVELIN AND HIS FOUR CHILDREN
common_voice_en_19548004.mp3,WE USED TO TREPASS THE NEIGHBOURHOOD
common_voice_en_21162440.mp3,AFTER ALL PLEASURE WAS ONE THING AND BUSINESS ANOTHER
common_voice_en_27870847.mp3,THE LEAD ARCHITECT OF THE PROJECT WAS EDWARD F KNEES OF SHRIEVE PORT LOUISIANA
common_voice_en_23893440.mp3,SOME OTHER IMPORTANT ARTISTS FOR HER ARE PAUL SYMON AND LAURA NARROW
common_voice_en_26986054.mp3,THE DOMINO SUGAR FACTORY WAS ALSO LOCATED NEAR BY
common_voice_en_19567981.mp3,GREGORY THOMPSON
common_voice_en_19693300.mp3,EXAMPLES FOR THOROUGH SYNTHETIC PIGMENTS ARE CHLOROFORM CARTINOIDS AND FLY CHLOE COBBLERS
common_voice_en_27270553.mp3,BAD COAT SMELLS CAN BE AN INDICATOR OF FACTORS THAT CONTRIBUTE THE TECHNICAL DEBT
common_voice_en_22749663.mp3,IN HER FINAL STORY LINE STIFFENING FORESTER LOST HER BEDROOM KANSAS AND DIED
common_voice_en_24206661.mp3,CASS SPEAKS FLUENT ESTONIAN AND ENGLISH AND AS CONVERSATIONAL IN RUSSIAN AND ITALIAN
common_voice_en_19743941.mp3,THE FOREWORD IS BY A JAPANESE WRITER BENEATH A YOSHIMOTUM
common_voice_en_18900722.mp3,THEY ARE MESSER DESIGNED COMMERCIALITIES OF ENGINES WITH NO COMMUNITY TO PUMA
common_voice_en_25640553.mp3,PECK ALSO ESTABLISHED A WEEKLY RELIGIOUS JOURNAL THE WESTERN PIONEER
common_voice_en_19612311.mp3,BRAD SHEPHERD SAID IT HAD THE POTENTIAL TO BE A CAREER DEFINING RECORD
common_voice_en_21203549.mp3,HE WAS A FOUNDING MEMBER AND TEACHING MEMBER OF THE INTERNATIONAL TRANSACTIONAL ANALYSIS ASSOCIATION
common_voice_en_18530341.mp3,THE PACKAGING IS REFUSABLE AND ENVIRONMENTALLY FRIENDLY
common_voice_en_19693274.mp3,THEY ROTATED THE ROTATIONS STARTED AND PERISHED
common_voice_en_141411.mp3,A DRUMMER PLAYING A RED DRUM SET
common_voice_en_19547790.mp3,ONE SATURDAY MORNING ADVERTISED AS FIVE HOURS OF SUMMER ONCE A WEEK
common_voice_en_19597455.mp3,THE LEADERS UNANIMOUSLY AGREED TO ITS CREATION AND LENA BECOMES ITS FIRST CHAIRMAN
common_voice_en_25640407.mp3,THE COURT REJECTED GREENWOOD'S CLAIM THAT THE AMENDMENT VIOLATED THE DUE PROCESS CLAUSE
common_voice_en_21494149.mp3,NO ONE WAS TAKEN AS A PRISONER TO LONDON WHERE HE DIED SHORTLY AFTERWARDS
common_voice_en_22758703.mp3,THE ELBOW FEATURES RESTS ENOSQUE SOUNDSCAPES ON MANY OF THE SONGS
common_voice_en_18567569.mp3,NOBODY SAID YOU DID SAID THE RED QUEEN
common_voice_en_25380178.mp3,THESE TIGERS WERE INSULT TO GOLD SHOPS SOUVENIR SHOPS AND PHARMACES
common_voice_en_22749664.mp3,ITS FLOWERS OCCUR SINGLY ARE FIVE PITCHED IN WHITE
common_voice_en_22214263.mp3,OTHERWISE THEY MOVE USING THEIR FRAGILLA
common_voice_en_19547492.mp3,BORN AND MAILHOUSE FRITZ CAGES THE HID OF GAME DEVELOPED INDIA QUANTITIES
common_voice_en_27871050.mp3,BONAMAS AND HART CHOSE FIVE SONGS FOR THE ALBUM EACH
common_voice_en_20031863.mp3,THE TWO GREEN STRIPES REPRESENT MARJORIE'S NATURAL WEALTH WHILST THE WHITE BAND REPRESENTS PEACE
common_voice_en_21185356.mp3,THE CASINO WAS REMOVED AND REPLACED BY SEVERAL OFFICERS CLASSROOMS AND CONFERENCE FACILITIES
common_voice_en_19744447.mp3,THE VEHICLES ARE A DIFFERENT TYPE THOUGH BOTH VISIONS ARE SUNG BY DAVID GILMORE
common_voice_en_21159888.mp3,HIS EXECUTION MADE HIM A MARTYR TO THE UPPER CANADIAN REFORM MOVEMENT
common_voice_en_19693394.mp3,LOCATION MADAM BAPTIST CHURCH MONTEREY BAPTISTS PASTORIAL CIRCLE
common_voice_en_21185415.mp3,TO SIT WAS NEVER WISER EVEN TO HER DEATH
common_voice_en_21185689.mp3,HOWEVER THIS ASSUMPTION IS NOT SUPPORTED BY EITHER FINAL GENETIC ANALYSIS OR FOSSIL EVIDENCE
common_voice_en_18893620.mp3,THE CRESTED GHETTO HAS HEALTHY PROJECTIONS FOUND ABOUT THE EYES RESEMBLING EYELASHES
common_voice_en_25640092.mp3,THE CANADIAN INDIA ROCKBAND THE VIOLET ARCHES IS NAMED FOR ARCHER
common_voice_en_18838362.mp3,AND THE STORY OF THE NEAR ORGANISM DOORS OBTAINS THE FOG MOTHER'S POWERS
common_voice_en_19547552.mp3,TO DAY FATINI DOES NOT ADHERE TO ANY POLITICAL PARTY
common_voice_en_18893948.mp3,EARLY PROGRAMMING WAS NOTED FOR ITS CREATIVITY AND INNOVATION
common_voice_en_18893836.mp3,IN A LATER PRESS RELEASE LOPEZ ANNOUNCED A DETAILED ITINERARY
common_voice_en_19005149.mp3,IT IS TIME TO FORESEE IN VAIN AN EARLY RESIDENT
common_voice_en_22708437.mp3,ACCUSTICAL ENGINEERS ARE TYPICALLY CONCERNED WITH THE DESIGN ANALYSIS AND CONTROL OF SOUND
common_voice_en_21139281.mp3,THE COLOR IS GRAIN
common_voice_en_21203547.mp3,THE LIBERALS QUICKLY RECRUITED THEIR ELECTION EXPENSES WHENCE THEY WERE IN GOVERNMENT
common_voice_en_19867620.mp3,ELIZABETH DECIDED THAT THEY NEEDED A PRODUCT WITH AN EDGE AND STAINED REMOVAL
common_voice_en_20031313.mp3,MILAN DAINCOTT'S ALL KEYS WITH HIM
common_voice_en_19852776.mp3,AFTER THAT HE BEGAN A FOUR YEARS SPENT WITH THE NEW ENGLAND PATRIOTS
common_voice_en_21494166.mp3,THIS WILL SEE I'M A YEAR AND YOU'RE OUR FASHION WITH SUCH WISHES
common_voice_en_22758593.mp3,HE IS KNOWN FOR HIS FLUID SCAPEBOARDING STYLE AND INVENTING THE BIG SPIN SCAPEBOARD TRICK
common_voice_en_18893553.mp3,CAVENDISH HOWEVER RECEIVES NO BENEFIT
common_voice_en_18893569.mp3,THEY USE THE ARGUMENT OPERATION TO CONSTRUCT A NEW MODIFIED OPERATION
common_voice_en_21185339.mp3,LEADING GENERALS WERE ASSASSINATED AND THE ARMY PROVED INCOMPETENT TO HANDLE COMMAND AND CONTROL
common_voice_en_19552839.mp3,IT'S A MAN BUT NOT FOR YOU
common_voice_en_18909341.mp3,ON THE OTHER HAND SHE TRIED TO MAKE PEACE WITH THE MONGOLS
common_voice_en_25358039.mp3,A LONG TIME FRIEND OF MILBURGH ARE LAID HE MANAGED LAD'S CONGRESSIONAL CAMPAIGNS
common_voice_en_19852834.mp3,JONATHAN WONDERS CENTRAL PARK AND COMES UPON SARAH'S JACKET ON THE PARK BENCH
common_voice_en_20029537.mp3,IT IS TO SEE TO THAT PROVINCE AND THAT MUNICIPALITY
common_voice_en_18909342.mp3,THE MEANING OF HIS STATEMENT IS STILL UNCERTAIN
common_voice_en_19693040.mp3,THE SPORTS COMMISSION DID NOT AGREE AND THE RESULT WAS NOT CHANGED
common_voice_en_18893573.mp3,O'NEIL'S PRESIDENTIAL MEDAL OF FREEDOM AWARDED POSTHUMOUSLY BY PRINCIPLE AND GEORGE W BUSH WAS STERNATED
common_voice_en_20031817.mp3,MOST OTHER STYLES OF DANCE ARE IGNORED AS EMPHASIS AS PRIMARILY ON PERSONAL PREFERENCE
common_voice_en_19547789.mp3,THE FOAM INCLUDED PREVIOUSLY UNRELEASED INTERVIEWS PHOTOS AND THORN FRUITAGE OF KENDALL BURGER
common_voice_en_20168262.mp3,JACKSON TREASURED IT FROM THE UNIVERSITY OF OREGON WITH A DEGREE AND POLITICAL FLORENCE
common_voice_en_19962364.mp3,IN HARVEST MEN MAY HAVE THE ORNAMENT OF SPINES
common_voice_en_19552440.mp3,IN THIS CONTACTS IT MAY BE CALLED A CONTINUATION
common_voice_en_25359386.mp3,THE ACHAEA LIVE AND ELONGATED HOUSES MADE FROM BAMBOO WOODS AND CANE LEAVES
common_voice_en_27637591.mp3,MC DONALD HAS SINCE STARTED ANOTHER RELATIONSHIP AND MARRIED
common_voice_en_18985543.mp3,BOTH GIRLS WERE SUMMONED TO LONDON TO EXPLAIN THEIR ACTIONS
common_voice_en_23893380.mp3,AFTER GRADUATING DELAWARE WAS A CIVIL ADMINISTRATOR OF PUBLIC SERVICES
common_voice_en_19744544.mp3,HE WAS EDUCATED BY THE IRISH CHRISTIAN BROTHERS AT SAINT MARY'S COLLEGE CROSBIE
common_voice_en_19744494.mp3,THEIR EMPLOYMENT OCCUPIED HERE FOR ABOUT A MONTH
common_voice_en_25345713.mp3,A BUY CARTRIDGE WAS LENGTHENED BY ABOUT TO FIT THE SHARP FRONTED STEEL BULK
common_voice_en_19547474.mp3,THE EXCLUDED EXECUTORS EDUCATED AND PENSION FELL UNDER THE THREAT OF VIOLENCE
common_voice_en_19730834.mp3,IN A SHELTERED COVE THEY FOUNDED A SETTLEMENT
common_voice_en_20049205.mp3,LATER HE BECAME A STORY EDITOR AT PINEWOOD STUDIOS
common_voice_en_18893613.mp3,SILLY SCAPE QUALITY WAS ALSO RUINED BECAUSE OF THE PRAGMATIC MODERNIZATIONS OF ASSORTED ECONOMY
common_voice_en_23893766.mp3,ACOUSTICALLY IT IS A CLOSE MED FRONT CENTRAL ROUNDED FOWL
common_voice_en_29741940.mp3,A TOP TIN RESULT WAS ACHIEVED FOR THE SECOND TIME IN THREE YEARS
common_voice_en_27292305.mp3,IT IS BEING EXPENDED TO INCLUDE SOME OF THE NEIGHBOURING DRYLAND FARMING AREAS
common_voice_en_19946488.mp3,DON'T MUDDLES WITH THE HINDERED THOSE WHO BUILT AND TEMPTED WITHIN REPRODUCTION
common_voice_en_21139147.mp3,THE DEPTH OF THE FRAME BERRIES
common_voice_en_30645483.mp3,SO ENJOY IT WHILE IT LASTS
common_voice_en_21493959.mp3,THEY ALSO HINT BY THEIR OWN SHOWS WITH SUPPORTING ACTS LIKE WE ARE THE FURY
common_voice_en_25640559.mp3,THE TRIPPER A CRICKET TEAM PARTICIPATES IN THE RANGAY TROPHY THE INDIAN DOMESTIC CRICKET COMPETITION
common_voice_en_18890731.mp3,THEY WERE THE COAL MEMBERS OF THE PORTLAND'S FIERY
common_voice_en_28852498.mp3,YEAST IS NO LONGER INVOLVED WITH THE STATION BUT HAS MAINTAINED LOCAL MEDIA PRESENCE
common_voice_en_21139515.mp3,HOWEVER OTHER VIEWS HAVE BEEN SHARED AND A VIGOROUS DEBATE PROCESS TO THE STATE
common_voice_en_18714929.mp3,FILO IS THE CLOSEST MUNICIPALITY TO BLUE ROCK STATE PARK
common_voice_en_24569283.mp3,UNLIKE THE KEY OF MEADOW KHAKI IS NOT PROVIDED ANNOUNCED ONE MUNICIPAL COMPANY
common_voice_en_20284818.mp3,THE TWO WERE EVENTUALLY STOPPED WORKING TOGETHER
common_voice_en_19853795.mp3,TO DAY ITS ONLY ENGLISH LANGUAGE PUBLICATION HAS BEEN IN THE AMERICAN MAGAZINE COMIC'S REVIEW
common_voice_en_19550929.mp3,THE DRIVER INTENDS TO KILL HIMSELF AND HIS PASSENGERS BY CROSSING THE TRAIN
common_voice_en_25359389.mp3,ITS RESISTANCE TO SMALL ARMS FIRE AND TRENCHNEL
common_voice_en_19562764.mp3,THE NOVEL DEALS WITH THE NATURE OF TRUTH AND FICTION
common_voice_en_19853464.mp3,HER NAME WAS LATER FEATURED IN LONDON'S ADVERTISEMENTS
common_voice_en_19852881.mp3,PHENOMENA HAS NEVER BEEN CONSIDERED PART OF STAR TRACK CANNON
common_voice_en_19946621.mp3,THE DOLLYCOCK CAME CROWNED WITH LOCATE A HERE
