common_voice_en_19853462.mp3,THE TOWN IS THE ADMINISTRATIVE SEAT FOR THE GILGANDRASHIRE
common_voice_en_20031681.mp3,EVENTUALLY THE IMAGES CONSUMED NEARER CHROMATIZING HIM AND RESULTING IN HIS DEFEAT
common_voice_en_28852473.mp3,HE LIVED IN CINCINNATI OHIO
common_voice_en_20167585.mp3,OTHER PHENOMENONS BEGIN OPENING STUDIOS AND HOLLYWOOD AREA
common_voice_en_19573618.mp3,SLOWLY WENT MAD FROM THE VIOLENCE THAT SURROUNDED HIM
common_voice_en_19693361.mp3,NORTHERN AND WESTERN MOSLEMS HAVE DOMINATED THE COUNTRY'S POLITICAL AND ECONOMIC SYSTEM SINCE INDEPENDENCE
common_voice_en_19852833.mp3,THE RESULTS FOLLOWED
common_voice_en_141410.mp3,TWO YOUNG CHILDREN BOUNCED ON A SHORT TRAMPLING
common_voice_en_19867743.mp3,BY THE TIME OF CHLOE'S RETURN CELLAR WAS IN AN ADVANCED STATE OF COLLAPSE
common_voice_en_18977847.mp3,ITS CAPITAL WAS CHEER VARIETY
common_voice_en_19552840.mp3,THEY ARE FOUND AND SHOUTED AREAS SUCH AS BAYS BAYOS THE GHOONS AND HISTORIES
common_voice_en_25380179.mp3,THE SCHOOL FACILITY IS LOCATED IN LITTLE FAULTS TOWNSHIP
common_voice_en_21139191.mp3,A NUMBER OF STATE HIGHWAYS SERVED THE CITY
common_voice_en_21185615.mp3,BLINDER WAS BORN TO A JEWISH FAMILY AND BROOKLYN NEW YORK
common_voice_en_19552185.mp3,GENTLE WAS FAWN AND COLUMBUS FOR HIRE
common_voice_en_18890769.mp3,THE BUILDING HAS THE GRAND HALL AND OUTER RIM AND THE KITCHEN
common_voice_en_18985424.mp3,INTERFERENCE FROM BOTH KING AND VICE KING WAS THE A FORMIDABLE
common_voice_en_18909367.mp3,HAWORTH BAND IS ONE OF THE OLDEST SECULAR MUSICAL ORGANIZATIONS AND THE KEITHLEY AREA
common_voice_en_25639951.mp3,NO SCRIPTS ARE ALOUD
common_voice_en_28852959.mp3,THEY CONTRIBUTED SIX TRACTS ALONG WITH OTHER EARLY BOSTON HARD CALL BAND GANG GREEN
common_voice_en_23893398.mp3,I CAME AS A STUDENT
common_voice_en_18714525.mp3,HE EARNED HIS PAGE B
common_voice_en_21162481.mp3,STREETS HAD ALSO BEEN RE SURFACE WITHOUT FAULT AFTER DECADES OF NEGLECT AND DETERIORATION
common_voice_en_18985434.mp3,YOU WROTE A GEOGRAPHICAL COMPENDIUM KNOWN AS BOOK CAPRICIOUS RECORDS
common_voice_en_21206743.mp3,IT OCCURRED ON THE ELECTION OF MISTER CLEVELAND TO THE PRESIDENCY
common_voice_en_18893819.mp3,THE EXCHANGE WAS BEEN NAMED AT THE PHILADELPHIA BALTIMORE STOCK EXCHANGE
common_voice_en_19693272.mp3,DESPITE THEIR BLOSSOMING ROMANCE VIRGINIA ABRUPTLY LEAVES TOWN WITHOUT EXPLANATION
common_voice_en_27871307.mp3,THE FIRST SINGLE WAS CALLED FIBRE AND FEATURED WICKLIFFE JEAN
common_voice_en_23912038.mp3,PARAPHERNALIA GENERALLY FOOLS AND TO TWO CATEGORIES USES SPECIFIC PRODUCTS AND DEALERS SPECIFIC INTRODUCTS
common_voice_en_18906287.mp3,AFTER GRADUATION HE RETURNED HOME TO ARIZONA WHERE HE BEGAN A SCHOOL PRACTICE
common_voice_en_18884776.mp3,BUT IT DOES ALSO A VERY CONSIDERABLE REPROACH TO POLITICS
common_voice_en_89113.mp3,A LITTLE GIRL IN A PINCHOT IS LOOKING AT A TOY DOLL
common_voice_en_25353877.mp3,IN THE CENTRE THERE WAS A CHAMBER OF BURNT BRICKS TO KEEP SACRED RELICS
common_voice_en_19946652.mp3,BICKER'S MAGDALENA IS ONE OF THE MOST TYPICAL LOCAL FRUITS IN THE GAME OF PREFECTURE
common_voice_en_19519433.mp3,NONE UNKNOWN UNKNOWN UNKNOWN TO HAVE SURVIVED
common_voice_en_18985459.mp3,DEMANDED ROSCOE COAXESON TO D'ARTAGNAN TWAS IN THE STRONG BOX
common_voice_en_21185691.mp3,FOR ME NOW IT'S ABOUT WHO I WORK WITH
common_voice_en_27870790.mp3,A PRIESTESS OF THE CULT OF LOUDOIR WAS NAMED IN EACH CITY
common_voice_en_21181949.mp3,THE COHEN BROTHERS NEXT FOAM O BROTHER WHERE ART THOU
common_voice_en_20284778.mp3,THE SOUND TRACK BECAME A CHARRED BUSTER UPON RELEASE AND WAS HIGHLY ACCLAIMED
common_voice_en_20996242.mp3,HE INDORSED CORALLINE'S ALLEGATIONS AGAINST KARA VARALLA
common_voice_en_22758599.mp3,THESE HAVE RECENTLY BEEN DEVELOPED INTO LAYBORNE LAKE'S COUNTRY PARK AND A HOUSING DEVELOPMENT
common_voice_en_23893395.mp3,IT IS THE STATE'S LODGER'S HOSPITAL
common_voice_en_18884676.mp3,SHE RESIGNED AFTER BEING CHARGED WITH DRIVING UNDER THE INFLUENCE
common_voice_en_26986083.mp3,HE IS AN ACCOMPLISHED PHONOGRAPHER
common_voice_en_18884759.mp3,HE BEING FINISHED ROBERT OFF WITH THREE SWORD BLOWS TO THE HEAD
common_voice_en_21183329.mp3,HE TRAVELLED TO INDIA AND CHINA AND ATTENDED SCIENTIFIC CONFERENCES TOGETHER MORE DATA
common_voice_en_24569305.mp3,THERE WAS ALSO A JAR BASED CONSOLE WITH ANTECEDENT RELEASE FUNCTIONALITY
common_voice_en_19550749.mp3,IT ASSUMED A SERIOUS HISTORICAL VISION OF EUROPEAN UNITY
common_voice_en_18900789.mp3,THIS TIME THERE WAS NO DOUBT ABOUT ALBERSON BEING THE SCORER
common_voice_en_19034547.mp3,MASTER MIND WERE MUSICALLY VERY DIFFERENT FROM JOURNEY
common_voice_en_21209950.mp3,CUSTOM RUBBERS ARE ARRANGED IN GROUPS THAT ARE SOMEWHAT TO THEIR BEAUTIES
common_voice_en_19744527.mp3,COMMUNICATION SENSATIONS CONSIST OF REQUESTS AND RESPONSES THAT OCCUR BETWEEN APPLICATIONS
common_voice_en_18946861.mp3,SEE THE SONS OF ODIN
common_voice_en_19853460.mp3,SHE CONCLUDED THAT THE ELBOW IS IMPOSSIBLE TO LABEL
common_voice_en_23912178.mp3,THESE METHODS STAND AGAINST PUBLICATION BY US AND AGAINST EXCESSIVE CORPORATE INFLUENCE ON SCIENTIFIC ANTIQUITY
common_voice_en_21139157.mp3,HE AND HIS CREW MANAGED TO BREAK THROUGH TO THE SELVIET SAID
common_voice_en_19616206.mp3,KARL JACOBSON WAS A DEDICATED ARCH COLLECTOR
common_voice_en_20166650.mp3,VANE RELEASED ONE ELBOW CRASSICA
common_voice_en_19744101.mp3,THEY ALSO WON ONLY ONE PLAY OR SERIES DURING THIS TIME
common_voice_en_27325818.mp3,ROSE CITY IS OWNED BY MC CROSSOV PROFOUNDER IN PORTLAND TRAIL BLAZERS OWNER PAUL ELLEN
common_voice_en_20999397.mp3,THAT'S A BIG DIFFERENCE BETWEEN THIS ROLL AND ANY OTHER PART ONE HAVE PLAYED
common_voice_en_22708464.mp3,SHE MARRIED SEPPOPO LATANGA
common_voice_en_27284745.mp3,THE RESULTING STRUCTURE IS HE QUOTED ALGEBRA
common_voice_en_20048846.mp3,IN JUNE THE GROUP HAD THEIR FIRST ANNUAL MEETING WITH EIGHTEEN PEOPLE AND ATTENDANTS
common_voice_en_18985408.mp3,KOVIAN WAS EXTREMELY ACTIVE AS A SCIENTIFIC LEADER
common_voice_en_19867821.mp3,TALLMAN SUFFERED A HEAD INJURY
common_voice_en_18935232.mp3,THEY CAPTURED A LIMITED NUMBER OF WEAPONS ALTHOUGH THEY HAD PLANNED ON MORE
common_voice_en_19744946.mp3,HOWEVER NO OFFICIAL CONTACT COULD BE ESTABLISHED WITH THE HOSTILE TO TAKE HER
common_voice_en_21139265.mp3,THE REST WERE SENTENCED TO VARIOUS TERMS OF IMPRISONMENT
common_voice_en_27325809.mp3,FOR EXAMPLE THERE IS A SYMPHONIC BAND ON THE SCHOOL
common_voice_en_23566569.mp3,THERE IS OTHER TEMPLES NOBODY ARE WORTH SEEING
common_voice_en_20049201.mp3,SHE ACHIEVED MARKED SUCCESS IN SEVERAL OF HIS PLAYS THERE
common_voice_en_19867879.mp3,SUCCOR RAIL HAS NOT BEEN ANNOUNCED AS BEING RE BRANDED
common_voice_en_23893793.mp3,HURTING EXTRACTION OFTEN INVOLVES DEGRADATION OF THE SALWALL
common_voice_en_18935306.mp3,AT THE SAME TIME HE APPLIED HIMSELF WITH SUCCESS TO MATHEMATICS
common_voice_en_30645579.mp3,ERIC IS FORCED TO APPEAL TO OTHER KINGS FROM NEIGHBORING NATIONS FOR SUPPORT
common_voice_en_26985965.mp3,THIRTY FOUR NATIONS SENT BY ATHLETES TO COMPETE IN THE EVENTS
common_voice_en_26985913.mp3,MOST OF THE WRITINGS RESTAURANTS WERE ABORIGINAL MANY LIVING IN ISOLATED COMMUNITIES
common_voice_en_27344608.mp3,HE HAD A NARROW A UNIVERSAL'S MONSTER GO HOME
common_voice_en_27284691.mp3,WHY THE DRIVER PASSED THE SIGNAL REMAINED A MYSTERY
common_voice_en_18985557.mp3,NONFECT VERSIONS OF THE PROJECTOR OR SO AVAILABLE CONTAINING CONCERT AND OTHER INGREDIENTS
common_voice_en_19868015.mp3,UNINCORPORATED COMMUNITY OF BADGER IS IN THE TONE
common_voice_en_21139172.mp3,CLUBS PROVIDE VOLUNTEER LIFE SAVING SERVICES AND CONDUCT SPORTING CANNIBALS
common_voice_en_24569300.mp3,THEY WERE HELD AT THE SISSONS SAINT CIGAREO RUINA
common_voice_en_23893804.mp3,A CALLOUS SALVE CULTURE IS USUALLY SUSTAINED ON THIS MEDIUM
common_voice_en_20048848.mp3,IT IS OMITTED LATE SEASON
common_voice_en_21139300.mp3,THE SCHOOL ALSO HAS MANY CLUBS AND COMMUNITY OUTREACH PROGRAMMES
common_voice_en_23911884.mp3,BOTH STRUCTURES ARE NOW INDIVIDUALLY LISTED ON THE NATIONAL REGISTER OF HISTORIC PLACES
common_voice_en_19693207.mp3,TOWNS WERE DIVIDED INTO WARDS
common_voice_en_19552425.mp3,I WANT TO TRY OTHER THINGS FIRST
common_voice_en_27344649.mp3,SHE HAS BEEN CALLED ONE OF AUSTRALIA'S MOST IMPORTANT AND ADMIRED WRITERS
common_voice_en_28853282.mp3,ALL THE PARTY'S TOP POSTS WERE NOT CONTESTED AT THAT TIME
common_voice_en_19547375.mp3,IT IS THE DEMONSTRATE TO BE REPRESENTED ON THE NATIONAL FLAG
common_voice_en_18985458.mp3,PITIABLE VESSEL WAS USED BY NATIVE AMERICANS FOR ITS PITIABLE ROOTS AND YOUNG SHOOTS
common_voice_en_20166972.mp3,THAT'S THE BUCCINING IS CONTAGIOUS AND WE'LL BE TRANSMITTED TO EVERYBODY SOON
common_voice_en_19747050.mp3,THERE'S TOO MINNIE SHE CAN'T SEND BRANCH LIONS YAMAGATTA SYMPTOMSON AND THE AQUITA CHICKENS THEM
common_voice_en_18627226.mp3,THE DRIVER BECAME AGITATED AND TRAPPER
common_voice_en_19852550.mp3,FOR MELBAHIDE WAS THE FIRST POLLYOTOMIC ORGANIC MOLECULE DETECTED IN THE INTERSTELLAR MEDIUM
common_voice_en_22443957.mp3,THE ATTENDANCE WAS VERY LARGE AMONG THOSE PRISM WERE A GOOD MANY SHOWMEN
common_voice_en_19548032.mp3,CREATED BY ALLAN CATS THE SERIES STARS FRUIT BLOSSOM AND GLADYS KNIGHT
common_voice_en_19547582.mp3,ACCOMPANY PURCHASED ADDITIONAL LAND IN THE VICINITY
common_voice_en_19552548.mp3,ALL BROWNIE DID HEAR THE MESSAGE HE SAID WITH HIS WIFE
common_voice_en_30650350.mp3,CONTEMPORT TELEVISION BROADCAST A PAGEANT LIFE OF NAPOLEONS AT HOME AND ABROAD
common_voice_en_20562387.mp3,IT SHOULD ALSO BE WORKING WITH THE COMMUNITY FOR THE BENEFIT OF THE COMMUNITY
common_voice_en_25640039.mp3,OTHER INFORMAL LEARNING THEORIES LOOK AT THE SOURCES OF MOTIVATION FOR LEARNING
common_voice_en_18884159.mp3,SHE ALSO SERVED AS PROVOST AND DEEM OF THE COLLEGE OF LETTERS AND SCIENCES
common_voice_en_20168121.mp3,INTERMEDE WAS RESPONSIBLE FOR THE DESIGN AND PULLING OF THE MOSCOW MODERATE SYSTEM
common_voice_en_20288437.mp3,HE WAS BRIEFLY CONFINED IN THE NOTORIOUS MOUNTJOY PRISON
common_voice_en_21162470.mp3,PERHAPS YOU WILL HARDLY BELIEVE IT
common_voice_en_21493949.mp3,THE MAIN CHARACTER DOCTOR SANDRA FOSTER STUDIES FEDS AND BOULDER COLORADO
common_voice_en_19962336.mp3,PHILOSOPHICAL CITIZEN CITIZEN REMOVED TO BENEATH THE RUINED LOG
common_voice_en_23912071.mp3,DURING HER SEVERE CAREER HE BECAME KNOWN FOR HIS DEDICATION AND ATTENTION TO DETAILS
common_voice_en_18714497.mp3,FRIDAY'S BETAKEN SKIN'S SNACK CHIPS
common_voice_en_19547554.mp3,THE MOON WAS AT THE PERIOD OF A UNIT OF THE POLICAN PHYSICAL CORPORATION
common_voice_en_19693144.mp3,THE MINOR PERIOD OF A HINDUSTANI IS CARIBBEAN AND DESTINY
common_voice_en_18893596.mp3,THE RESEARCHES USED THE TERM CYNO SULPHURED IT TO DESCRIBE THE NETWORK OF REACTIONS
common_voice_en_25354195.mp3,HE WAS ALSO A GIFT STAR AND AN EARLY EPISODE OF THE ADVENTURES
common_voice_en_20029446.mp3,LOOK AS ALSO SIR AS THE ASSOCIATE ARTISTIC DIRECTOR
common_voice_en_21185396.mp3,THE FINAL DAY OF COMPETITION IS RESERVED FOR OUTGROWNS
common_voice_en_18715664.mp3,MUCH FROM THE MUSE RIVER ANOTHER WATERWAY THE ELBERT CANAL PASSES THROUGH THIS TOWN
common_voice_en_28853355.mp3,IT FLOWS INTO THE ADRIATIC SEA AT THE CITY OF PESCARA
common_voice_en_28853376.mp3,DE VACOTAE WAS AN ACTIVE TOWN IN THE INDIAN INDEPENDENCE MOVEMENT
common_voice_en_21494089.mp3,IN THE END HE'S A TOTAL USE YOUR ALLUSION
common_voice_en_23893809.mp3,SINCE THAT PERIOD IT HAS BENEFITED BY THE INVENTIONS APPLIED TO WEAVING MACHINERY GENERALLY
common_voice_en_20031923.mp3,THE CURRENT HID MISTRESS S MISS GLORIA LOW
common_voice_en_20168223.mp3,SEPARATE BEST DETECTORS TO TEACH GAMMA RAYS AND THE INDUCED ARRANGE FROM PILOT ELECTRO BOX UP TO CIVIL GIGANTIC ELECTROVOKES
common_voice_en_28852469.mp3,TETRA D'ARTAGNAN BLOCKED SODIUM CHANNELS CAUSING MOTOR PARALYSIS AND RESPIRATORY ARREST WITHIN MINUTES OF EXPOSURE
common_voice_en_28467358.mp3,THE HARVARD BRIDGE IS MARKED OFF IN AN IDIOSYNCRATIC UNIT OF MEASURE THE SMOOTH
common_voice_en_23893331.mp3,IT'S A SLIGHT WAY AND I'M A METHOD
common_voice_en_27284714.mp3,HE RETURNED HOME WITH NUMEROUS RECOMMENDATIONS AND WAS THANKED FOR HIS SERVICES
common_voice_en_19946700.mp3,AFTER THIS NO CREATURES WERE ADDED EVEN BY THE NUMBER OF PROVINCES AND BREATHED
common_voice_en_26985969.mp3,SHE WOULD BECOME HIS THIRD WIFE
common_voice_en_19547442.mp3,THE HIDDEN NEWSPAPER PLANTS
common_voice_en_25358074.mp3,ONE OF THE PURPOSES STATED IN THE DOCUMENT WAS THE EXPLICIT CONDEMNATION OF COMMUNISM
common_voice_en_21182076.mp3,THESE ARTISTS BECAME SOME OF THE MAIN FIGURES IN THE RUSSIAN HEAVEN GUARD
common_voice_en_18893968.mp3,WHEN ASKED OF THE CHARGES LOUISE RESPONDED TAINT SO
common_voice_en_25640631.mp3,IN RETURN HE ASKED FOR KUSHINA'S FEMALE'S HAND IN MARRIAGE WHICH WAS AGREED
common_voice_en_20166648.mp3,STERNBACK BELIEF COMMITTED HIS REPROSSING TO TAKE OVER THE HAWAIIAN ISLANDS
common_voice_en_26350162.mp3,AS WELL POTENTIAL ENVIRONMENTAL DISASTERS ARE CONCERNED FOR LIKE PILOTS
common_voice_en_19852553.mp3,HE ALSO HAS TWO DAUGHTERS ARIANA WARREN AND CALAP WARREN
common_voice_en_19568050.mp3,THE TOWEL CHURNS UTILITIES AS A PRICE PRINTED AVERAGE
common_voice_en_19846658.mp3,HE IS ALSO AUTHOR OF SOME DOCUMENTARY MOVIES
common_voice_en_23893828.mp3,MOST OF THE PLANTS ON THE LIST ORIGINATED IN TROPICAL OR SUBTROPICAL ENVIRONMENTS
common_voice_en_20177027.mp3,IT COMPRISES THE TRAFFIC MANAGEMENT BUREAU CENTRAL TRAFFIC PROSECUTIONS BUREAU AND ADMINISTRATION BUREAU
common_voice_en_20167669.mp3,CHUCKBURY ALSO CAME TO SEE THE BEND
common_voice_en_27871213.mp3,BROOK MECKLEDOWNY IS ALSO THE CREATOR OF THE WEB COMIC PIBCORN A SPINNOW
common_voice_en_19552137.mp3,SWINGING FOR THE FENCES RECEIVED TWO GRIMMY AVOWED NOMINATIONS
common_voice_en_18967264.mp3,THEY ARE FROST HARDY AND GROW WELL IN MOST SOILS
common_voice_en_25040749.mp3,THIS THEN IS THE EARLIEST POSSIBLE DATE OF THE COPYING OF THE TEXT
common_voice_en_29381016.mp3,THUS WILL BUT ASSURED THORNDYKE'S RETURN TO CONGRESS AFTER A TWO YEAR ABSENCE
common_voice_en_18893606.mp3,IT HAS SINCE SPREAD TO EVERY COMMERCIAL CENTRESCRIBE IN FLORIDA
common_voice_en_22758613.mp3,FURTHERMORE CRIME CONTINUED TO DECLINE FOR THE FOLLOWING TEN YEARS
common_voice_en_18714910.mp3,THE DRIVE MOTOR IS CONTINUALLY DRIVING THE CHECK DURING THE HEATING STAGES
common_voice_en_18909361.mp3,THUS MANY TOWNSPEOPLE HAVE REFERRED TO CARROLL'S PACK AS MEMORIAL PACK
common_voice_en_18909356.mp3,THE SKULL WAS MOUNTED ON A SHORT PERPLEXABLE NECK
common_voice_en_20168005.mp3,IT ALSO PUBLISHES BY INVITATION ONLY BUT REVIEWS IN SHORT MATHEMATICAL PROSPECTOR'S ARTICLES
common_voice_en_21206863.mp3,TO HIS SURPRISE THEIR CRIMISONS USUALLY AN INDISTINCT TANGLE WERE VISIBLE AS SEPARATE STRUCTURES
common_voice_en_27270005.mp3,HAMMER OF THE GODS IS AN EMPIRE BUILDING GAME WITH A FOCUS OF MILITARY STRATEGY
common_voice_en_19552150.mp3,SHE WAS ORIGINALLY DERIVED FROM RUSKIN MYTHOLOGY
common_voice_en_23846383.mp3,IN ADDITION TO BASKETBALL THE MYRIAD SENATORS USED TO HAVE WEEKLY DIVISIONALS AND FORMS
common_voice_en_28852425.mp3,AFTER THE END OF THE WAR HE WORKED TO THE MANNER DURING COURAGE
common_voice_en_19573622.mp3,DETAILS ARE INCLUDED IN THE CIVIL PARISH OF PIERRE THAT INFERIOR
common_voice_en_21139288.mp3,IN LATER LIFE HE WAS OFTEN EMPLOYED AS A SIGN PAINTER
common_voice_en_20166902.mp3,THIS CULLING HAPPENED IN YU VALUE COUNTY TEXAS AND INVOLVED A MAN TOTAL CHRISTIANS
common_voice_en_19853442.mp3,TAKE YOUR LIGHT GLOVES AND THE EMBROIDERED HANDKERCHIEF
common_voice_en_19005142.mp3,UNICO ALSO APPEALS TO THE ESTERBURY MANGER AN ACCOMMOD BOOK
common_voice_en_19547439.mp3,THE COW WAS ONLY ADDED TO WHAT MIGHT HAVE BEEN A VERY UNCOMFORTABLE SITUATION
common_voice_en_19946556.mp3,PAPA HELD OFF THE SWIMMING PERSONAL TRAINING INTO THE CONSTRUCTION
common_voice_en_20177026.mp3,HIS SECOND MARRIAGE WAS TO ACTRESS JOHANNA PITTED
common_voice_en_20562232.mp3,TYPECABANA IS SURROUNDED BY PRE COLUMBIAN RUINS OF CONSIDERABLE INTEREST
common_voice_en_26986073.mp3,IF THE EPISODE FEATURES ANY SHORES THEY ARE LISTED BELOW
common_voice_en_23767409.mp3,A MORE PROPER DIGNIFIED TOMB IS MECHANICALLY FROZEN ICE
common_voice_en_22443932.mp3,PORTIONS OF THE ALAMOSA GERANGA LION SURVIVED TO THIS DAY
common_voice_en_21208406.mp3,AS WELL SHE FOUND AT THE VANCOUVER BASED WORLD MUSIC GROUP SILK ROAD MUSIC
common_voice_en_18884146.mp3,DUNBAR WAS ROTTEN AND THE SAME WAS NORTH BERWICK
common_voice_en_23830005.mp3,MANY COMMISSION WERE ABSORBED ALSO OFFERED THE SURFACE AT A CHARGE
common_voice_en_27637768.mp3,PIERRE'S PRESENCE PORTRAYED VINCENT
common_voice_en_23893442.mp3,FOR THE HANNAH GASSA O DORI THE DANCERS USED STRAW HATS WITH FLOWERS ON THEM
common_voice_en_19677444.mp3,I'LL SCARE THE DAYLIGHTS OUT OF YOU
common_voice_en_21139536.mp3,THE ROAD HAS EITHER TWO OR THREE LANES EACH WAY
common_voice_en_18893579.mp3,IN NUMEROUS ENGAGEMENTS ESTHER SCORED DRIFTING PACKS ON ITS TARGETS
common_voice_en_26985651.mp3,HE WAS EDUCATED TO BECOME A CLERGYMAN BUT HIS INTERESTS LATER SWITCHED TO SCIENCES
common_voice_en_18530340.mp3,THAT IS A MORE ALARMING PERSON THAN THE CLERK
common_voice_en_18935338.mp3,THE SONG WAS COVERED FOR THE UNITED KINGDOM BY PRISCILLA CART
common_voice_en_18909349.mp3,MEANWHILE SELDOM PLANNED HIS OWN INVASION OF THE KINGDOM OF JERUSALEM FROM EGYPT
common_voice_en_23870230.mp3,MOST RELATIONAL DATE BASED MANAGEMENTS AS SINCE FALLEN TO THE CATEGORY OF DATE DEPOSITS THAT SUPPORT TRANSACTIONS
common_voice_en_21493942.mp3,FERD KIBBY STRODE ON THE BACKPACK UNTIL IT WAS NEEDED
common_voice_en_18893572.mp3,HOWEVER WILSON SUFFERED YET ANOTHER INJURY DURING HIS REHABILITATION DURING THE WINTER MONTHS
common_voice_en_19573606.mp3,THE LIBANON CEDAR IS MENTIONED CIVIL TIMES AND THE OLD TESTAMENT
common_voice_en_19552439.mp3,THESE CONDITIONS ARE CAUSED BY A NUMBER OF FACTORS
common_voice_en_19905125.mp3,THE GOVERNOR GENERAL THE EARL OF ABERDEEN UNDERTOOK THE EDUCATION OF THE SONS
common_voice_en_89109.mp3,A CIRCUS JUMPS IN THE AIR NEAR THE GRAND CANYON
common_voice_en_27871197.mp3,SENATOR HARRY BIRD SINGER AND HIS MASSIVE RESISTANCE CAMPAIGN
common_voice_en_30650396.mp3,DEER FRANTICALLY REACHES HIM ON TIME AND COOLS HIM OUT
common_voice_en_19519466.mp3,THE NEWLY NAMED CHAIN SOLVED THAT PROBLEM
common_voice_en_20049350.mp3,THE TRACTOR DOES MOST OF THE WORK WITH THE FARMER STEPPING IN FOR EMERGENCIES
common_voice_en_18714495.mp3,ITS HABITAT WAS LOWLAND'S COFFEE BROAD LEAFED AND BEECH FORESTS
common_voice_en_21162472.mp3,THE PITCHER WAS CRITICISED AS APING WISDOM CULTURE AND ANTIBITON
common_voice_en_23912176.mp3,THOUGH CONSIDERED VERY SIGNIFICANT AND ARTISTIC TERMS THE TRILOGY HAD PRIVATELY SUCCESSFUL COMMERCIALLY
common_voice_en_20029560.mp3,ONE OF HIS SKULLS IS TO SOME DAY SEE ANNE'S IN THEOLOGICS
common_voice_en_21494167.mp3,AFTER A FEW WEEKS TO CONSIDER SHE AGREED
common_voice_en_18884663.mp3,THE BANDS STILL BORDERED THE PLAIN AND FLEW DOWN TO ARIZONA WITHOUT A DRUMMER
common_voice_en_23893345.mp3,THE SAILED ONE WAS TRANSFERRED TO AWAKE BY THE FORTRESS AND EXPERIMENTS IN GERMANY
common_voice_en_23893810.mp3,IT WAS KNOWN TO BE A HURT
common_voice_en_19868038.mp3,WAGON RIDES AND TOURS OF THE NEAR BY ENGLISH FARMS ARE OFFERED TO THE PUBLIC
common_voice_en_19692988.mp3,ALL ITS VOICES WAVE AND TURN THEMSELVES INTO A FELT OF YELLING
common_voice_en_19946650.mp3,THE VILLAGERS BE FREQUENTLY NAPOLEON ENVY
common_voice_en_20031270.mp3,HE WAS SUCCEEDED AS KING BY SON OF THE THIRST A BERGMANN
common_voice_en_20029559.mp3,REALIZING THAT HE IS ACTING RECKLESSLY TINY TRIES TO GET HIM TO COME DOWN
common_voice_en_30645474.mp3,THE BOOK RESUMED MILDLY POSITIVE REVIEWS
common_voice_en_21208024.mp3,IN WINTER MUCH OF THE AREA IS SNOW COVERED AND ONLY ACCESSIBLE ON SKEES
common_voice_en_27637638.mp3,BILLY RELEASED AN OFFICIAL STATEMENT TO THE PRESS
common_voice_en_18935245.mp3,A PLAN APPROACHED TO AN INVESTMENT THEREFORE CANNOT BE SUCCESSFUL
common_voice_en_19747052.mp3,SANTA CLARA IS IN THE PROVINCE NOW KNOWN AS PHILIP CLARA
common_voice_en_21207925.mp3,TWO WEEKS AFTER HER INEXCESSFUL ATTEMPT KEITH WAS BACK IN THE WATER
common_voice_en_18893833.mp3,CONSEQUENTLY A FLOOD RELIEF CHANNEL WAS SUGGESTED
common_voice_en_19867750.mp3,HIS BROTHER THE ODD COURTEOUS WAS A NOTED PHILOLOGISTIST
common_voice_en_21185686.mp3,THE CHURCHES BUILT IN RED SANDSTONE
common_voice_en_20168004.mp3,THIS RIVER AND VICTORIA WAS LATER RETINED THE BARCAVE RIVER
common_voice_en_18893979.mp3,CHARLES ELLIOT MORTON WAS ELIOT'S COUSIN
common_voice_en_28853383.mp3,ALLIED TROOPS WERE WITHDRAWN TO LEMNOS AND THEN TO EGYPT
common_voice_en_18985546.mp3,RICHARD WAS NINE YEARS OLD WHEN HIS FATHER DIED
common_voice_en_21206894.mp3,LATER THAT YEAR IT WAS RENAMED CUNNINGHAM BROADCASTING
common_voice_en_19005152.mp3,THE WASTE WAS UNABLE TO BREAK THE SOVIET INSCRIPTION AT THIS TIME
common_voice_en_22443834.mp3,TRANSFORMATION IS MEANT TO IDENTIFY AND LEVERAGE NEW SOURCES OF POWER
common_voice_en_27637792.mp3,THE BOTTOM LAYER IS AN ORDINARY ORDERED LINKED LIST
common_voice_en_19547695.mp3,A SINGLE WIT PAGE MAY CONTAIN MORTAL AIRS
common_voice_en_27284774.mp3,THE NAME CADWELLIS IS THE LATIN WORD THE EUROPEAN GULFISH
common_voice_en_20167999.mp3,THE FLOWER BUDS AND PETALS IRRITABLE
common_voice_en_18893835.mp3,THESE CENSORS THEN EMPLOYED A WATER VAPOR MECHANISM TO PUT OUT THE FIRE
common_voice_en_23912005.mp3,IT IS COMMONLY KNOWN AS THE CITY OF SHIPS
common_voice_en_21493968.mp3,THIS MARRIAGE WAS POLITICALLY BENEFICIAL AS THE MEDICI RENEWED TO THEIR DUCAL STATUS
common_voice_en_21139245.mp3,THE ADMINISTRATIVE CENTRE OF THE MUNICIPALITY IS A VILLAGE OF SAND
common_voice_en_27871385.mp3,THERE IS PRECEDENT FOR SUCH A SACRED ROAD AT OTHER COMPLEXES
common_voice_en_18715640.mp3,THE LARGEST OF THESE ARE HOWEVER WITH US A LOUD SALLOW AH KUDI NITA ARJU TUIDA AND KILO
common_voice_en_19852712.mp3,THIS AND TWO CRATER DIAMETERS TO THE WEST SOUTHWEST OF MORASSOV IS SANDSTRAPPED
common_voice_en_19547929.mp3,A NUMBER OF EDITIONS HAVE BEEN PUBLISHED INCLUDING AN EDITION AND C MANNER
common_voice_en_19552424.mp3,ALSO HIGHER WORKER OR STUDENT PRODUCTIVITY CAN BE EFFECTED INTO SAVINGS AND COST DEDUCTIONS
common_voice_en_19547364.mp3,HE WAS MARRIED AND HAD A DAUGHTER PULLING WHO WAS NAMED AFTER MORPHY
common_voice_en_24908811.mp3,THE METABOLIC PATHWAY OR RATE DID NOT DIFFER BETWEEN THE SEXES
common_voice_en_18884174.mp3,EACH MEMBER PAPER EXERCISES ONE VOTE AND CONFERENCES
common_voice_en_19034518.mp3,OYSTER LANDINGS DID NOT RESUME FOR AN ENTIRE YEAR
common_voice_en_25640002.mp3,THE LOCAL SECULAR ELEMENTARY SCHOOL IS DAILY PUBLIC SCHOOL
common_voice_en_19552193.mp3,THE GREEKS HAD BEEN DEFEATED AT THEIR OWN CLASSIC EXERCISE
common_voice_en_23893379.mp3,CIVIL SOCIETY HAS TO BE BOAT FROM THE INSIDE OUT
common_voice_en_27637474.mp3,BECAUSE OF THIS ADMISSION BAR ALSO RESIGNED FROM INDIANA WAR MOTHERS
common_voice_en_18909351.mp3,THE RANCH APPEALS ON THE TELEVISION SERIES DEALS
common_voice_en_21847329.mp3,IN RESPONSE TO THE BILL MANY ONTARIO DOCTORS DECIDED TO STOP PERFORMING ABORTIONS TO GET ALTOGETHER
common_voice_en_23893775.mp3,RUSSELL COMPANY ALSO OF ATLANTA
common_voice_en_18884774.mp3,THIS DOCTRINE MAY STEM FROM VARIATIONS AND INDIVIDUALS OF MANUAL DEXTERITY
common_voice_en_18890730.mp3,THERE ARE TWO MAIN TYPES OF PRODUCER AUDIO OR CREATIVE CONDUCER AND CONTEMPTRODUCER
common_voice_en_19692969.mp3,THE MARK ALSO INCLUDED THE HIGH RISE DEVELOPMENT AT RED ROAD
common_voice_en_25641171.mp3,AT THIS POINT THE EXISTING EXAMPLES COULD BE UNIFIED
common_voice_en_30650389.mp3,IN NOVEMBER COMMANDED THE SHIP BRIEFLY TRANSFERRED TO CAPTAIN LORD HENRY POWLETT
common_voice_en_27344593.mp3,BUT OH IT FEELS SO GOOD
common_voice_en_21494016.mp3,THE CINEMATOGRAPHIC WAS BY ANDREA PHILOTTO
common_voice_en_21203329.mp3,THIS ESTATE INCOMPETENT SUSSEX HAD ONCE BELONGED TO GODWIN'S FATHER
common_voice_en_23893751.mp3,DURING LEISURE MONSIEUR THE CONSTRUCTION OF THE ODESSA BOTANICAL GARDENS AND TREMOSKI BOULEVARD BEGAN
common_voice_en_23912073.mp3,THE GRAVE OF SHAKESPEARE'S WIFE IS NEXT TO HER HUSBAND'S
common_voice_en_18985422.mp3,ALL TRACKS WRITTEN BY GEOGRAPHIC SITTERS NOTED
common_voice_en_23893759.mp3,THIS TENDS NOT TO CHANGE WITH FREQUENCY BUT DOES CHANGE WITH TEMPERATURE AND VOLTAGE
common_voice_en_18884158.mp3,THE SIMPSONS WRITERS OFTEN PARODY THIS PHRASE AND ITS IMPLICATIONS
common_voice_en_21229080.mp3,OTHER FOODS WIDELY ASSOCIATED WITH CENTRAL EUROPE ARE GLUTCH AND BEER
common_voice_en_19005157.mp3,MANY ORIENTAL MANUSCRIPTS BELONGING TO HIM ARE NOW IN THE BODLEIAN LIBRARY IN OXFORD
common_voice_en_21209834.mp3,TO INSULT A PECKAGE THE YEZER MUST CAST THE SPELL
common_voice_en_19962362.mp3,IT IS PART OF THE MAGISTRATE'S OPPORTUNITY TO TESTICAL ERROR IN THE SAINT HAWKIN VALLEY
common_voice_en_26985707.mp3,MOST PRAUDS USED TWO METAL TIPS BUT SUMMER ROBBERIZED FOR HURTING STUBBORN ANIMALS
common_voice_en_23893396.mp3,THESE WERE EITHER REMOTE FROM OBSOLETE COACHING STOCK OR OCCASIONALLY WERE NEWLY BUILT
common_voice_en_19547443.mp3,HOWEVER IT WAS AN INTERNATIONAL SUCCESS
common_voice_en_29375365.mp3,MOST OF THE COUNTY'S WATER AREA IS PART OF LAKE WIN A PISTOL KEY
common_voice_en_18893594.mp3,THE NEW VERSION WAS ALSO SET IN A DIFFERENT KEY IN THE ORIGINAL
common_voice_en_30645510.mp3,CLAIMING THEY WERE ALL STAGED
common_voice_en_21210222.mp3,THE NATURE OF THIS EVENT IS CONTROVERSIAL
common_voice_en_22749714.mp3,THIS PROVED A SOURCE OF MANY PRACTICE FROM ANGRY MIRACLES FRIENDS
common_voice_en_18714994.mp3,HE DIED OF LANCANCOURT LIE JONAH CALIFORNIA
common_voice_en_22758647.mp3,AFTER LEAVING THE SERIES DUNCAN HAD GUESSED STARING ROLLS ON HOTEL AND MURDER SHE WROTE
common_voice_en_19547387.mp3,IT IS IN THIS CONTEXT THAT THE EMPTY CONVERSION LAWS AN INDIA MUST BE VIEWED
common_voice_en_27637641.mp3,THIS EVENT ATTRACTS THOUSANDS EVERY YEAR EITHER PARTICIPANTS OR BYSTANDERS
common_voice_en_25640382.mp3,FOR EXAMPLE IT FINDS USE IN ARTIFICIAL HEARTS AND ARTIFICIAL HEART VALVES
common_voice_en_25354118.mp3,AGAIN I HAD TO DESCRIBE EVERY DETAIL OF HIS APPEARANCE
