common_voice_en_25345790.mp3,FOR COLD PLAYS DAVY STUDIO ALBUM PARACHUTES RUDDER TRICKLE PRODUCE A KIN NELSON REPRODUCED A DUN PANIC
common_voice_en_25640632.mp3,HE WAS LATER A STAFF MEMBER OF THE SENATE FOREIGN RELATIONS COMMITTEE
common_voice_en_25640376.mp3,NORTH OF THE VILLAGE IS A NORMAN MAT AND EARTHWORKS BUT NO BAILEY
common_voice_en_27270014.mp3,I WOULDN'T DARE
common_voice_en_21160072.mp3,SHE WAS POPULAR FOR HER TANNED SKIN AND SLENDER ATHLETIC BODY
common_voice_en_18496990.mp3,MC KOY FOUND A STIFLING POISONOUS ATMOSPHERE IN THE PENT CAVERN
common_voice_en_24957103.mp3,QUIVERED ACONCULTURAL RHYTHMS BUSINESSES AND RESTAURANTS FLOURISH IN THE ARRIAN
common_voice_en_18893507.mp3,MALDRON STUDIED AT THE NATIONAL GALLERY SCHOOL IN MELBOURNE
common_voice_en_21183016.mp3,IT'S A SMOKER POWERFUL ILLUSTRATION OF THE HUMAN SPIRIT
common_voice_en_21139264.mp3,PORT REALLY HELPED ANYBODY'S COMIC TIMING
common_voice_en_25641264.mp3,THE RESULTS BOTH SUPPORTED AND EXTENDED MENDEL'S LAWS OF HEREDITY
common_voice_en_22758600.mp3,THAT COMPANY'S VERSION WAS FURTHER USED IN ANIMATED PUBLIC SERVICE ANNOUNCEMENTS
common_voice_en_19867742.mp3,SHERWOOD INITIALLY CONTENDED THAT ALL WAS MERELY A CASUAL ACQUAINTANCE
common_voice_en_19744375.mp3,HOWEVER THAT CANAL NEVER WENT FURTHER THAN THE BASIN AND MARKET HARBOROUGH
common_voice_en_21139524.mp3,GRISTER'S SPICE IS A COMPOUND THAT INCREASES THE LONGEVITY AND REVERSES AGING OF HUMAN BEINGS
common_voice_en_21139297.mp3,KENNEDY'S INCLUDED KENNEDY'S GLOBAL CHORUS ENTERTAINMENT ASTRO MEDIA AND ROGER'S COMMUNICATIONS
common_voice_en_19868017.mp3,IT USED TO BE COMMONLY ADDED TO POULTRY FEED
common_voice_en_19946620.mp3,A PHOTOGRAPHY SHOOT DONE AND WRITTEN BUSTING AT EDMOND LEON FROM HONCOMB
common_voice_en_30650378.mp3,STIPALS ARE MISSING
common_voice_en_27871406.mp3,THE ELBOW WAS PRODUCED BY DAVID NICHOLAS ASSISTED BY JUSTIN TRESSIDA
common_voice_en_23893821.mp3,HOWEVER TREASURE ARMSTRONG WAS ELATED DESPITE THEORY BEING UNABLE TO REMEMBER HER NAME
common_voice_en_20168039.mp3,TWELVE LADS CALLED IT THOMASOVADA AND THE GREASE CALLED IT PANKLER COWDER
common_voice_en_20168117.mp3,INSTALLATION SAID ARCH PARK WERE INTENDED TO BE TEMPORARY
common_voice_en_25358038.mp3,THE HANDS AND FEET OF THE FIGURES FULLY MOVABLE DURING PERFORMANCES
common_voice_en_21183276.mp3,THE RIVER IS ECOLOGICALLY SIGNIFICANT IN SO FAR AS IT REMAINS LARGELY UNDISTURBED BY RESOURCE EXTRACTION
common_voice_en_30645545.mp3,IT IS FITTED WITH AN INBOARD THESE LEGEND FOR DOCKING AND MANOEUVRING
common_voice_en_21494087.mp3,ONE OF HER BAKER'S FULL BEARDS WHILST QUITE ADMISSIONARY IT IS A BIT WEEP
common_voice_en_25353895.mp3,THE SHORT LIVED GRUNT BEE ERROR HAS ACQUIRED LATE INJURY STATUS AND MINE RALLY FANS
common_voice_en_25640362.mp3,THE MALE WILL THEN RUB HIS CHEEK AGAINST THE FEMALES
common_voice_en_18838319.mp3,IT IS A RARE VAGRANT NORTH OF ITS BREEDING RANGE
common_voice_en_19693469.mp3,HE WAS RAISED AND CONSERVED OF JUDAISM
common_voice_en_19567930.mp3,WON'T THIS HALSTED MORAL STATE PRESENT AN IRONY
common_voice_en_19573614.mp3,SAID STATUE LET'S SEE SOME REEL FLYING
common_voice_en_19867906.mp3,SUCH MACHINES WERE DESIGNED TO ELIMINATE THE PERIODIC PROBLEM OF VOTES STEALING
common_voice_en_17730637.mp3,THE CITY GUARD HAD TO BE REDUCED AS WELL DUE TO FINANCE SHORTAGES
common_voice_en_19693141.mp3,THE AREAS CONCERTED THE SYMPTOMA OF THE PERIOD CENTRIMONOMIC REGIONS
common_voice_en_19519457.mp3,HE RUNS THE PUBLISHING HOUSE WILD HONEY CHRIS
common_voice_en_19867854.mp3,THE VILLAGE WAS ONCE LARGER THAN TO DAY THOUGH PROBABLY ALWAYS SCATTERED AND PLANNED
common_voice_en_26985613.mp3,LIKEWISE THE DISTINCTION OR OVERLAP BETWEEN MILITARY AND CIVILIAN SECURITY AGENCIES VARIES BETWEEN COUNTRIES
common_voice_en_19561792.mp3,THE PARISH CONTAINS THE HAMLET OF BROMLY
common_voice_en_27637637.mp3,HE LOST IN A LANDSLIDE TO HIS LIBERAL PARTY OF CANADA OPPONENTS
common_voice_en_19693138.mp3,ONE WAS CERTIFIED PLATINUM
common_voice_en_18893577.mp3,BRAIDED WIRES ARE OFTEN SUITABLE AS AN ELECTRO MAGNETIC SHIELD AND NOISE REDUCTION TABLES
common_voice_en_19743937.mp3,IN THE AREA THERE ARE FIVE JUNCTIONS
common_voice_en_20167165.mp3,THIS VIEW BASED ON POLITICAL AND IDEOLOGICAL CONSIDERATIONS IS NO LINGUISTIC VALIDITY
common_voice_en_20168061.mp3,THE WOOD LUNCH CONTINUES TO BE A SUCCESSFUL ECONOMICAL COMMUNITY EVEN TO DAY
common_voice_en_19547547.mp3,WAISTCOATS WAS PURCHASED BY AND AS A SUBSIDIARY OF NATIONAL ENTERTAINMENT COLLECTABLES ASSOCIATION
common_voice_en_23893329.mp3,HE WAS SUCCEEDED AS ARCHITECTURAL CREDIT BY MICHAEL CAMILLE MAN
common_voice_en_18890736.mp3,SINGLETON REFUSED THE NEW AGREEMENT
common_voice_en_18715609.mp3,CREATED SWEET SCRUPLE OF HIS PRIVATE BANKING INVESTMENT BANKING AND ACID MANAGEMENT SERVICES
common_voice_en_21206893.mp3,THE STATION ALSO AIRED INDIANAPOLIS I SULKY GAMES
common_voice_en_25640379.mp3,RUIN HAS THE FIRST MONUMENTAL CONSTRUCTIONS IN ARCHITECTURAL HISTORY
common_voice_en_19568019.mp3,SHE WAS NAMED FOR JOHN YOUNG
common_voice_en_19561794.mp3,THORNHILL WAS A PATRON OF THE AUSTRALIAN GIRL'S SQUIRE FROM THE QUIET BEGINNIN
common_voice_en_18893982.mp3,WITH THE HEAD EXTENDED THE GLUTIUS MEDIUS AND THE GREEDIEST MINIMUS INTERNALLY ROTATE THE FURY
common_voice_en_19551008.mp3,ONE MORE RECORD AND SIX O LUMPIC RECORDS WAS SAID AT GRENOBLE
common_voice_en_23893565.mp3,I AM SURE I AM NOT MEAN ABOUT HER
common_voice_en_25640270.mp3,JOHN CONTINUED THESE NEGOTIATIONS AND FINALLY SUCCEEDED IN NEGOTIATING A DEAL
common_voice_en_21229071.mp3,IT WAS FOUNDED BY JACK QUINN
common_voice_en_19693297.mp3,SUCH DARKER SURFACES ON A MINER TYPICALLY FORMED BY FLOWS OF BALSATIC BALSATIC LABOUR
common_voice_en_19519443.mp3,PUBLISHED BY MOSBY
common_voice_en_20166649.mp3,SOME MILITARY DISTRICTS COULD NOT FORM MY FRONT
common_voice_en_19547395.mp3,HIS HEAD CORNERS IRON BACK INSIDE AND THEN LONDON BURROW OUR BREATH BRIDGE
common_voice_en_18977867.mp3,IT IS COMPLETELY SURROUNDED BY THE CITY OF PALM DALE
common_voice_en_19693357.mp3,THE NAME IS DERIVED FROM SARADINA A BRANCH OF JUDAH'S
common_voice_en_89074.mp3,A GROUP OF PEOPLE IS TRAVELLING THROUGH A TERMINAL WITH LOVING MORE GRACE
common_voice_en_26792071.mp3,ITS SEAT IS LOCATED IN THE CITY OF FINGERSTA
common_voice_en_20168060.mp3,ITS LEXICOGRAPHICAL WORKS AND PARTICULAR HAS LATIN GERMAN CROSSERIES ARE STILL CITED IN SCHOLARSHIP TO DAY
common_voice_en_25380144.mp3,THE RESTAURANTS CLOSED ON SUNDAYS
common_voice_en_18909343.mp3,THESE CARDS ARE USED TO BED FOR TURN ORDER
common_voice_en_19946692.mp3,IT OFFERED AN A BIT OF PICTOLOGY IN IT MUTTERED AND BOLD PILOT
common_voice_en_25380228.mp3,THE COLLEGE HAS ARRANGED A CHARITY UNDER ENGLISH LAW
common_voice_en_18893477.mp3,AGNES MAKES MAJIE PROMISE SHE'LL MARRIED JIMMY AND HAVE A GOOD LIFE
common_voice_en_19793979.mp3,MATTHEW IS THUS VERY CAREFUL TO SPECIFY THE RELATIONSHIP BETWEEN THE TWO
common_voice_en_23893586.mp3,WHEN JOSEPH AND MARY'S NEIGHBOURS COMPLAINED THEY ARE MIRACULOUSLY STRUCK BLIND BY JESUS
common_voice_en_25380140.mp3,BOTH AGREED THAT HE WAS BURIED AT COVENTRY
common_voice_en_18890761.mp3,THEY HAVE A KING PEN THAT CAN'T MOVE VERTICALLY WHICH PREVENTS THIS
common_voice_en_21210160.mp3,A PRENOMINAL IS ALSO A WORD OR PHRASE THAT ACTS AS A PRONOUN
common_voice_en_20177067.mp3,GLOBAL WARMING HAS OCCURRED RAPIDLY OVER THE COURSE OF THE PAST HALF CENTURY
common_voice_en_19744070.mp3,RYECROFT WAS BORN IN SOUTH HAMPTON BEFORE MOVING TO CAMBRIDGE AT THE AGE OF ELEVEN
common_voice_en_22749687.mp3,DOCUMENTARIES OFTEN USED THE THEME OF ADVENTURE AS WELL
common_voice_en_89115.mp3,A BUOY IN A HELMET JUMPS FROM A MAKESHIFT DRUNKARDEN MAIDEN TIRES
common_voice_en_20288490.mp3,THE OATH WAS COLORED RED BY IRON FROM HIDE AUTUMNAL SPRINKS
common_voice_en_21183296.mp3,HE WAS BORN IN SILKOKA PREFECTURE
common_voice_en_19693043.mp3,I WAS ASKED TO TAKE A MAN'S LIFE
common_voice_en_18909326.mp3,THE THIRD FORM IS REALLY SEEN OUTSIDE OF THIS CONTEXT
common_voice_en_19552435.mp3,MURDY HOW D'YE MINKER BECAME THE LEAGUE'S TOP SQUIRREL
common_voice_en_26986548.mp3,WILLIAMS STUDIED ARCHITECTURE AND WORK FOR A TIME AS AN ARCHITECT'S ASSISTANT
common_voice_en_19552141.mp3,IT IS APPROPRIATE TO THE MODERN FORMULA
common_voice_en_19946697.mp3,THE CONTROVERSIAL DEVELOPMENT IS THE BULGARLY IN KEEPING WITH THE LOCALARIA
common_voice_en_26985733.mp3,THEY HAD TWO CHILDREN TOGETHER CLIFF AND DIANA
common_voice_en_24895697.mp3,WOOD BUFFALO IS LOCATED DIRECTLY NORTH OF THE ATHABASKA OIL SANDS
common_voice_en_25640560.mp3,THE FORMER CHILLY LION ALSO RAN THERE
common_voice_en_20029533.mp3,IT HOLDS OPEN SUBMISSION EXHIBITIONS FOR MEMBERS AND GIFTS ATTESTS
common_voice_en_19562751.mp3,HE IS A PRECAME COLORED ANNALIST FOR THE TEAMS TELECAST ON FOX SPORTSMEN AT WHIST
common_voice_en_19573616.mp3,THE DEFENDING CHAMPIONS OF A POLE WERE ELIMINATED BY A BENFICK AND THE PHILOSOPHER ROUND
common_voice_en_21139537.mp3,IT'S CAPITAL AND SABBATH
common_voice_en_27284717.mp3,OWLERS THEN HAVE A GUARANTEE ACCESS TO THAT AIRCRAFT AT ANY TIME
common_voice_en_21206862.mp3,THE TRACK ALSO HAS A LARGE CASINO AND RESORT ON SIGHT
common_voice_en_19905126.mp3,KEYBOARD COMPLIMENTS OFFERED ON CASSETTE ARE ALSO INCLUDED
common_voice_en_24949176.mp3,JACOBIN HAS A DOCTRINE IN FRENCH LITERATURE
common_voice_en_27560879.mp3,HE WAS THE SON OF ALLAN AND NANCY MC LENDEN HAYDEN
common_voice_en_27292630.mp3,THERE IS A WIND FARM IN THIS MUNICIPALITY AS WELL
common_voice_en_20167337.mp3,AFTER BEING TRAINED AS AN ELECTRICIAN SALBOU BECAME A CASTLESMAN AND HAMMERED SERIOUSLY
common_voice_en_21183331.mp3,THESE INCLUDE THE VATICAN BALL THE FRANK THE A MEMORIAL BALL AND IS YET WE INVITATIONAL
common_voice_en_18838387.mp3,IT WAS A COMMUNITY SCHOOL FOR THE SHILOH AREA
common_voice_en_21208407.mp3,A COMPETING SYSTEM DEBATES AND PRINTED BY DAVID BLACKMARE ALSO FOUND SUCCESS AND PROFESSIONAL AUDIENCE
common_voice_en_21139521.mp3,THE NUMBER WAS USED DURING HIS DAYS AS A GREEK FETETAGA
common_voice_en_20284803.mp3,THE PLAY CAN JUMP OFF THE DYNAMITE AT ANY TIME
common_voice_en_21162435.mp3,THE OPERA WAS GIVEN FIRST AT THE TEACHER'S AND SAMUEL IN VENICE IN DECEMBER
common_voice_en_25640395.mp3,THE HEADS WERE TAKEN HIS CUE FROM PINE NEAR SETTLERS AFTER THEY HAD BEEN SCALPED
common_voice_en_19547511.mp3,AND LYON WAS SURVIVED BY HIS WIFE AND FOUR CHILDREN
common_voice_en_20029535.mp3,IN THE SOLEMN TEXT AUTOMOBILE PRIAMUS IS A REAR FAT AND REDDISH DETAILED SPECTRE
common_voice_en_18714564.mp3,PAUSED TO THEM AND MANY WIDOWS AS WELL LIVED IN POVERTY
common_voice_en_19547440.mp3,THE FIRST THREE PROJECTS ARE IN FULL SWING
common_voice_en_25353881.mp3,TWO MACHINE GUNS ARE ALSO CARRIED
common_voice_en_19744212.mp3,HE WAS VARIED AND FIRM HALL MEMORIAL GARDENS AND MUSLIN IN STUART FLORIDA
common_voice_en_27637593.mp3,HOWEVER IT IS MORE FREQUENTLY ASSOCIATED WITH PATHOLOGIC PROCESSES
common_voice_en_28852643.mp3,THE MONUMENT IS THE CENTRE OF MANY TOWNS CELEBRATIONS AND FESTIVITIES
common_voice_en_21185484.mp3,MAHALLE MAGGIE WAS ALSO THE ART ADVISER FOR THE MAIL ORDER HOUSE OF SPEGLE AND CHICAGO
common_voice_en_23870231.mp3,AS A LITERARY AUTHOR BOONE WAS NOT AN EARLY BLOOMER
common_voice_en_22758690.mp3,EACH MEMBER OF EACH ON SYMBOL MUST ADDITION AND BE SELECTED BY A STAFF MEMBER
common_voice_en_18884780.mp3,ONLY MAIN DRAW A SINGLE SNATCHES ARE INCLUDED HERE
common_voice_en_89069.mp3,A BULL IS RUNNING TOWARDS A RICH PLOUGH
common_voice_en_23846374.mp3,AFTER RETORTING HE BECAME A RACHA
common_voice_en_20167240.mp3,DURING THIS SECTION APPEARED POSSIBLY IN RESPONSE TO THE RADIO COOLER
common_voice_en_18884167.mp3,ROSAMOND'S USUALLY MALICIOUS WIT WAS ANCIENT DERRY
common_voice_en_21182845.mp3,FOR EXAMPLE S IS A SUB GROUP OF S
common_voice_en_21183372.mp3,MISSUS MIRRAND WAS A LONG TIME SUPPORTER OF CUBA AND ITS MARKS'S LENINIST GOVERNMENT
common_voice_en_18714913.mp3,FIRST PUBLIC PERFORMANCE OF THE SONG WAS AT BENCON'S FUNERAL
common_voice_en_25359095.mp3,THE HEAT TRANSFERS INK FROM THE RIBBON TO THE PAPER
common_voice_en_19693143.mp3,ARMENIANS PAID HOMAGE TO HER MAMMA INCLINED HIM AS KING A TEXAS
common_voice_en_21182842.mp3,THE MUSIC IS CHARACTERIZED BY COMPLEX RHYTHM
common_voice_en_19547892.mp3,THESE DESIGNS ARE MORE PEDESTRIAN FRIENDLY THAN THE SAINT PIERRECOE WITHOUT ANY POPA
common_voice_en_18884662.mp3,HOWEVER THE SPREAD OF THE ENGLISH LANGUAGE TOOK MUCH LONGER HERE THAN ELSEWHERE
common_voice_en_19547617.mp3,HENCE BLOCKADAH FOLLOWED PRODUCTION INHABITANTS THAT FOLLOWED DEPENDENT METABOLIC PROCESSES FOR PICTORIAL GRACE
common_voice_en_25640380.mp3,A BOOK IS A SNEEZE
common_voice_en_19692705.mp3,I WAS NEVER ABLE TO CALL THE MASTER OF CEREMONIES JACK BERRY JACK
common_voice_en_19905170.mp3,FROM THAT POINT ON LEOPOLDO MADE FREQUENT TRIPS TO RUN PURSUING HIS ARTISTIC INTERESTS
common_voice_en_25354196.mp3,WE THANK YOU FROM THE BOTTOM OF OUR HEARTS
common_voice_en_18909320.mp3,HE FINALLY APPEARED IN THE CROWD CHEERING D'ARTAGNAN AUDIENCE
common_voice_en_19744884.mp3,THEY GULLS AND METHODS WERE INSPIRED I BRUSHED LIBERALISM
common_voice_en_18967306.mp3,THIS SIGNAL WAS THEN RUN THROUGH A GRAPHIC INCREASE TO OCCASIONALLY CHANGE ITS TIMBRE
common_voice_en_21203333.mp3,NONE THE LESS THE SINGLE WAS CO CREDITED TO HER AND BECAME HER ONLY GOLD RECORD
common_voice_en_18890721.mp3,AND EACH SEX AND GENEALOGY PRESERVED AS BRITISH LIBRARY ED
common_voice_en_20288493.mp3,I'VE NOT NOMINALLY CONTROLLED ONLY WINKLES
common_voice_en_19552443.mp3,HE SUCCEEDS IN CONFRONTS MAKE A KING'S GENERA
common_voice_en_30645457.mp3,ZOYER AND COURT MEET AGAIN WHILE TRACKING DOWN ONE OF THEODORE'S ASSOCIATES
common_voice_en_19867740.mp3,SHORE JOINED SHORE BROTHER STUDIOS AFTER GRADUATING FROM SECONDARY SCHOOL
common_voice_en_19867699.mp3,AFTER SEVERAL DISCUSSIONS HE THEN MADE A RETURN TO FOOTBALL WITH BLOOM FONTAINE CELTIC
common_voice_en_20305489.mp3,SHORTLY AFTERWARDS SHE ENDED HER BRIEF MODERN CAREER AND HINTED ACTING FULL TIME
common_voice_en_18714930.mp3,CERTAINLY THE MAUSOLEUM WAS A DECORATED CYLINDER WITH THE GARDEN TOP AND GOLDEN QUADRIGA
common_voice_en_20167966.mp3,VISITORS COULD GET IN A TRAIN FROM HERE AND DOESN'T BARK AT THE TOPSAGO STOPPED
common_voice_en_20996254.mp3,EXCESS GAS CAN BE REMOVED IN A SIMILAR MANNER
common_voice_en_27284776.mp3,THE TOWN IS SAID TO BE NAMED AFTER ONE OF THURSTON'S SONS
common_voice_en_18893581.mp3,SEVERAL SEX MANAGEMENTS STOLE OF THEM BIRMINGHAM
common_voice_en_21159969.mp3,COMMUNITIES INCLUDE NATURE TRAILS A PICNIC PAVILION AND A PRIMITIVE CAMP SITE
common_voice_en_21139158.mp3,POPULAR SONGS ON THE ALBUM INCLUDED DUSTY TIN AROUND SOME TIME AND HOLLY RODE
common_voice_en_19548034.mp3,SEVERAL RATHER IMPERIAL PRINCES WERE ALSO PRESSED TO OTHER KEY CITIES AND THE EMPIRE
common_voice_en_29373560.mp3,THE DIVISION TRAINED ALONG THE WEST BANK OF THE RIVER IN MATCH
common_voice_en_18714485.mp3,MERELY ODIN IS CURRENTLY WORKING AS THE VOLUME OR GUIDE FOR THE POPULAR WEBSIGHT ABOUT DOT COMB
common_voice_en_27637725.mp3,ONE CAN SAY EVEN MORE
common_voice_en_21139518.mp3,WE'VE WON THIS RIDE
common_voice_en_27292583.mp3,HOYLES PLAINS WAS THE ORIGINAL TERMINUS OF THE PORT WAKEFIELD RAILWAY LYING KNOCK
common_voice_en_31289613.mp3,THE GAME REMAINED CLOSE TO THE VERY END
common_voice_en_19853482.mp3,IT'S LYN HAMMERDON ANOTHER CA QUERIED GOD SHARP I TOOK POWER
common_voice_en_20167242.mp3,SOME FOUND IT BRILLIANT OTHERS TASTELESS
common_voice_en_20167584.mp3,DAVID CASSA WAS VITAL FOR THE SETTING UP OF THE INFORMAL MEDITERRANEAN INTERVIEW
common_voice_en_19692643.mp3,SAINT MARY'S SCHOOL IS LOW CHURNED LAP ELFIN PRIORY SCHOOL
common_voice_en_30645525.mp3,THE REVIEW FINDS THAT JURIES GENERALLY DO NOT DELIVER RACIALLY DISCRIMINATORY RESULTS
common_voice_en_20996272.mp3,CRYSTAL BALLS ARE POPULAR PROPS USED IN MENTALISM ACTS BY STAGE MAGICIANS
common_voice_en_19693189.mp3,ADDITIONALLY SHE BRANCHED OUT INTO MIXING DANCE MUSIC ALBUMS
common_voice_en_27871353.mp3,HIS BURIAL PLACE IS A DEBATED ISSUE
common_voice_en_19853461.mp3,ACADEMY IS A CHARGE OF SCHOOL LOCATED IN HIGHLAND PARK
common_voice_en_28853070.mp3,RADEL'S MOTIVES FOR TREASON ARE STILL UNFAIR
common_voice_en_18890729.mp3,HARRY'S PLAYHOUSE THEATRE IS IN THE TOWN
common_voice_en_21494086.mp3,RIGHT LEARNING IS WIDELY USED IN THE MASTERY OF FOUNDATION OR KNOWLEDGE
common_voice_en_18985522.mp3,THUS ANY EXCITING FREQUENCY LONGER THAN THE CUT OF FREQUENCY WOULD ATTENUATE RATHER THAN PROPAGATE
common_voice_en_20031862.mp3,THREE DAYS LATER IVAN MADE VASSILI AUTOCRAT OF ALL RUSSIA
common_voice_en_21209888.mp3,DURING THE END OF THE RAYS SHEDS WAS IN SECOND PLACE
common_voice_en_18567520.mp3,BUT IT WAS PLAIN THAT EVEN HE WAS OVERDOING HIS GAIETY
common_voice_en_24949180.mp3,MARCHMONT WHO WAS BORN IN BONNET TEXAS BUT GROW UP IN CARROLLTON ADELA'S SUBURB
common_voice_en_26985605.mp3,THIS MEANS USES CAN COMPILELY CODE WITH ANY OF THE AVAILABLE LIBRARIES
common_voice_en_19005150.mp3,EGGS ARE COLLECTED FERTILIZED AND INCUBATED ARTIFICIALLY UNTIL THE HEDGE
common_voice_en_18985405.mp3,THE SMALL SYSTEM EVENTUALLY TRICKED WASTE NORTH WESTERLY
common_voice_en_23893814.mp3,THE COMMON NAME OF THESE FISH IS RELATED TO THE BAZAAR TUBULAR EYES
common_voice_en_27284833.mp3,HE HAS A TWIN SISTER NAPOLEON WHO IS ALSO AN ACTRESS
common_voice_en_19550927.mp3,ACCORDING TO FRANCIS THE TENTH
common_voice_en_30645513.mp3,OUTLAW ROLLINS
common_voice_en_18715681.mp3,IT WAS SUBSTANTIALLY REWARDED WITH COMMENTARY BY WODEHOUSE REPLACING MUCH OF TALBOT'S CONTRIBUTION
common_voice_en_18890732.mp3,THIS WAS THE BIRTH OF THE UNITED STATES OF AMERICA
common_voice_en_18884154.mp3,WITH A BUREAU STATIONED PERSONAL ON THE ISLAND
common_voice_en_19519477.mp3,IT'S NOT EXCLUSIVELY THE PARENTS FAULT EVERY TIME A YOUNGSTER COMMITS SUICIDE EVERY TIME A YOUNGSTER COMMITS SUICIDE EVERY TIME A YOUNGSTER COMMITS SUICIDE EVERY TIME A YOUNGSTER COMMITS SUICIDE EVERY TIME A YOUNGSTER COMMITS SUICIDE EVERY TIME A YOUNGSTER COMMITS SUICIDES
common_voice_en_18909333.mp3,LATER ARRIVALS INCLUDED THE LATTER PEOPLE
common_voice_en_20168119.mp3,HANK'S RETREATED TO HONG KONG AND SPENT NEARLY A YEAR THERE
common_voice_en_27870723.mp3,HIGHMONT WAS SOLD LATER THAT YEAR TO THE PRIVATE EQUITY FIRM INNERVEST
common_voice_en_21139173.mp3,ASSISTED BY HIS TWO OLDER SONS WHITMAN GOES HUNTING AND THE HILLS FOR WITCHES
common_voice_en_18890734.mp3,IT IS A POPULAR RIVER FOR FISHING CONTAINING LARGE POPULATIONS OF TIGER FISH AND BRIM
common_voice_en_27270003.mp3,SO BEGAN HIS ARTISTIC CAREER
common_voice_en_25353912.mp3,HE DEVELOPS TRAINING PROGRAMMES AND QUALIFIES PERSONNEL IN DIVING EQUIPMENT SYSTEMS AND PROCEDURES
common_voice_en_19692698.mp3,NO ADDITIONAL INFORMATION HAS BEEN LOCATED AND ITS FATE IS THE GNAWING
common_voice_en_19744446.mp3,REMOVAL MAY CAUSE SCARING
common_voice_en_21507167.mp3,TO DATE SHELTERED REMINDS SOME CITIZEN'S LAST REPUBLICAN MERE
common_voice_en_19547402.mp3,BY SKILFUL MANOEUVRING THE AUSTRIANS CHASED THE INFANT FROM THE LATTERPATHIA
common_voice_en_27560854.mp3,HILL COUNTRY RESIDENTS HOWEVER WERE TYPICALLY POOR DIRT FARMERS AND RARELY SLAVE OWNERS
common_voice_en_18884768.mp3,HOWEVER BOSTON BOULEVARD HAD NOT BEEN DEVELOPED YET WHEN THE DRINK WAS NAMED
common_voice_en_18884660.mp3,HE WAS ALSO A MURDERATIONAL SPEAKER AND MUSICIAN
common_voice_en_19867786.mp3,THIS IS CALLED STOPPING THE STRINGS
common_voice_en_21208380.mp3,HER PERFORMANCE IN IT WAS PRAISED AND ESTABLISHED HER CREDIBILITY AS AN ACTRESS
common_voice_en_21139175.mp3,THIS HAS NO COMMEMORATIVE INSCRIPTION
common_voice_en_21183245.mp3,HE FIRST STARTED SHOWING INTEREST IN ART AS A SMALL CHILD WITH DRAWINGS
common_voice_en_19552447.mp3,SHORT BOW TRIPS ALONG THE SHOPSHIRE UNION CANAL ARE ARRANGED
common_voice_en_18893844.mp3,AS THE EMPIRE NEARED THE A PORT THE LANDING GILL WAS EXTENDED
common_voice_en_27270001.mp3,THE HATRED OF THE ANGELS IS UNCERTAIN
common_voice_en_18893616.mp3,EMPLOYED PRIDEO FOR MEATS CONVEYED THE DEER'S SIGNALS AS A SERIES OF LINES
common_voice_en_19519480.mp3,IF THERE IS NO FIGHT THREATENED SCANDAL SPEED WILL BE KILLED
common_voice_en_19730836.mp3,HE STARED MOROSELY AT THE FIRE
common_voice_en_21185414.mp3,WILT LICENSE THE RAINWOOD CATALOGUE TO CONCORD MUSIC GROUP FOR TEN YEARS
common_voice_en_19905292.mp3,IT'S MUSIC RADIO FEATURED ALICE IN WONDERLAND IMAGERY
common_voice_en_18884166.mp3,HE IS ALSO FAMOUS FOR THE PENNIES TABLE TENNIS MATCH AND HISTORY
common_voice_en_19867751.mp3,CHIEF CONSTRUCTION PROJECT HE WAS DONE WHERE BULL SHOALS TABLE ROCK AND GREASE FERRY
common_voice_en_20168245.mp3,PEOPLE'S INSTINCTIVE TRAVELS WAS ABOUT CELEBRATING YOU WHOEVER YOU ARE
common_voice_en_19568049.mp3,THIS CAUSES MUCH DISTRESS TO HERSELF AND HER FAMILY
common_voice_en_21185573.mp3,THE LONG DISTANCE CONNECTION IS NOTEWORTHY FOR TWO MINOR INCIDENTS
common_voice_en_20029536.mp3,WHAT IS CLEAR AS IF THE GAME HAS DEEPLY EVOLVED
common_voice_en_20048847.mp3,THE APPROXIMITY TO THE CHANNEL NECESSITATED SHIP IMPACT TESTING AND MODELLING
common_voice_en_21507169.mp3,THOU WILT SAY THEN UNTO ME WHY DON'T HE YET FIND FAULT
common_voice_en_18977853.mp3,THEY HAVE PLAYED MILWAUKEE WISCONSIN SOME OF THIS EMBITTER HIM PENNSYLVANIA'S MUSIC FIST
common_voice_en_19693137.mp3,LOUVILLE FIELD THEORY IS ASSOCIATED TO THE ACADEM MATRONS
common_voice_en_17246108.mp3,ONE CAN'T BE TOO CAREFUL
common_voice_en_23893568.mp3,HE WAS LOST FOR THE REMAINDER OF THE SEASON
common_voice_en_23566566.mp3,FERGUS AND MAN AIN'T COMMUNICES ON THE LEISURE OF ALL MALAY BY LAW
common_voice_en_22214264.mp3,THE WOOD THRUSH IS PRIMARILY SOLITARY BUT OCCASIONALLY FORMS MIXED SPECIES FLOCKS IN THE WINTER
common_voice_en_27292356.mp3,PHRONSIE'S IN LUCY'S LONG ACRE'S NEIGHBORHOOD
common_voice_en_21208377.mp3,THAT AREA HAS BEEN INHABITED SINCE THE GREAT MIGRATION
common_voice_en_19552867.mp3,INDIVIDUALS A TERRITORIAL AROUND THE INNOCENTS
common_voice_en_25380177.mp3,FOR THE FOLLOWING TWO YEARS HE SERVED AS GOVERNOR GENERAL OF WARSAW
common_voice_en_18893993.mp3,IT CAN ALSO BE USED FOR MANUAL STRETCHING OF WHOLE MICROSCOPE EXAMPLES
common_voice_en_23912070.mp3,A MAJOR POINT OF CONTENTION A RELATIONS AS INTELLECTUAL PROPERTY RIGHTS AND FRINGEMENT
common_voice_en_19717656.mp3,FROM A LUMBER INDUSTRY
common_voice_en_18935402.mp3,IT WAS SO OVER BADGERED
common_voice_en_21139523.mp3,FRANKLIN IS THE THIRD LARGEST TOWN IN FRANKLIN COUNTY
common_voice_en_18893591.mp3,THE RELEASE OF BUNGLE SPORTS LASTED THROUGH THE WHOLE VEGETATIVE SEASON
common_voice_en_18893974.mp3,SHE STUDIED SCULPTURE AT THE ACADEMY OF FINANCE AND MORSEL
common_voice_en_25353915.mp3,ONE DAY FRANK ARRIVES ON THE ISLAND
common_voice_en_20166747.mp3,THE SUN AWNING WAS PRINTED WITH THE RESPECTIVE COUNTRY FLAGS
common_voice_en_21139527.mp3,IT'S ALSO TAUGHT IN SOME SCHOOLS AND UNIVERSITIES
common_voice_en_22758698.mp3,HIS NAME LINKSOME TO ALL THE TREES
common_voice_en_18893564.mp3,REGULAR INSPIRED TRAINS CONNECT COMMUNICATE AND BEYOND
common_voice_en_21921180.mp3,PHYSIOLOGY IS UNKNOWN AS THE MINING CONTINUES
common_voice_en_21162434.mp3,CAN HAVE BEEN NIPPED IN
common_voice_en_19693360.mp3,THE LETTER IS WRITTEN IN PENCIL AND CONSISTS OF THREE PARTS
common_voice_en_20196345.mp3,THE TRADER ADROITLY GREETED IT RESERVOIRS AND ASTRIDE THE SCOPPERIES
common_voice_en_23830014.mp3,THE INTRODUCTION PRESENTS THE THEME ALMOST WHOLE THAT LAKES ONLY THE LAST NIGHT
common_voice_en_20031312.mp3,HE WAS SECULARIST THOUGH NOT EXACTLY SO AS THE PROGRESSIVE PARTY
common_voice_en_18667055.mp3,ESTHER DEAR SHE SAID VERY QUIETLY I'M NOT GOING HOME AGAIN
common_voice_en_24206656.mp3,IT WAS NOT INSTEAD BEING DESIGNATED A VERY DOUBTFUL VALIDITY
common_voice_en_19547569.mp3,OAK HELL AS A PRIVATE SKULL WHERE THE UNIFORMS RECORD
common_voice_en_19552537.mp3,THE PRINCE BISHOPS HOWEVER RETAINED THE RESTRICTION A BIT OF CATHEDRAL OF WILLIAMS INSIDE THE CITY
common_voice_en_25640420.mp3,HE IS CURRENTLY THE SHORTEST REIGNING MANAGER OF THE CLUB
common_voice_en_19552838.mp3,THE STATION WAS CLOSE TO THE TOWN'S CENTRE
common_voice_en_19547412.mp3,THE COMPANY BECAME BOTH EXTREMELY WELL KNOWN AND RESPECTED IN THE INDUSTRY
common_voice_en_30645528.mp3,BASIN SUPPORTED BRAIN INSTEAD
common_voice_en_18497005.mp3,I HAVE INDEED HAPPY OLD MAN
common_voice_en_27871096.mp3,EARTH SCIENCE AND ALL OF ITS BRANCHES ARE BRANCHES OF PHYSICAL SCIENCE
common_voice_en_27344686.mp3,CHEYENNE STUDIED AT SALON UNIVERSITY IN PARIS
common_voice_en_21203430.mp3,THEY ALSO PRODUCE CARD GAMES AND FAMILY GAMES
common_voice_en_21185568.mp3,HENCE TO FRIDGE THE TWO NAMES FOR THE OBJECT MUST HAVE A DIFFERENT SENSE
common_voice_en_30645538.mp3,HE ALSO DESIGNED AND PLANTED THE PRIVATE GARDENS
common_voice_en_21210095.mp3,DRONE US WAS BORN WITH A CLIPPED LIP UNDERGOING THREE CIGARIES WERE THEN HIS FIRST YEAR
common_voice_en_27871231.mp3,THE BOOKS ABOUT THE FRENCH REVOLUTION HAD FASCINATED HER
common_voice_en_19693149.mp3,NAPOLEON WHERE HE PLAYED FOR THE NEXT FOUR SEASONS
common_voice_en_18909376.mp3,THIS BOUNDARY IS STILL DISPUTED
common_voice_en_24569312.mp3,THIS CONSTITUENCY COVERS THE NORTHERN PART OF HULL
common_voice_en_26986049.mp3,I WAS PROUD OF YOU
common_voice_en_20167164.mp3,HE IS ALSO A MUSICIAN STRETCHING FROM THE GUITAR TO THE BENDER
common_voice_en_19511412.mp3,THE POPULATION IS EXPECTED TO CONTINUE DECREASING
common_voice_en_20029452.mp3,THEY MAINLY OFFERED LEGAL ADVICE TO JUDGES ON THE CASES BEING TRIED
common_voice_en_21185296.mp3,HE MOVED TO SAINT PETERBURG WHERE HE WAS ACTIVE AND LITERARY ENDEAVOURS
common_voice_en_24569298.mp3,THE WAKEFIELD BLINDNESS COLORED YELLOW ON MAPS AND PUBLICATIONS BY WEST YORKSHIRE METRO
common_voice_en_23846362.mp3,MIDDLE KETTLE ENDS FORM FIRE PHOTOGRAPHS SOME OF WHICH A POLYMERIC
common_voice_en_21208423.mp3,BESIDES THERE IS NO FEMALE SAINT AND CHRISTIANITY WITH THIS NAME
common_voice_en_21208411.mp3,OFTEN THE WRITER CAN ALSO RECAST THE SENTENCE TO AVOID IT
common_voice_en_19793978.mp3,BY THAT TIME HE HAD MARRIED CHANGEFULLY
