common_voice_en_18935390.mp3,THE SLEEP OF THE DEVELOPMENT OF VILLAGERS CENTERED AROUND LONG HOUSES
common_voice_en_18714496.mp3,ARISTOTLE COLONEL KENZAVAR SCYTHE AND OTHERS
common_voice_en_19005154.mp3,THERE ARE VARIOUS OBSCURE REFERENCES WITHIN THE SONGS SOME MORE LUCID THAN OTHERS
common_voice_en_27560840.mp3,PRESENTLY TWO MEN APPEARED BOWED BENEATH A GREAT WEIGHT
common_voice_en_26986211.mp3,THE CHARGES WERE EVENTUALLY DROPPED
common_voice_en_18893976.mp3,A TOILET BLOCK FORMERLY PROVIDED HAS BEEN DEMOLISHED
common_voice_en_19552428.mp3,ALGERIA AND SINGAPOLA ENJOYED CONSULTATIONS IN BASE ECONOMIC AND POLITICAL AREAS
common_voice_en_19852886.mp3,REUBEN'S ROLL WAS HIGH LIGHTED IN A PUBLIC BROADCASTING SERVICE FRONT LINE REPORT THE WARNING
common_voice_en_19867909.mp3,BY THAT JUDGE HIGH SCHOOL IS LOCATED IN HOLMESBURG
common_voice_en_18985460.mp3,THE PRESIDENT OF SYLVIA AND MONTEGRO WAS ELECTED BY THE PARLIAMENT
common_voice_en_20167501.mp3,THIS IS MISTER HAWKINS SHE SAID
common_voice_en_27871013.mp3,HE WAS BORN AND RAISED IN MODERN ITALY
common_voice_en_23893764.mp3,OTHER AGRICULTURAL CROPS ASH SHOULD DECAY SIMILAR COTTON TOMATOES AND CHILIS
common_voice_en_27269975.mp3,THE USAGE HAS ALSO EXTENDED TO BRETON AND CORNISH POETRY
common_voice_en_18985541.mp3,WITH ALEXANDER TEN LIMITED REPUBLICANS NOMINATED FORMER GOVERNOR WON'T FEEL DONE
common_voice_en_25639981.mp3,RIGHT COMPANY THE MANUFACTURER OF LINCOLN LOGS
common_voice_en_19743935.mp3,SEPARATED SHE EXCLAIMED WITH AN ACCENT OF INDIGNATION
common_voice_en_21206838.mp3,IN HAIGEE'S SICKENING GOVERNMENT FITZGERALD RETURNED TO THE POSITION OF MINISTER FOR LABOUR
common_voice_en_21494150.mp3,THE POPULATION CONSISTS OF MANY HUNTERS AND MUSLIMS AND VERY FEW CHRISTIAN SAILORS
common_voice_en_23846376.mp3,THE LARGEST GLACIERS AND BRIGITTETON NATIONAL FORESTS ARE FOUND IN THE WILDERNESS
common_voice_en_25353906.mp3,THE RAIN QUEEN WAS OFFERED IN ANNUAL GOVERNMENT CIVIL LIST
common_voice_en_21206782.mp3,THEIR UNPLACED HORSES INCLUDED SUB ZERO THE PHANTOM AND DRUM TAPS
common_voice_en_25354197.mp3,HE INSERTED ILLUSTRATIONS FOR RANDOM HOUSE PAPA AND ROB AND DOUBLE DAY
common_voice_en_20284779.mp3,ACCORDING TO KATE THE COUPLE LATER MARRIED IN VALDOSTER GEORGIA
common_voice_en_28853082.mp3,IN THE ENGLISH CIVIL WAR LICHFIELD WAS DIVIDED
common_voice_en_27560839.mp3,WHILE SUCCESSFUL THE COMPANY WAS ONLY A MINOR AUTOMOTIVE SUPPLIER
common_voice_en_21185392.mp3,THIS PERSUADED THEIR FOLLOWERS TO DETECT POISONTAINED CITIES SEIZING PRISONERS AND CATTLE
common_voice_en_18935340.mp3,WHEN IT HURTS SO BAD AS MUSICALLY OLD BRUTES ARE AGAIN MIXED WITH SALT
common_voice_en_19693384.mp3,AS A RESULT AND UNFIXED TO GET UP FOR PORTING STYLE WAS DEVELOPED
common_voice_en_18884688.mp3,THE AIRPORT IS LOCATED APPROXIMATELY THREE MILES NORTHEAST OF THE CENTRAL BUSINESS DISTANCE
common_voice_en_21162441.mp3,HOWEVER DUE TO THE PHYSICIAN THE ACCOMPANY'S STORE HAD TO TIGHTEN ITS BELT
common_voice_en_19852744.mp3,FOLLOWING WORLD WORE ONE MAIN CENTRAL BEGAN RETRACTING
common_voice_en_20167587.mp3,THAT BOY'S TUTOR
common_voice_en_20167098.mp3,FIJI HAS RATIFIED THE AGREEMENT FOR THE SUPPRESSION OF THE CIRCULATION OF OBSCENE PUBLICATIONS
common_voice_en_20032074.mp3,ALL OTHER SERVICES REMAIN UNDER A BALLOT WHICH ALSO RETAINS RESPONSIBILITY FOR THE STATION MANAGEMENT
common_voice_en_21203332.mp3,THIS INTELLIGENT SURPRISE REPORTABLY AFFLICTED TOBY'S CREDIBILITY WITH THE NIXON ADMINISTRATION
common_voice_en_21493938.mp3,USE CASES CAN BE FEUD ON THE TEN ESSAYS WHIPSIGHT
common_voice_en_19699940.mp3,HE WAS RELEASED IN THE FOLLOWING SUMMER
common_voice_en_19547556.mp3,HE WAS LATER ALLOWED BACK IN THE COUNTRY
common_voice_en_30645475.mp3,ONE SITTING MEMBER JOHN LUCAS DID NOT CONTEST THE ELECTION
common_voice_en_25641446.mp3,PRIOR TO HER DEATH SHE HAD BEEN LIVING AT A CHAIR HOME IN HOVE
common_voice_en_28467356.mp3,GUESS MORALITY DID NOT ENJOY GREAT SUCCESS THE NEXT SEASON
common_voice_en_21139166.mp3,CHRISTINE THEY WERE INCLUDED IN THE TOWNSHIP OF ACTON
common_voice_en_28852422.mp3,WE'VE ENJOYED OUR PARTNERSHIP WITH THE ARENA FOOTBALL LEAGUE
common_voice_en_21182928.mp3,PUBLISHED POETS WROTE OVER TWO THOUSAND POEMS ABOUT AND JOINED THE WAR
common_voice_en_20996253.mp3,IN NEW CLEAR REACTORS IT IS USED AS A MODERATOR FOR FAST NEUTRONS
common_voice_en_89116.mp3,I NEED TO ADD TO MY METAL CRASH COASTLESS THE MUSIC OF L SEXTO CENTITO
common_voice_en_18884163.mp3,THE NORTH SEA RACE IS A YACHT RACE WHICH TAKES PLACE ANNUALLY
common_voice_en_18893935.mp3,HOWEVER WHEN CLEAR CATTLE BEGAN REPLACING SELECTED LOGGING SIDINGS OF THE SPECIES GREW SCARCE
common_voice_en_19846666.mp3,THIS IS WHERE OUR LIMITS BATTLE BEGINS AGAINST SEXISM
common_voice_en_19744542.mp3,HE IS A GRADUATE OF THE AIR BORN AND EAR ASSAULT SCHOOLS
common_voice_en_19868021.mp3,AT A QUARTER TO ELEVEN SHE WAS HEARD RAKING THE FIRE
common_voice_en_25640029.mp3,A FERRY CONNECTED THE TWO BANKS OF THE ALCORN RIVER NEAR FREMONT
common_voice_en_21206812.mp3,THE INTIMATE PROGRAMME IS OFTEN CONSIDERED THE FIRST SITUATION COMEDY
common_voice_en_19519450.mp3,EDITH'S FATHER A MASSA A REDFIELD WAS A NEW YORK ATTORNEY AND AUTHOR
common_voice_en_21185434.mp3,NO ONE LOCALLY AS THE DEUCE IT IS A POPULAR WATER IN HORROR
common_voice_en_25640551.mp3,HOWEVER ITS FIGURATIVE CONNOTATIONS MAKE IT INAPPROPRIATE AS A GENERAL TRANSLATION
common_voice_en_18893604.mp3,SHORTLY THEREAFTER BEGS WAS RAISED FROM HIS CONTRACT AND LEFT THE WRESTLING BUSINESS
common_voice_en_21210162.mp3,IT WAS REVEALED THAT MURRAY HAD SEEN THIS COMING AND WAS THRILLED BY IT
common_voice_en_22758621.mp3,A SMALL SECTION OF THE CITY IS PART OF THE WESTERN WILSONVILLE SCHOOL DISTRICT
common_voice_en_19547886.mp3,SIMILAR HOISTS SUPPLIED AMMUNITION TO THE SHIP'S TWIN AND TRIPLE TURRETS
common_voice_en_21162476.mp3,THE REMAINING DEPOSITS CONSISTED OF THE ALLUVIAL MATERIALS MENTIONED ABOVE
common_voice_en_20176987.mp3,ACHIEVEMENTS AND HORROR AFFECTION ARE RECOGNIZED BY NUMEROUS AWARDS
common_voice_en_19744540.mp3,THIS CITATION DESCRIBED HIM IS AN INDEFATIGABLE CAMPAIGNER CONSTANT ATTENDER AND INDEPENDENT MINDED
common_voice_en_19946623.mp3,YOU KNOW CIVIL FORTRESSES AND CASTLES BUILT OUT THE NEW CAPITAL
common_voice_en_27270591.mp3,THE MOHEGANS HAD BECOME A REGIONAL POWER
common_voice_en_22214346.mp3,THE NEWSPAPER HAS FIVE PRINTING PLANTS LOCATED THROUGHOUT SARAWAK AND SABBATH
common_voice_en_18967321.mp3,NATIONAL BANK'S BUSINESS IS CONCENTRATED TO THE QUEBEC AND IT IS EXPANDING ON OTHER PROVINCES
common_voice_en_22749683.mp3,THE BLEAR ENDS WITH HER BACK ON THE COAST AT NIGHT
common_voice_en_27284783.mp3,RECENT SPECIAL EXHIBITS HAVE INCLUDED MUMMIES AND TERROR SOURCE
common_voice_en_20029444.mp3,HAMMER GOES TO HIS RELATIVELY LARGE HOUSE PRETENDING TO BE A REPORTER
common_voice_en_21162451.mp3,HE SET IN OPPOSITION FOR THE REMAINDER OF HIS TIME IN THE RELIGIOUS PLACER
common_voice_en_21182047.mp3,DURING THE CIVIL WAR VIRGINIA'S STATE HOUSE ALSO IN RICHMOND HOUSED OFFICERS OF THE CONFEDERACY
common_voice_en_27284704.mp3,FAMILY WASN'T ATTENDED TO SAVE A CONTEMPORARY TRADITIONAL FAMILY WITH REALISTIC BELIEVABLE CHARACTERS
common_voice_en_27344684.mp3,DAINNY WILLIAMS IS NOW IN A TENT PASTE BAND AND CALLED ALLAYED
common_voice_en_19606951.mp3,COUPLED WITH THE DEMOCRATIC HABITS OF THE ROUND HEATS THE RESULT WAS FIASCO
common_voice_en_21185466.mp3,THE NEW BAND WAS RENAMED RUCKY ERICSSON AND THE ALIENS
common_voice_en_27637831.mp3,CROATIA IS A MAJOR TOURIST'S CENTRE
common_voice_en_22708458.mp3,THIS IN TURN CONTRIBUTES TO THE SPREAD OF THE FUNGUS TO UNINFECTED PLANTS
common_voice_en_21203248.mp3,I TELL YOU I WANT NO MORE OF IT
common_voice_en_19946704.mp3,NOW AND IT'S THEY'RE PLIED TOGETHER IN THE GRIP PAPA JOHN
common_voice_en_25640297.mp3,ALSO ITS CAM SHAFT IS DRIVEN BY A CHAIN INSTEAD OF A BELT
common_voice_en_21183377.mp3,AFTER A LENGTHY DEBATE THE COUNCIL DECIDED UPON DESTROYING THE RING
common_voice_en_20288436.mp3,THE GREEDY AROUND THE PARK HAS MADE IT A SEVERE HAUNT OF PICNICERS
common_voice_en_20196314.mp3,THE NAME T E R A Z AHINI IS USED IN THE NOMENCLATURE OF DERIVATIVES OF THIS COMPARISON
common_voice_en_18890760.mp3,LANE THEN PULLED OUTWARD OUT OF THE BATH TUB AND UNDRESSED HER
common_voice_en_21139296.mp3,SAXON'S PERSONAL PAPERS ARE STORED AT THE STRONG AND RUSSIA'S AND NEW YORK
common_voice_en_18890751.mp3,THE MAJOR DISTRIBUTORS OF RUBBER TAKE MERCHANDISE FOR SEVERAL YEARS
common_voice_en_18884756.mp3,THE CAUCASUS ARE GENERALLY DEFINED AS GATHERINGS OF NEIGHBOURS
common_voice_en_18884683.mp3,INSTEAD LUTHER BANDROSS SANG THE THEME HEART OF A HERO
common_voice_en_25040777.mp3,ITS ARCHITECTS HAVE BENEFITED FROM NATURAL MOUNTAINOUS REACHES IN THE CONSTRUCTION OF THE FORT
common_voice_en_21139165.mp3,IT IS PREDOMINANTLY FOUND IN INDIA NAPO AND THE DIOSPHORA OF THESE COUNTRIES
common_voice_en_25358036.mp3,THE TOWN ALSO HAS SAID FROM ART GALLERIES AND A SKULL OF ENGLISH
common_voice_en_21494088.mp3,THE VILLAGE OF WARR KNOCKER IS IN THE EASTERN PART OF TOWN
common_voice_en_19852742.mp3,SEVERAL STATUES ARE FOUND OF THIS CREATURE IN YOUNG YOUNG THE CAPITAL OF NORTH CAREER
common_voice_en_19853796.mp3,SUCH CASES WERE DEALT WITH BY ENCLOSING THE CONTENT WITHIN COMMENT BLOCKS
common_voice_en_23893825.mp3,THUS AS THEY SAY WAS JUST THE BEGINNING
common_voice_en_23893415.mp3,THE DEPARTMENT LAUNCHED AN URGENT INQUIRY INTO THE REPORTS
common_voice_en_20166901.mp3,IN THE MAGIC OF THE REBUILDING AND RECOVERY AS A NEW BEARER'S WATER TOWER
common_voice_en_18893589.mp3,A PROPER USE OF THIS SAYS MAN FROM FAILING TO THE TRAP OF MAIA
common_voice_en_18900790.mp3,IT IS BORDERED TO THE NORTH BY ITS TWIN CITY OF COPYHOLD AND SEE
common_voice_en_27871249.mp3,IT DIFFERS FROM INDUCTIVE REASONING AND ABDUCTIVE REASONING
common_voice_en_18893938.mp3,THE PRIMARY VERTICAL MOTION IS UPWARD
common_voice_en_21159834.mp3,WE'RE THE MESSORI VOLUNTEERS
common_voice_en_27637480.mp3,UPON HIS ARRIVAL IN INDIA CREPT HOW TALKS WITH INDIAN LEADERS
common_voice_en_19547559.mp3,A STONE AND THE TWO YARDS SOMETIMES POINTED OUT IS BURYING THE DEVIL'S FOOTPRINT
common_voice_en_18896498.mp3,SPEED IS CRUCIAL MISS MAGDA AND LIGHT AND BLAME
common_voice_en_27292380.mp3,AFTER HIS DEATH A STATUE THUNDERED BY PUBLIC SUBSCRIPTION WAS ERECTED IN LONE FONTAINE
common_voice_en_19852647.mp3,HE SAID A LOST ENGINEER'S COLISEUM RECORD OF BLOCKING FOUR KICKS AND ONE GAME
common_voice_en_21183325.mp3,THE GROWTH OF THE MUD SLEIGH LED TO AN UNGOING BUILDING PROGRAMME
common_voice_en_21185483.mp3,AT SIXTEEN YEARS OF AGE HE WAS WORKING AS A MATHEMATICAL INSTRUMENT MAKER
common_voice_en_19547616.mp3,MALLOW FOLLOWED HIM INTO RETIREMENT
common_voice_en_21162457.mp3,IT CAN BE PUSHED AND TUGGED WHILE MOLTEN TO CREATE SYMPHONY FIXED
common_voice_en_22443931.mp3,THE DEEDS ARE NEAR A FAMILY OF INSTRUMENTS IS NAMED AFTER IT
common_voice_en_19744945.mp3,IT IS BETWEEN THE TOWNS OF BON ACCORD AND LOWLANDS
common_voice_en_19693234.mp3,PELIAS WAS PRESIDING OVER A SACRIFICE TO POSEIDON WITH SEVERAL NEIGHBOURING KINGS AND ATTENDANTS
common_voice_en_21139531.mp3,THE ENTIRE VILLAGE OF MANNAE IS PART OF THE INFANTRY OF SWISSHERITED SITES
common_voice_en_19547510.mp3,THE NEXT DAY MAGNIA AGAIN HAD TROUBLE
common_voice_en_21208385.mp3,HE WAS ALSO THE DRUMMER FOR RHINO BUCKET
common_voice_en_19547619.mp3,MC GEE GUARANTEED TO MAKE THE INJURED HAND A ONE HUNDRED PER CENT GOOD HAND
common_voice_en_21207992.mp3,THE GRAMMATICAL NUMBER OF SUCH CONSTRACTS IS OFTEN PRAYER OR DIO
common_voice_en_19547530.mp3,MAC DONALD'S COURIER BEGAN WASHER'S WORKING AS A BALMATE AND GLASGOW
common_voice_en_21182927.mp3,LARGE PILLARS WITH DECORATIVE SPIRES SUPPORT LARGE HIND SKATES
common_voice_en_18884160.mp3,HOCKLEY LIES ADJACENT TO THE LACE MARKET MANY WELL PRESERVED VICTORIAN BUILDINGS
common_voice_en_20999720.mp3,HIS WORKS ARE INSPIRED BY JOHN SINGER SERGEANT AND FRANK PRESIDENT
common_voice_en_21162460.mp3,WESTERN WAS EDUCATED AT THE WESTMINSTER SCORE
common_voice_en_20999590.mp3,WHETHER THE FIRST SHOT CAME FROM BOAT OR DARK WAS NEVER DETERMINED
common_voice_en_20999721.mp3,HE PRESENTED GALLERY SHOWINGS ACROSS THE UNITED STATES
common_voice_en_19867291.mp3,HOWEVER HE WAS RELEASED BEFORE COMPLETING ONE YEAR IN JAIL DUE TO ILL HEALTH
common_voice_en_23893773.mp3,THAT EPISODES WERE FILMED AROUND SCOTLAND INCLUDING AND SIGHED EAST KILLED BY HIS SHOPPING CENTRE
common_voice_en_20031266.mp3,PHELAN REVEALED HIS ATTACHMENT TO BEAT THE AGER BLUNDERBORE AND HIS LAST BREATH
common_voice_en_23893585.mp3,IT IS ALSO CLOSE TO BOTH THE HILTON AND MARRIOTT HOTELS
common_voice_en_19548002.mp3,THE TRAIL WAS ON THE FORMER ROAD BED OF THE CHICAGO AND NORTH WESTERN RAILWAY
common_voice_en_25640176.mp3,ACCORDING TO SOME RESEARCH THERE IS A HIERARCHY FOR PARANOIA
common_voice_en_19693017.mp3,THE TRAFFIC ON THIS NETWORK CAN BE MOUNTED BY CIVILIZED SITES
common_voice_en_18714569.mp3,LATE IN LIFE HE BECAME A MEMBER OF THE NATIONAL ACADEMY OF DESIGN
common_voice_en_24949178.mp3,HE WAS PARTICULARLY NOTED FOR HIS WORK ON PROTECTING THE NATURAL ENVIRONMENT
common_voice_en_21493936.mp3,ONE OF THESE IS REDUCED TO THE ORIGINAL CONTACT BY MORAL SYMMETRY
common_voice_en_23566578.mp3,AFTER LATER INVASION BY THE DOLPHS THE REGION CHANGED HANDS MANY TIMES
common_voice_en_25358017.mp3,JIM'S SUICIDAL THOUGHTS TURNED AROUND AND TO A NEW PURPOSE TO RESCUE DENNY
common_voice_en_20288489.mp3,D'ARTAGNAN IMMEDIATELY CROSSED TO BOBBY
common_voice_en_25359087.mp3,THE FAMOUS AMERICAN POET WILLIAM CULLEN BRYANT ALSO GAVE LECTURES
common_voice_en_18909347.mp3,SOME SPECIES HAVE ALSO BECOME IMPORTANT AS LABORATORY ANIMALS
common_voice_en_21162475.mp3,ALGON THE SICKENED HIGHEST MOUNTAIN AND THE REPUBLIC OF KENYA
common_voice_en_19867882.mp3,THE LARVAS BURIED HIM THEN KEPT THE KEY LIKE DEVICE THAT WOULD ACTIVATE WAR WORLD HIDDEN
common_voice_en_27270467.mp3,AT LEOTA'S ARGUING HELL ENTERED ALCOHOL REABILITATION TWO DAYS AFTER THE SHOOT
common_voice_en_648166.mp3,IT NEVER RAISED BUT IT FORCE
common_voice_en_23893353.mp3,THE SHIP CANAL BRIDGE CARRIES IT OVER A PORTAGE BAY AND SEATTLE
common_voice_en_19550931.mp3,HE STUDIED EXTENSIVELY AT THE CITY'S AMERICAN CONSERVATORY THEATRE
common_voice_en_19867849.mp3,A TEMPORARY CORNERSTONE WAS LAID BY THE END OF THE EARTH
common_voice_en_25640068.mp3,IT WAS THEN REMODELLED BY JAMES OF SAINT GEORGE
common_voice_en_27344744.mp3,MISTER MALLIN WAS DRUNK AS USUAL AND DENIED THE FACT
common_voice_en_25640579.mp3,ITS ROOT BEGINS IN THE NETHERLANDS AND ENDS IN FRANCE BY A BELGIUM
common_voice_en_19946696.mp3,DEALING WITH HYPNOTISTS
common_voice_en_19519468.mp3,LIVE STOCK RANCHING IS THE PRIMARY INDUSTRY IN THE SURROUNDING AREA
common_voice_en_22749677.mp3,TO DAY THERE IS A VERY LIMITED LATE EVENING SERVICE PROVIDED BY SOUTHWEST TRAINS
common_voice_en_28852451.mp3,THE GEOGRAPHOLOGY OF THE MEANDER SOUTH OF AXMINSTER IS THE PARTICULAR GEOLOGICAL INTEREST
common_voice_en_21162469.mp3,COMPETITIVE AUCTIONS DETERMINE THE STUMPAGE FEES TO BE PAID
common_voice_en_19550971.mp3,THIS MANGER STORY IS FAITHFUL TO THEIR ORIGINAL POSSIBLY MORE FAITHFUL THAN THE ENEMY
common_voice_en_19946555.mp3,THE COUNT'S MAIL FOR AFRAID OF THE WELCOME PEOPLE
common_voice_en_25358076.mp3,STATION WAS INNOCENTLY PLANNED AS THE TRADITIONAL DEEP PILOT TYPE
common_voice_en_18985540.mp3,AFTER ENTERING JAPANESE OCCUPIED CHINA WANG WAS BRIEFLY IMPRISONED BY THE JAPANESE BUT WAS RELEASED
common_voice_en_21230372.mp3,THE TEXTILE BASED ECONOMY FLORENCE UNDER THE FRENCH
common_voice_en_28853270.mp3,THE ADENOID IS OFTEN REMOVED ALONG WITH THE PALATINE COUNCILS
common_voice_en_19547447.mp3,HE HAS BEEN ABDUCTED AND THE WHOLE OF FAME OF THE PIERRE FUTURE ACADEMY
common_voice_en_21182844.mp3,THEY ALSO APPEAR IN THE NOVEL WOOLLY BY ANNA ELIZABETH
common_voice_en_27870677.mp3,SHE DID NOT GRADUATE FROM EITHER SCHOOL
common_voice_en_18714526.mp3,OTHERS ELECTED OFFICIALS INCLUDED CLERK TREASURER SHERIFF SESSOR AND PROSECUTOR
common_voice_en_19562761.mp3,THEY CONTINUED TO PERFORM LIFE TO DAY
common_voice_en_21230337.mp3,HIS FAMILY LATER MOVED TO THE VILLAGE OF THE THEATRE
common_voice_en_18900784.mp3,THE THREE DISTRICT EDUCATION OFFICERS SERVE UNDER THE CHEAP EDUCATION OFFICER
common_voice_en_28852580.mp3,AS A RESULT TO DAY THE RAILROAD POOL IS SIGNIFICANTLY SMALLER THAN AT ITS PEAK
common_voice_en_19946509.mp3,BOBBY BURY IT WAS MARRIED TO RUINDA BE BURIED
common_voice_en_25640108.mp3,THESE WERE NOT ORGANIZED PUBLIC EVENTS
common_voice_en_19552149.mp3,GROUPS AND OTHERS SUPPORT SIZE ON THE INTIMATE
common_voice_en_27344552.mp3,HE WAS A SCHOLAR OF ITALIAN RENAISSANCE AWE
common_voice_en_19677449.mp3,PALMERSTON'S ELEVATION IS ABOVE SEA LEVEL
common_voice_en_18884677.mp3,THE SCORE WAS CURRENTLY AIMING TO BECOME A DESCRIPTION OF FRIENDLY SCHOOL
common_voice_en_19793965.mp3,VINCENT WAS BORN UNTO LOUISE AND GORE
common_voice_en_21139243.mp3,THE ONLY THING BURNE SEIZES MAMMA
common_voice_en_27871389.mp3,MC PHELAN REVOLUTIONIZED SPITE A MAN'S LOOK
common_voice_en_18896538.mp3,THE NEW ZEALAND CORDIA NETWORK A SPACE PRIMARILY ON DJAGALMARKWIFE TECHNOLOGY
common_voice_en_20031922.mp3,AN END AIN'T THAT MISTER CRICKET'S AH HERE MAIDEN'S NAME PLAYING FOR BUT ODDER
common_voice_en_19962363.mp3,HE SUFFERED CONCUSSION AND LOST MOST OF HIS RIGHT HAND
common_voice_en_21207720.mp3,THE AIRPORT IS ABOUT HALF WAY BETWEEN HARTFORD AND SPRINGFIELD
common_voice_en_19519447.mp3,MODERN DEMOCRACY BUILDS ON SUCH PARTICIPATION OF THE PEOPLE AND MEDIA
common_voice_en_23893683.mp3,SAGOT EARNED TWO KEPS FOR ENGLAND
common_voice_en_30645522.mp3,THE FIRST CHILD BORN IN THE SETTLEMENT WAS NAMED CHRISTOPHER BRYANT JUNIOR
common_voice_en_19519431.mp3,THE PROPOSED TITLE WAS CHANGED TO TAKE A POPE
common_voice_en_19744102.mp3,TABOR ALSO VOICES LAURIE LOUD ON THE LOUD HOUSE
common_voice_en_21210052.mp3,HORNS ARE DISTINCT TO ANTLERS WHICH ARE NOT PERMANENT
common_voice_en_23912006.mp3,AREA RESTAURANTS COMPETE FOR LOCAL BRAGGING WRIGHTS FOR HAVING THE BEASTS AREA CLIMBED CHILDHOOD
common_voice_en_19793976.mp3,THESE PARTNERSHIPS PROVIDE MOST BUT NOT ALL OF THE RIGHTS OF MARRIAGE
common_voice_en_21210132.mp3,THE SAMPLE HAS BEEN UPSETTED TO YE TUBE
common_voice_en_21208413.mp3,VARIOUS COMPETING THEORIES OF THE PHRASES ORIGIN FOLLOW
common_voice_en_19867622.mp3,MARTINO ALSO HAD A TRIAL AT LEAST UNITED
common_voice_en_19853478.mp3,SIGN LANGUAGES FALL IN THIS CATEGORY
common_voice_en_25640850.mp3,THE AMPHIBIANS OF INDIA SHOW A HIGH LEVEL OF INDAMISM
common_voice_en_19547423.mp3,THE FAMILY SEAT IS MAINTAINED THEIR DANCE DE QUOTSHIRE
common_voice_en_18567523.mp3,IT'S SOMETIMES FASTER TO USE MORTAL THREE DAY PRINTERS
common_voice_en_25040771.mp3,AFRAID TO REVEAL THAT CHECKED PAST SHE DOES NOT ANSWER IMMEDIATELY
common_voice_en_19034549.mp3,A KEYBOARD WITH TRACK BOWL AS THE EMPEROR DEVICE FOR OPERATION OF THE SYSTEM
common_voice_en_21185627.mp3,IT IS AN INFLOWING INSTRUMENT OF SIX TOP HALLS AND ONE BOTTOM HALL
common_voice_en_21159885.mp3,THE WHITE HART IS A LONG SENDING HUB ON CHASE RHODE NEAR SELF GATE CIRCUS ROUND ABOUT
common_voice_en_25640858.mp3,THE GROUP IS OFTEN REFERRED TO AS THE OTHER MOOSE AFFECTION
common_voice_en_21209837.mp3,ITS BOX IS MADE OF WOOD BUT ITS INTERNAL ELEMENTS A MAN OF METAL
common_voice_en_19573603.mp3,THEY ALSO ADVOCATE EXPENDING THE PUBLIC SYMPATHY WITH NECESSITY OF LARGE MULTI NATIONAL CORPORATIONS
common_voice_en_31289370.mp3,HE TOPPED FOUR TEAMS OF EACH GROUP ADVANCED TO THE SECOND STAGE
common_voice_en_18935244.mp3,SOME LASTED SEVERAL YEARS AND APPEARED IN SUBSEQUENT SERIES
common_voice_en_20167622.mp3,CURRENT AGENTINA IS KEEPING A LARD PATRIOT AT RAISING A FAMILY
common_voice_en_21208379.mp3,IRON AGE INDIA ENTERS THE LATTER VERDICT COURAGE
common_voice_en_25353913.mp3,THE DISTILLERY USED AS MALTA BAILEY'S SOURCE FROM THE MALTINGS AND PORT ALLAN
common_voice_en_21207923.mp3,EACH VERSE IS FIERCELY ARTICULATED AND REGULAR FRENCH BEEN TRANSLATED AND SLANG
common_voice_en_19519454.mp3,RE BALANCE THE TREE IF NEEDED
common_voice_en_19744493.mp3,ROBERT WAS BORN IN NORMANDY A HALF BROTHER OF WILLIAM THE CONQUEROR
common_voice_en_19519444.mp3,THE DOG SUBSEQUENTLY RETRIEVED THE HEIGHT AND GIVEN ITS NAME
common_voice_en_23830007.mp3,GAY WAS MARRIED TO BEVERLY GOING
common_voice_en_18884769.mp3,THE UNIVERSITY OF SOUTH FLORIDA WON BOTH
common_voice_en_22758689.mp3,I KEPT THINKING OF THOSE CLEAN CUT YOUNG AMERICAN GUARDS AT ABU GRAVE
common_voice_en_18714538.mp3,LEAR IS A WELL KNOWN KNIGHT LIFE CENTRE IN FLANDERS
common_voice_en_21493994.mp3,A COMPARABLE NUMBER OF FAMILIES ALSO MOVED TO AUSTRALIA CANADA AND THE UNITED STATES
common_voice_en_25359155.mp3,THIS UNDERSTANDING OF HOW THEY WERE A PRIEST WAS A FOCUS OF HIS NOVELS
common_voice_en_22758596.mp3,ALL THE FACULTIES OF HER UNDERGRADUATE AND GRADUATE DEGREES
common_voice_en_25641178.mp3,ARROW THE ACROBAT WORKS AND LIVES IN THE WORLD OF AMUSEMENT CIRCUS AND FUN PARK
common_voice_en_23830017.mp3,DISCOVERED THE ISLAND WAS NAMED FOR HIM BY CHAIN ISLAND
common_voice_en_19744378.mp3,THIS ONE IS THE DEITY WHO SEES AND KNOWS ALL THINGS
common_voice_en_27344743.mp3,THE MECHANISM WORKS RELIABLY BUT SOMETIMES SMALL INCIDENTS OCCUR
common_voice_en_21185592.mp3,HELL'S MOTION TO USE A FERMENT OF DEFENCE OF JUSTIFICATION WAS DENIED
common_voice_en_20999602.mp3,THE ELDEST SYDNEY CAN WAS A FAMOUS AIRCRAFT DESIGNER
common_voice_en_27269987.mp3,DEAR CREEK RESERVOIR IS THE MAIN FEATURE OF DARE CREEK STATE PARK
common_voice_en_19547689.mp3,AN EXCEPTION WAS LATER MADE FOR THE SHERIFF OF LONDON'S CHARITY SHIELD
common_voice_en_18893592.mp3,WARMING CENTRES TYPICALLY OPEN DURING PARTICULARLY COLD OR RAINY NIGHTS
common_voice_en_23893347.mp3,ZARRIA IS A WILD HERO TO SLIGHT YOU TOO IT'S A STARK MINING ACTIVITIES
common_voice_en_19852733.mp3,THE SEAL IS BENEATH APARRITIC PACKAGE OF ROCKS INCLUDING IN PERMEAL AND HYDRATE
common_voice_en_20167832.mp3,IT IS I OUT OF THE CASTLE CITY SCOLDER STRICT
common_voice_en_23893368.mp3,HE HAD ORDERS TO SECURE THE WATER'S SUPPLY AT WARRIA
common_voice_en_26985738.mp3,THE TRIP WAS SO SUCCESSFUL THE GUNS CONTINUED THE TRADITION FOR TWELVE YEARS
common_voice_en_21209797.mp3,ACORN REFERS TO A FICTITIOUS TOWN SOMEWHERE AND ISOLATED WITH TEXAS
common_voice_en_19519459.mp3,THIS LASS IS HARDLY ALL INCLUSIVE
common_voice_en_18893834.mp3,TURKEY DISTRICT WAS DISSOLVED AS A RESULT OF THE MERGER
common_voice_en_19573613.mp3,MOORLAND HILLS IS PRIMARILY SERVED BY THE IRON CITY SCHOOL SYSTEM
common_voice_en_19717576.mp3,THREE MONTHS AFTER HIS BIRTH THE FAMILY MOVED TO BRUGES
common_voice_en_26986071.mp3,MOST CARTRIDGE BASED CONCERT SYSTEMS DID NOT HAVE MUD CHIPS PRODUCED FOR THEM
common_voice_en_28853398.mp3,MORE GENERALLY A NAUTILIAN SCHEME IS A NECTARIAN TOPOLOGICAL SPACE
common_voice_en_25380106.mp3,BOTH THE MANAGER AND THE CLUB SEEKER TERRY OPPOSED THE CHANGE
common_voice_en_21185572.mp3,THIS COLLECTION EVENTUALLY CAUGHT THE ATTENTION OF A COLLEGE RADIO STATION AND ORLANDO FLORIDA
common_voice_en_22443828.mp3,IT ALLOWED USES TO CREATE PUBLIC CHAT ROBES SEND PRIVATE MESSAGES AND USE A MONOCONS
common_voice_en_21185372.mp3,THE CONDITION OF THE FACILITY HELP LAID TO THE SOUTHERN CONFERENCE'S DEPARTURE
common_voice_en_25640613.mp3,HIS ACCOUNTING ABILITIES ALSO AIDED IN THE SYSTEM OF FINANCIAL POLICY WITHIN THE GRANGE
common_voice_en_20166647.mp3,A PUPILLARY DEFEAT MAY BE RESOLUTE IN THE ACUTE STAGE AS WELL
common_voice_en_23893665.mp3,DETAILS ARE GIVEN BALLAR
common_voice_en_20176985.mp3,CORNET PUT THE JUGULAR MONSIEUR ON HIS NAME AS A PLAY OF HIS PHYSIQUE
common_voice_en_18838394.mp3,APRIL CHUTTLEGASSES HOWEVER ARE HIGHLY DEVELOPED INCONVENIENT FRAIL TRAVELLERS
common_voice_en_19553053.mp3,FOR EXAMPLE HE TRANSLATES SIMPLE STORIES BY PUSHKIN INTO ACETIC
common_voice_en_23893748.mp3,THE NEW CLEAR ARMS RICE SHIFTED INTO HIGH GEAR
common_voice_en_18985470.mp3,TOMMY BURNED THE BASE FROM THE WRECK FIRST
common_voice_en_21210055.mp3,AFTER SUBSTANTIAL CRIPPED ANALYSIS THE AGREADUM IS CONSIDERED BROKEN
common_voice_en_20029443.mp3,HATMAN AND LONDON LEAD THE SHATTERED CIVIL YEARS OF SUCCESS
common_voice_en_27637765.mp3,THE MEN'S BASKETBALL TEAM WAS COACHED FOR MANY YEARS BY LANGUAGE
common_voice_en_23767417.mp3,IT CONSISTS OF MEADOWS A SMALL PEAT BOG AND MIXED DECIDUOUS FOREST
common_voice_en_25640062.mp3,TROTTON WAS POPULAR WITH BOTH THE PRODUCTION TEAM AND HIS COAST HOURS
common_voice_en_19567935.mp3,JOHN DEEPENED BAKER REPORTABLY LOATHED STEVENS OVER THE ESSAY
common_voice_en_20167339.mp3,MOUNT PEARL'S SOUTH HAS SEEN AN EXPANSION AND BIG BOX RATE TOLD OTHERS AND RECENT YEARS
common_voice_en_18893505.mp3,MINORITY GROUPS MAKE UP APPROXIMATELY ONE FOURTH OF THE STUDENT BODY
common_voice_en_25640849.mp3,THE BOOK HAS BEEN WIDELY REVIEWED IN JOURNALS
common_voice_en_20049244.mp3,SALT AND SOUR RECEPTORS ARE CHEMICALLY GAITED IRON CHANNELS WHICH DEPOLARIZE THE CELL
common_voice_en_19519475.mp3,CISCO'S POSITION MAY HAVE BEEN DUE TO THEIR LAWSUIT WITH ALCOHOL
common_voice_en_18985547.mp3,IT IS A POPULATION HEALTH STRATEGY AS WELL AS AN APPROACH TO PERSONAL HEALTH
common_voice_en_18893556.mp3,MANUFACTURED RACE MAY BE MADE OF SYNTHETIC FIBRE
common_voice_en_19905202.mp3,ITS COUNTY SEAT IS ASHLAND CITY
common_voice_en_21507083.mp3,MESSY SIGNED IT TO THE TWO SQUADRON GROOTS THE CORNER AND IN A REPAY
common_voice_en_18985446.mp3,MOST SPECIES HAVE AT LEAST TWO TYPES OF CALL THE LOUD SONG AND THE SOFT SONG
common_voice_en_19552186.mp3,SIMON WAS LAUNCHED AS A CANDIDATE AND THE CONSTITUENCY OF HASHY APPLE AND PUDDINGSHIRE
common_voice_en_19573620.mp3,SINCE THE TOWN PLACES WHIST THE SUNSETS ARE VISIBLE AND ARE SOMETIMES BEAUTIFUL
common_voice_en_23893312.mp3,HYSTERICALLY THE NEIGHBOURHOOD RIVER DIVIDES EAST PRUSSIA AND WEST PRUSSIA
common_voice_en_21209869.mp3,SEASON ONE WAS THE ONLY SEASON AVAILABLE TO WATCH OUR NETFOLKS
common_voice_en_19852665.mp3,SUTRA WAS BORN AND OFTEN GERMANY
common_voice_en_25358065.mp3,CLUBBING MAY OCCUR DUE TO LIMITATIONS AND THE POWER SUPPLY OR THE UPWARD STAGE
